### ISSUE TITLE
The tcp connection over localhost was disconnected unexpectedly by wsl.

### ISSUE THREAD

**Issue by pikadun** [microsoft/WSL#7979]
### Version

Microsoft Windows [Version 10.0.22000.434]

### WSL Version

- [X] WSL 2
- [ ] WSL 1

### Kernel Version

5.10.81.1

### Distro Version

Ubuntu 20.04

### Repro Steps

I have some http services running on `wsl`.
When I first request these services from localhost on Windows everything works fine, and after a few seconds I keep getting no response when I request it again.

I tried to find the cause of the problem by capturing packets with `tcpdump -i lo port 80`, and found that wsl has not received the keep alive packet for a while and then disconnected the tcp connection, and the `fin` command sent by wsl is acked, but the client does not receive the `fin` command

### Expected Behavior

The client can correctly respond to the `fin` command and disconnect the tcp connection

### Actual Behavior

WSL disconnects the tcp connection, but the client does not know that the connection has been disconnected, and the next http request is still sent through this tcp connection.

### Diagnostic Logs

+ server tcp packets
```log
10:25:27.772919 IP6 ip6-localhost.47354 > ip6-localhost.http: Flags [S], seq 2842385603, win 65476, options [mss 65476,sackOK,TS val 4043027962 ecr 0,nop,wscale 7], length 0
10:25:27.772933 IP6 ip6-localhost.http > ip6-localhost.47354: Flags [S.], seq 1551043929, ack 2842385604, win 65464, options [mss 65476,sackOK,TS val 4043027962 ecr 4043027962,nop,wscale 7], length 0
10:25:27.772944 IP6 ip6-localhost.47354 > ip6-localhost.http: Flags [.], ack 1, win 512, options [nop,nop,TS val 4043027962 ecr 4043027962], length 0
10:25:27.773000 IP6 ip6-localhost.47354 > ip6-localhost.http: Flags [P.], seq 1:544, ack 1, win 512, options [nop,nop,TS val 4043027962 ecr 4043027962], length 543: HTTP: GET / HTTP/1.1
10:25:27.773006 IP6 ip6-localhost.http > ip6-localhost.47354: Flags [.], ack 544, win 508, options [nop,nop,TS val 4043027962 ecr 4043027962], length 0
10:25:27.776760 IP6 ip6-localhost.http > ip6-localhost.47354: Flags [P.], seq 1:263, ack 544, win 512, options [nop,nop,TS val 4043027966 ecr 4043027962], length 262: HTTP: HTTP/1.1 401 Unauthorized
10:25:27.776791 IP6 ip6-localhost.47354 > ip6-localhost.http: Flags [.], ack 263, win 510, options [nop,nop,TS val 4043027966 ecr 4043027966], length 0

10:25:32.782204 IP6 ip6-localhost.http > ip6-localhost.47354: Flags [F.], seq 263, ack 544, win 512, options [nop,nop,TS val 4043032971 ecr 4043027966], length 0
10:25:32.782382 IP6 ip6-localhost.47354 > ip6-localhost.http: Flags [F.], seq 544, ack 264, win 512, options [nop,nop,TS val 4043032971 ecr 4043032971], length 0
10:25:32.782557 IP6 ip6-localhost.http > ip6-localhost.47354: Flags [.], ack 545, win 512, options [nop,nop,TS val 4043032972 ecr 4043032971], length 0
```

+ client tcp packets
```log
No.	Time	Source	Destination	Protocol	Length	Info
39	3.553559	::1	::1	TCP	76	51523 → 80 [SYN] Seq=0 Win=65535 Len=0 MSS=65475 WS=256 SACK_PERM=1
40	3.553613	::1	::1	TCP	76	80 → 51523 [SYN, ACK] Seq=0 Ack=1 Win=65535 Len=0 MSS=65475 WS=256 SACK_PERM=1
41	3.553630	::1	::1	TCP	64	51523 → 80 [ACK] Seq=1 Ack=1 Win=327168 Len=0
42	3.553852	::1	::1	HTTP	607	GET / HTTP/1.1 
43	3.553863	::1	::1	TCP	64	80 → 51523 [ACK] Seq=1 Ack=544 Win=2160128 Len=0
44	3.559454	::1	::1	HTTP	326	HTTP/1.1 401 Unauthorized 
45	3.559496	::1	::1	TCP	64	51523 → 80 [ACK] Seq=544 Ack=263 Win=326912 Len=0
```

**Comment by 39digits** [comment]
I opened #7982 with some details on an issue I think is related to yours.  There is definitely something up with connections via localhost since the last update.  I've had problems with Node-based web apps when using localhost but everything is fine when using the IP address.

If I explicitly disable keep-alive timeout in the Node http server by setting it to 0 then localhost works.

**Comment by 39digits** [comment]
Are you using the Microsoft Store version of WSL?  I've seen that as the common thread throughout the localhost issues and uninstalling it fixes things.
