### ISSUE TITLE
virtioproxy/consomme networking mode does not allow connections to Docker container from local Windows environment

### ISSUE THREAD

**Issue by mattmichal** [microsoft/WSL#41554]
### Windows Version

Microsoft Windows [Version 10.0.26100.9445]

### WSL Version

2.9.10.0

### Are you using WSL 1 or WSL 2?

- [x] WSL 2
- [ ] WSL 1

### Kernel Version

6.18.40.1-1

### Distro Version

Ubuntu-20.04

### Other Software

Docker Engine - Community 24.0.6
containerd 1.6.24
iptables v1.8.4 (legacy)

### Configure and verify environment

```
PS> Get-Content "$env:USERPROFILE\.wslconfig"
[wsl2]
networkingMode=consomme
dnsTunneling=true
autoProxy=true
```

```
ubuntu@:~$ ip -4 addr show docker0
4: docker0: <BROADCAST,MULTICAST,UP,LOWER_UP> mtu 1500 qdisc noqueue state UP group default
    inet 172.18.0.1/16 brd 172.18.255.255 scope global docker0
       valid_lft forever preferred_lft forever
```

### Run a container

```
ubuntu@:~$ docker run --rm -d \
>   --name wsl-consomme-repro \
>   -p 127.0.0.1:18081:80 \
>   nginx:alpine
c7100e6426a876247fdf3422f42811f5a845e9a269e58826ab815b513ac11ae4
ubuntu@:~$ docker ps --filter name=wsl-consomme-repro \
>   --format 'table {{.Names}}\t{{.Ports}}'
NAMES                PORTS
wsl-consomme-repro   127.0.0.1:18081->80/tcp
```

### Connect to container from inside WSL

```
ubuntu@:~$ curl -v --max-time 5 http://127.0.0.1:18081/
*   Trying 127.0.0.1:18081...
* TCP_NODELAY set
* Connected to 127.0.0.1 (127.0.0.1) port 18081 (#0)
> GET / HTTP/1.1
> Host: 127.0.0.1:18081
> User-Agent: curl/7.68.0
> Accept: */*
>
* Mark bundle as not supporting multiuse
< HTTP/1.1 200 OK
< Server: nginx/1.31.5
< Date: Thu, 10 Sep 2026 11:04:05 GMT
< Content-Type: text/html
< Content-Length: 896
< Last-Modified: Wed, 02 Sep 2026 17:23:39 GMT
< Connection: keep-alive
< ETag: "6a985b9b-380"
< Accept-Ranges: bytes
<
<!DOCTYPE html>
<html>
<head>
<title>Welcome to nginx!</title>
...
</html>
* Connection #0 to host 127.0.0.1 left intact
ubuntu@:~$ sudo ss -lntp | grep ':18081 '
LISTEN    0         4096             127.0.0.1:18081            0.0.0.0:*        users:(("docker-proxy",pid=4204,fd=4)) 
ubuntu@:~$ ps -ef | grep '[d]ocker-proxy.*18081'
root        4204     356  0 06:03 ?        00:00:00 /usr/bin/docker-proxy -proto tcp -host-ip 127.0.0.1 -host-port 1808 -container-ip 172.18.0.3 -container-port 80
ubuntu@:~$ sudo iptables -t nat -nvL DOCKER --line-numbers
Chain DOCKER (2 references)
num   pkts bytes target     prot opt in     out     source               destination
1        0     0 RETURN     all  --  docker0 *       0.0.0.0/0            0.0.0.0/0
2        0     0 DNAT       tcp  --  !docker0 *       0.0.0.0/0            127.0.0.1            tcp dpt:18081 to:172.18.0.3:80
```

### Connect to a container from outside WSL (in Windows environment)

```
PS> curl.exe -v --max-time 5 http://127.0.0.1:18081/
*   Trying 127.0.0.1:18081...
* Established connection to 127.0.0.1 (127.0.0.1 port 18081) from 127.0.0.1 port 52697
* using HTTP/1.x
> GET / HTTP/1.1
> Host: 127.0.0.1:18081
> User-Agent: curl/8.21.0
> Accept: */*
>
* Request completely sent off
* Operation timed out after 5005 milliseconds with 0 bytes received
* closing connection #0
curl: (28) Operation timed out after 5005 milliseconds with 0 bytes received
PS> Test-NetConnection 127.0.0.1 -Port 18081

ComputerName     : 127.0.0.1
RemoteAddress    : 127.0.0.1
RemotePort       : 18081
InterfaceAlias   : Loopback Pseudo-Interface 1
SourceAddress    : 127.0.0.1
TcpTestSucceeded : True

PS> Get-NetTCPConnection -State Listen -LocalPort 18081 |
>>     Format-Table LocalAddress,LocalPort,OwningProcess

LocalAddress LocalPort OwningProcess
------------ --------- -------------
127.0.0.1        18081         14908


PS> tasklist /m wsldevicehost.dll

Image Name                     PID Modules
========================= ======== ============================================
dllhost.exe                  14908 wsldevicehost.dll
```

### Bypass DNAT

```
ubuntu@CND22459SB:~$ sudo iptables -t nat -I DOCKER 1 \
>   -d 127.0.0.1/32 \
>   -p tcp --dport 18081 \
>   -j RETURN
ubuntu@CND22459SB:~$ sudo iptables -t nat -nvL DOCKER --line-numbers
Chain DOCKER (2 references)
num   pkts bytes target     prot opt in     out     source               destination
1        0     0 RETURN     tcp  --  *      *       0.0.0.0/0            127.0.0.1            tcp dpt:18081
2        0     0 RETURN     all  --  docker0 *       0.0.0.0/0            0.0.0.0/0
3        3   144 DNAT       tcp  --  !docker0 *       0.0.0.0/0            127.0.0.1            tcp dpt:18081 to:172.18.0.3:80
```

After bypassing DNAT, connectivity from Windows environment works.

```
PS> curl.exe -v --max-time 5 http://127.0.0.1:18081/
*   Trying 127.0.0.1:18081...
* Established connection to 127.0.0.1 (127.0.0.1 port 18081) from 127.0.0.1 port 54864
* using HTTP/1.x
> GET / HTTP/1.1
> Host: 127.0.0.1:18081
> User-Agent: curl/8.21.0
> Accept: */*
>
* Request completely sent off
* Operation timed out after 5008 milliseconds with 0 bytes received
* closing connection #0
curl: (28) Operation timed out after 5008 milliseconds with 0 bytes received
PS C:\Users\MichalMR> curl.exe -v --max-time 5 http://127.0.0.1:18081/
*   Trying 127.0.0.1:18081...
* Established connection to 127.0.0.1 (127.0.0.1 port 18081) from 127.0.0.1 port 60749
* using HTTP/1.x
> GET / HTTP/1.1
> Host: 127.0.0.1:18081
> User-Agent: curl/8.21.0
> Accept: */*
>
* Request completely sent off
< HTTP/1.1 200 OK
< Server: nginx/1.31.5
< Date: Thu, 10 Sep 2026 11:12:29 GMT
< Content-Type: text/html
< Content-Length: 896
< Last-Modified: Wed, 02 Sep 2026 17:23:39 GMT
< Connection: keep-alive
< ETag: "6a985b9b-380"
< Accept-Ranges: bytes
<
<!DOCTYPE html>
<html>
<head>
<title>Welcome to nginx!</title>
...
</html>
* Connection #0 to host 127.0.0.1:18081 left intact
```

Using `--network host` also allows connectivity but custom port mapping is highly desired functionality.

### Expected Behavior

When using Docker port mapping, connectivity from the local Windows environment to WSL-hosted containers should work.

### Actual Behavior

Connectivity from the local Windows environment to WSL-hosted containers fails.

### Packet capture during Windows failure

```
ubuntu@CND22459SB:~$ CIP=$(docker inspect -f \
>   '{{range.NetworkSettings.Networks}}{{.IPAddress}}{{end}}' \
>   wsl-consomme-repro)
ubuntu@CND22459SB:~$ echo "container=$CIP"
container=172.18.0.3
ubuntu@CND22459SB:~$ sudo tcpdump -ni any -vv \
>   "tcp port 18081 or host $CIP"
tcpdump: listening on any, link-type LINUX_SLL (Linux cooked v1), capture size 262144 bytes
06:07:45.184318 IP (tos 0x0, ttl 64, id 0, offset 0, flags [DF], proto TCP (6), length 48)
    127.0.0.1.54864 > 127.0.0.1.18081: Flags [S], cksum 0xad15 (correct), seq 835029508, win 0, options [mss 65535,wscale 7,eol], length 0
06:07:45.184383 IP (tos 0x0, ttl 63, id 0, offset 0, flags [DF], proto TCP (6), length 48)
    127.0.0.1.54864 > 172.18.0.3.80: Flags [S], cksum 0xc652 (correct), seq 835029508, win 0, options [mss 65535,wscale 7,eol], length 0
06:07:45.184391 IP (tos 0x0, ttl 63, id 0, offset 0, flags [DF], proto TCP (6), length 48)
    127.0.0.1.54864 > 172.18.0.3.80: Flags [S], cksum 0xc652 (correct), seq 835029508, win 0, options [mss 65535,wscale 7,eol], length 0
06:07:46.198083 IP (tos 0x0, ttl 64, id 0, offset 0, flags [DF], proto TCP (6), length 48)
    127.0.0.1.54864 > 127.0.0.1.18081: Flags [S], cksum 0xad15 (correct), seq 835029508, win 0, options [mss 65535,wscale 7,eol], length 0
06:07:46.198157 IP (tos 0x0, ttl 63, id 0, offset 0, flags [DF], proto TCP (6), length 48)
    127.0.0.1.54864 > 172.18.0.3.80: Flags [S], cksum 0xc652 (correct), seq 835029508, win 0, options [mss 65535,wscale 7,eol], length 0
06:07:46.198187 IP (tos 0x0, ttl 63, id 0, offset 0, flags [DF], proto TCP (6), length 48)
    127.0.0.1.54864 > 172.18.0.3.80: Flags [S], cksum 0xc652 (correct), seq 835029508, win 0, options [mss 65535,wscale 7,eol], length 0
06:07:48.204678 IP (tos 0x0, ttl 64, id 0, offset 0, flags [DF], proto TCP (6), length 48)
    127.0.0.1.54864 > 127.0.0.1.18081: Flags [S], cksum 0xad15 (correct), seq 835029508, win 0, options [mss 65535,wscale 7,eol], length 0
06:07:48.204779 IP (tos 0x0, ttl 63, id 0, offset 0, flags [DF], proto TCP (6), length 48)
    127.0.0.1.54864 > 172.18.0.3.80: Flags [S], cksum 0xc652 (correct), seq 835029508, win 0, options [mss 65535,wscale 7,eol], length 0
06:07:48.204792 IP (tos 0x0, ttl 63, id 0, offset 0, flags [DF], proto TCP (6), length 48)
    127.0.0.1.54864 > 172.18.0.3.80: Flags [S], cksum 0xc652 (correct), seq 835029508, win 0, options [mss 65535,wscale 7,eol], length 0
06:07:50.213725 ARP, Ethernet (len 6), IPv4 (len 4), Request who-has 172.18.0.3 tell 172.18.0.1, length 28
06:07:50.213736 ARP, Ethernet (len 6), IPv4 (len 4), Request who-has 172.18.0.3 tell 172.18.0.1, length 28
06:07:50.213789 ARP, Ethernet (len 6), IPv4 (len 4), Reply 172.18.0.3 is-at 02:42:ac:12:00:03, length 28
06:07:50.213828 ARP, Ethernet (len 6), IPv4 (len 4), Reply 172.18.0.3 is-at 02:42:ac:12:00:03, length 28
06:07:52.212013 IP (tos 0x0, ttl 64, id 0, offset 0, flags [DF], proto TCP (6), length 48)
    127.0.0.1.54864 > 127.0.0.1.18081: Flags [S], cksum 0xad15 (correct), seq 835029508, win 0, options [mss 65535,wscale 7,eol], length 0
06:07:52.212115 IP (tos 0x0, ttl 63, id 0, offset 0, flags [DF], proto TCP (6), length 48)
    127.0.0.1.54864 > 172.18.0.3.80: Flags [S], cksum 0xc652 (correct), seq 835029508, win 0, options [mss 65535,wscale 7,eol], length 0
06:07:52.212127 IP (tos 0x0, ttl 63, id 0, offset 0, flags [DF], proto TCP (6), length 48)
    127.0.0.1.54864 > 172.18.0.3.80: Flags [S], cksum 0xc652 (correct), seq 835029508, win 0, options [mss 65535,wscale 7,eol], length 0
^C
16 packets captured
16 packets received by filter
0 packets dropped by kernel
```

### Packet capture after DNAT is bypassed

```
ubuntu@:~$ sudo tcpdump -ni any -vv \
>   "tcp port 18081 or host $CIP"
tcpdump: listening on any, link-type LINUX_SLL (Linux cooked v1), capture size 262144 bytes
06:12:29.907659 IP (tos 0x0, ttl 64, id 0, offset 0, flags [DF], proto TCP (6), length 48)
    127.0.0.1.60749 > 127.0.0.1.18081: Flags [S], cksum 0x3b02 (correct), seq 890757576, win 0, options [mss 65535,wscale 7,eol], length 0
06:12:29.907773 IP (tos 0x0, ttl 64, id 0, offset 0, flags [DF], proto TCP (6), length 48)
    127.0.0.1.18081 > 127.0.0.1.60749: Flags [S.], cksum 0xfe24 (incorrect -> 0x92ea), seq 1131440615, ack 890757577, win 64240, options [mss 1460,nop,wscale 10], length 0
06:12:29.907977 IP (tos 0x0, ttl 64, id 0, offset 0, flags [DF], proto TCP (6), length 40)
    127.0.0.1.60749 > 127.0.0.1.18081: Flags [.], cksum 0xb929 (correct), seq 1, ack 1, win 128, length 0
06:12:29.908451 IP (tos 0x0, ttl 64, id 50183, offset 0, flags [DF], proto TCP (6), length 60)
    172.18.0.1.36420 > 172.18.0.3.80: Flags [S], cksum 0x5857 (incorrect -> 0x1288), seq 2644942730, win 64240, options [mss 1460,sackOK,TS val 3468773332 ecr 0,nop,wscale 10], length 0
06:12:29.908471 IP (tos 0x0, ttl 64, id 50183, offset 0, flags [DF], proto TCP (6), length 60)
    172.18.0.1.36420 > 172.18.0.3.80: Flags [S], cksum 0x5857 (incorrect -> 0x1288), seq 2644942730, win 64240, options [mss 1460,sackOK,TS val 3468773332 ecr 0,nop,wscale 10], length 0
06:12:29.908489 IP (tos 0x0, ttl 64, id 0, offset 0, flags [DF], proto TCP (6), length 60)
    172.18.0.3.80 > 172.18.0.1.36420: Flags [S.], cksum 0x5857 (incorrect -> 0x3daa), seq 2003962366, ack 2644942731, win 65160, options [mss 1460,sackOK,TS val 3529997660 ecr 3468773332,nop,wscale 10], length 0
06:12:29.908497 IP (tos 0x0, ttl 64, id 0, offset 0, flags [DF], proto TCP (6), length 60)
    172.18.0.3.80 > 172.18.0.1.36420: Flags [S.], cksum 0x5857 (incorrect -> 0x3daa), seq 2003962366, ack 2644942731, win 65160, options [mss 1460,sackOK,TS val 3529997660 ecr 3468773332,nop,wscale 10], length 0
06:12:29.908507 IP (tos 0x0, ttl 64, id 50184, offset 0, flags [DF], proto TCP (6), length 52)
    172.18.0.1.36420 > 172.18.0.3.80: Flags [.], cksum 0x584f (incorrect -> 0x6ac3), seq 1, ack 1, win 63, options [nop,nop,TS val 3468773332 ecr 3529997660], length 0
06:12:29.908507 IP (tos 0x0, ttl 64, id 50184, offset 0, flags [DF], proto TCP (6), length 52)
    172.18.0.1.36420 > 172.18.0.3.80: Flags [.], cksum 0x584f (incorrect -> 0x6ac3), seq 1, ack 1, win 63, options [nop,nop,TS val 3468773332 ecr 3529997660], length 0
06:12:29.910236 IP (tos 0x0, ttl 64, id 0, offset 0, flags [DF], proto TCP (6), length 119)
    127.0.0.1.60749 > 127.0.0.1.18081: Flags [P.], cksum 0xfa85 (correct), seq 1:80, ack 1, win 128, length 79
06:12:29.910273 IP (tos 0x0, ttl 64, id 6587, offset 0, flags [DF], proto TCP (6), length 40)
    127.0.0.1.18081 > 127.0.0.1.60749: Flags [.], cksum 0xfe1c (incorrect -> 0xb91b), seq 1, ack 80, win 63, length 0
06:12:29.910391 IP (tos 0x0, ttl 64, id 50185, offset 0, flags [DF], proto TCP (6), length 131)
    172.18.0.1.36420 > 172.18.0.3.80: Flags [P.], cksum 0x589e (incorrect -> 0xac1d), seq 1:80, ack 1, win 63, options [nop,nop,TS val 3468773334 ecr 3529997660], length 79: HTTP, length: 79
        GET / HTTP/1.1
        Host: 127.0.0.1:18081
        User-Agent: curl/8.21.0
        Accept: */*

06:12:29.910409 IP (tos 0x0, ttl 64, id 50185, offset 0, flags [DF], proto TCP (6), length 131)
    172.18.0.1.36420 > 172.18.0.3.80: Flags [P.], cksum 0x589e (incorrect -> 0xac1d), seq 1:80, ack 1, win 63, options [nop,nop,TS val 3468773334 ecr 3529997660], length 79: HTTP, length: 79
        GET / HTTP/1.1
        Host: 127.0.0.1:18081
        User-Agent: curl/8.21.0
        Accept: */*

06:12:29.910432 IP (tos 0x0, ttl 64, id 45904, offset 0, flags [DF], proto TCP (6), length 52)
    172.18.0.3.80 > 172.18.0.1.36420: Flags [.], cksum 0x584f (incorrect -> 0x6a6f), seq 1, ack 80, win 64, options [nop,nop,TS val 3529997662 ecr 3468773334], length 0
06:12:29.910438 IP (tos 0x0, ttl 64, id 45904, offset 0, flags [DF], proto TCP (6), length 52)
    172.18.0.3.80 > 172.18.0.1.36420: Flags [.], cksum 0x584f (incorrect -> 0x6a6f), seq 1, ack 80, win 64, options [nop,nop,TS val 3529997662 ecr 3468773334], length 0
06:12:29.913250 IP (tos 0x0, ttl 64, id 45905, offset 0, flags [DF], proto TCP (6), length 290)
    172.18.0.3.80 > 172.18.0.1.36420: Flags [P.], cksum 0x593d (incorrect -> 0x8bec), seq 1:239, ack 80, win 64, options [nop,nop,TS val 3529997665 ecr 3468773334], length 238: HTTP, length: 238
        HTTP/1.1 200 OK
        Server: nginx/1.31.5
        Date: Thu, 10 Sep 2026 11:12:29 GMT
        Content-Type: text/html
        Content-Length: 896
        Last-Modified: Wed, 02 Sep 2026 17:23:39 GMT
        Connection: keep-alive
        ETag: "6a985b9b-380"
        Accept-Ranges: bytes

06:12:29.913269 IP (tos 0x0, ttl 64, id 45905, offset 0, flags [DF], proto TCP (6), length 290)
    172.18.0.3.80 > 172.18.0.1.36420: Flags [P.], cksum 0x593d (incorrect -> 0x8bec), seq 1:239, ack 80, win 64, options [nop,nop,TS val 3529997665 ecr 3468773334], length 238: HTTP, length: 238
        HTTP/1.1 200 OK
        Server: nginx/1.31.5
        Date: Thu, 10 Sep 2026 11:12:29 GMT
        Content-Type: text/html
        Content-Length: 896
        Last-Modified: Wed, 02 Sep 2026 17:23:39 GMT
        Connection: keep-alive
        ETag: "6a985b9b-380"
        Accept-Ranges: bytes

06:12:29.913293 IP (tos 0x0, ttl 64, id 50186, offset 0, flags [DF], proto TCP (6), length 52)
    172.18.0.1.36420 > 172.18.0.3.80: Flags [.], cksum 0x584f (incorrect -> 0x697c), seq 80, ack 239, win 63, options [nop,nop,TS val 3468773337 ecr 3529997665], length 0
06:12:29.913295 IP (tos 0x0, ttl 64, id 50186, offset 0, flags [DF], proto TCP (6), length 52)
    172.18.0.1.36420 > 172.18.0.3.80: Flags [.], cksum 0x584f (incorrect -> 0x697c), seq 80, ack 239, win 63, options [nop,nop,TS val 3468773337 ecr 3529997665], length 0
06:12:29.913358 IP (tos 0x0, ttl 64, id 6588, offset 0, flags [DF], proto TCP (6), length 278)
    127.0.0.1.18081 > 127.0.0.1.60749: Flags [P.], cksum 0xff0a (incorrect -> 0xda9b), seq 1:239, ack 80, win 63, length 238
06:12:29.913515 IP (tos 0x0, ttl 64, id 0, offset 0, flags [DF], proto TCP (6), length 40)
    127.0.0.1.60749 > 127.0.0.1.18081: Flags [.], cksum 0xb7ee (correct), seq 80, ack 239, win 126, length 0
06:12:29.913553 IP (tos 0x0, ttl 64, id 45906, offset 0, flags [DF], proto TCP (6), length 948)
    172.18.0.3.80 > 172.18.0.1.36420: Flags [P.], cksum 0x5bcf (incorrect -> 0xf96c), seq 239:1135, ack 80, win 64, options [nop,nop,TS val 3529997665 ecr 3468773337], length 896: HTTP
06:12:29.913575 IP (tos 0x0, ttl 64, id 45906, offset 0, flags [DF], proto TCP (6), length 948)
    172.18.0.3.80 > 172.18.0.1.36420: Flags [P.], cksum 0x5bcf (incorrect -> 0xf96c), seq 239:1135, ack 80, win 64, options [nop,nop,TS val 3529997665 ecr 3468773337], length 896: HTTP
06:12:29.913585 IP (tos 0x0, ttl 64, id 50187, offset 0, flags [DF], proto TCP (6), length 52)
    172.18.0.1.36420 > 172.18.0.3.80: Flags [.], cksum 0x584f (incorrect -> 0x65fb), seq 80, ack 1135, win 63, options [nop,nop,TS val 3468773338 ecr 3529997665], length 0
06:12:29.913586 IP (tos 0x0, ttl 64, id 50187, offset 0, flags [DF], proto TCP (6), length 52)
    172.18.0.1.36420 > 172.18.0.3.80: Flags [.], cksum 0x584f (incorrect -> 0x65fb), seq 80, ack 1135, win 63, options [nop,nop,TS val 3468773338 ecr 3529997665], length 0
06:12:29.913625 IP (tos 0x0, ttl 64, id 6589, offset 0, flags [DF], proto TCP (6), length 936)
    127.0.0.1.18081 > 127.0.0.1.60749: Flags [P.], cksum 0x019d (incorrect -> 0x481f), seq 239:1135, ack 80, win 63, length 896
06:12:29.914028 IP (tos 0x0, ttl 64, id 0, offset 0, flags [DF], proto TCP (6), length 40)
    127.0.0.1.60749 > 127.0.0.1.18081: Flags [.], cksum 0xb46c (correct), seq 80, ack 1135, win 128, length 0
06:12:29.920391 IP (tos 0x0, ttl 64, id 0, offset 0, flags [DF], proto TCP (6), length 40)
    127.0.0.1.60749 > 127.0.0.1.18081: Flags [F.], cksum 0xb46b (correct), seq 80, ack 1135, win 128, length 0
06:12:29.920490 IP (tos 0x0, ttl 64, id 50188, offset 0, flags [DF], proto TCP (6), length 52)
    172.18.0.1.36420 > 172.18.0.3.80: Flags [F.], cksum 0x584f (incorrect -> 0x65f4), seq 80, ack 1135, win 63, options [nop,nop,TS val 3468773344 ecr 3529997665], length 0
06:12:29.920506 IP (tos 0x0, ttl 64, id 50188, offset 0, flags [DF], proto TCP (6), length 52)
    172.18.0.1.36420 > 172.18.0.3.80: Flags [F.], cksum 0x584f (incorrect -> 0x65f4), seq 80, ack 1135, win 63, options [nop,nop,TS val 3468773344 ecr 3529997665], length 0
06:12:29.920553 IP (tos 0x0, ttl 64, id 45907, offset 0, flags [DF], proto TCP (6), length 52)
    172.18.0.3.80 > 172.18.0.1.36420: Flags [F.], cksum 0x584f (incorrect -> 0x65eb), seq 1135, ack 81, win 64, options [nop,nop,TS val 3529997672 ecr 3468773344], length 0
06:12:29.920557 IP (tos 0x0, ttl 64, id 45907, offset 0, flags [DF], proto TCP (6), length 52)
    172.18.0.3.80 > 172.18.0.1.36420: Flags [F.], cksum 0x584f (incorrect -> 0x65eb), seq 1135, ack 81, win 64, options [nop,nop,TS val 3529997672 ecr 3468773344], length 0
06:12:29.920593 IP (tos 0x0, ttl 64, id 50189, offset 0, flags [DF], proto TCP (6), length 52)
    172.18.0.1.36420 > 172.18.0.3.80: Flags [.], cksum 0x584f (incorrect -> 0x65eb), seq 81, ack 1136, win 63, options [nop,nop,TS val 3468773345 ecr 3529997672], length 0
06:12:29.920595 IP (tos 0x0, ttl 64, id 50189, offset 0, flags [DF], proto TCP (6), length 52)
    172.18.0.1.36420 > 172.18.0.3.80: Flags [.], cksum 0x584f (incorrect -> 0x65eb), seq 81, ack 1136, win 63, options [nop,nop,TS val 3468773345 ecr 3529997672], length 0
06:12:29.920669 IP (tos 0x0, ttl 64, id 6590, offset 0, flags [DF], proto TCP (6), length 40)
    127.0.0.1.18081 > 127.0.0.1.60749: Flags [F.], cksum 0xfe1c (incorrect -> 0xb4ab), seq 1135, ack 81, win 63, length 0
06:12:29.920818 IP (tos 0x0, ttl 64, id 0, offset 0, flags [DF], proto TCP (6), length 40)
    127.0.0.1.60749 > 127.0.0.1.18081: Flags [.], cksum 0xb46a (correct), seq 81, ack 1136, win 128, length 0
^C
36 packets captured
36 packets received by filter
0 packets dropped by kernel
```

**Comment by mattmichal** [comment]
[WslLogs-2026-09-10_06-15-34.tar.gz](https://github.com/user-attachments/files/32056638/WslLogs-2026-09-10_06-15-34.tar.gz)

**Comment by mattmichal** [comment]
Additionally, a test like `python3 -m http.server 18080 --bind 127.0.0.1` from inside WSL allows connections from local Windows environment.

**Comment by chemwolf6922** [comment]
Hi @mattmichal . 
Docker has a fix for this in newer versions: https://github.com/moby/moby/pull/48075. https://github.com/moby/moby/pull/48514. Please consider update docker. Thanks.

**Comment by mattmichal** [comment]
@chemwolf6922 thanks for pointing this out. I have the most recent Docker Desktop version that I was using to check my Docker Engine version but it turns out I also had another Docker Engine install locally inside WSL that was conflicting. I removed the local install, checked `docker version` to find the latest engine version v29.7.2 and then also found that the port mapping issue is resolved. Thank you for the direction!
