### ISSUE TITLE
WSL2 and Securemote Checkpoint incompatible - networks behind Checkpoint VPN not accessible in mirrored mode

### ISSUE THREAD

**Issue by marbaa** [microsoft/WSL#13426]
### Windows Version

Microsoft Windows [Version 10.0.26100.4652]

### WSL Version

2.5.10.0

### Are you using WSL 1 or WSL 2?

- [x] WSL 2
- [ ] WSL 1

### Kernel Version

6.6.87.2

### Distro Version

Ubuntu 24.04

### Other Software

Securemote Checkpoint VPN E86.60
WSL2 ssh client - OpenSSH_9.6p1 Ubuntu-3ubuntu13.12, OpenSSL 3.0.13 30 Jan 2024

### Repro Steps

1. Install default Ubuntu distro, example 24.04
2. Set as WSL2 version
3. Set WSL2 networking mode to mirrored
4. Connect to VPN using Checkpoint
5. ssh to networks behind Checkpoint

### Expected Behavior

Working network connection to networks located behind specific Checkpoint VPN network range.

### Actual Behavior

Connection doesn't work.
Doesn't matter which MTU I set on main interface and VPN interface.
Connection works from Powershell.
Connection doesn't work from WSL2 mirrored mode.

```
user@WSL2:~$ ip r get 6.x.y.z
6.x.y.z via 10.x.y.z dev eth4 src 10.xx.0.2 uid 1000
```

Default interface
```
user@WSL2:~$ ip a s eth0
2: eth0: <BROADCAST,MULTICAST,UP,LOWER_UP> mtu 1310 qdisc mq state UP group default qlen 1000
    link/ether 00:05:9a:3c:7a:00 brd ff:ff:ff:ff:ff:ff
    inet 10.yy.46.204/23 brd 10.yy.47.255 scope global noprefixroute eth0
       valid_lft forever preferred_lft forever
    inet6 fe80::9e32:a31c:4a7d:4fce/126 scope link nodad noprefixroute
       valid_lft forever preferred_lft forever
    inet6 fe80::2745:1106:9e98:edbf/64 scope link nodad noprefixroute
       valid_lft forever preferred_lft forever
```

Interface of Checkpoint VPN
```
user@WSL2:~$ ip a s eth4
6: eth4: <BROADCAST,MULTICAST,UP,LOWER_UP> mtu 1020 qdisc mq state UP group default qlen 1000
    link/ether 54:73:cf:79:21:03 brd ff:ff:ff:ff:ff:ff
    inet 10.yy.zz.2/30 brd 10.yy.zz.3 scope global noprefixroute eth4
       valid_lft forever preferred_lft forever
```
Following is output from tcpdump WSL2 Ubuntu when doing ssh to target server:
```
user@WSL2:~$ sudo tcpdump -nvvi eth4 port 22
tcpdump: listening on eth4, link-type EN10MB (Ethernet), snapshot length 262144 bytes
12:15:41.345512 IP (tos 0x10, ttl 64, id 2149, offset 0, flags [DF], proto TCP (6), length 60)
    10.yy.zz.2.44834 > 6.x.y.z.22: Flags [S], cksum 0x7737 (incorrect -> 0x10e0), seq 1282796778, win 64660, options [mss 1060,sackOK,TS val 945923096 ecr 0,nop,wscale 7], length 0
12:15:42.360368 IP (tos 0x10, ttl 64, id 2150, offset 0, flags [DF], proto TCP (6), length 60)
    10.yy.zz.2.44834 > 6.x.y.z.22: Flags [S], cksum 0x7737 (incorrect -> 0x0ce9), seq 1282796778, win 64660, options [mss 1060,sackOK,TS val 945924111 ecr 0,nop,wscale 7], length 0
12:15:43.384183 IP (tos 0x10, ttl 64, id 2151, offset 0, flags [DF], proto TCP (6), length 60)
    10.yy.zz.2.44834 > 6.x.y.z.22: Flags [S], cksum 0x7737 (incorrect -> 0x08e9), seq 1282796778, win 64660, options [mss 1060,sackOK,TS val 945925135 ecr 0,nop,wscale 7], length 0
12:15:44.408300 IP (tos 0x10, ttl 64, id 2152, offset 0, flags [DF], proto TCP (6), length 60)
    10.yy.zz.2.44834 > 6.x.y.z.22: Flags [S], cksum 0x7737 (incorrect -> 0x04e9), seq 1282796778, win 64660, options [mss 1060,sackOK,TS val 945926159 ecr 0,nop,wscale 7], length 0
12:15:45.432503 IP (tos 0x10, ttl 64, id 2153, offset 0, flags [DF], proto TCP (6), length 60)
    10.yy.zz.2.44834 > 6.x.y.z.22: Flags [S], cksum 0x7737 (incorrect -> 0x00e9), seq 1282796778, win 64660, options [mss 1060,sackOK,TS val 945927183 ecr 0,nop,wscale 7], length 0
12:15:46.456485 IP (tos 0x10, ttl 64, id 2154, offset 0, flags [DF], proto TCP (6), length 60)
    10.yy.zz.2.44834 > 6.x.y.z.22: Flags [S], cksum 0x7737 (incorrect -> 0xfce8), seq 1282796778, win 64660, options [mss 1060,sackOK,TS val 945928207 ecr 0,nop,wscale 7], length 0
12:15:48.472295 IP (tos 0x10, ttl 64, id 2155, offset 0, flags [DF], proto TCP (6), length 60)
    10.yy.zz.2.44834 > 6.x.y.z.22: Flags [S], cksum 0x7737 (incorrect -> 0xf508), seq 1282796778, win 64660, options [mss 1060,sackOK,TS val 945930223 ecr 0,nop,wscale 7], length 0
12:15:52.600384 IP (tos 0x10, ttl 64, id 2156, offset 0, flags [DF], proto TCP (6), length 60)
    10.yy.zz.2.44834 > 6.x.y.z.22: Flags [S], cksum 0x7737 (incorrect -> 0xe4e8), seq 1282796778, win 64660, options [mss 1060,sackOK,TS val 945934351 ecr 0,nop,wscale 7], length 0
12:16:00.792329 IP (tos 0x10, ttl 64, id 2157, offset 0, flags [DF], proto TCP (6), length 60)
    10.yy.zz.2.44834 > 6.x.y.z.22: Flags [S], cksum 0x7737 (incorrect -> 0xc4e8), seq 1282796778, win 64660, options [mss 1060,sackOK,TS val 945942543 ecr 0,nop,wscale 7], length 0
12:16:16.920191 IP (tos 0x10, ttl 64, id 2158, offset 0, flags [DF], proto TCP (6), length 60)
    10.yy.zz.2.44834 > 6.x.y.z.22: Flags [S], cksum 0x7737 (incorrect -> 0x85e8), seq 1282796778, win 64660, options [mss 1060,sackOK,TS val 945958671 ecr 0,nop,wscale 7], length 0
12:16:49.688205 IP (tos 0x10, ttl 64, id 2159, offset 0, flags [DF], proto TCP (6), length 60)
    10.yy.zz.2.44834 > 6.x.y.z.22: Flags [S], cksum 0x7737 (incorrect -> 0x05e8), seq 1282796778, win 64660, options [mss 1060,sackOK,TS val 945991439 ecr 0,nop,wscale 7], length 0
```

Even ping doesn't work from WSL2.
```
user@WSL2:~$ ping 6.x.y.z
PING 6.x.y.z (6.x.y.z) 56(84) bytes of data.
^C
```

From Powershell works:
```
PS C:\Users\XYZ> ping 6.x.y.z

Pinging 6.x.y.z with 32 bytes of data:
Reply from 6.x.y.z: bytes=32 time=45ms TTL=61
Reply from 6.x.y.z: bytes=32 time=47ms TTL=61
```

**Comment by marbaa** [comment]
[WslNetworkingLogs-2025-08-26_12-47-10.zip](https://github.com/user-attachments/files/21986371/WslNetworkingLogs-2025-08-26_12-47-10.zip)
