### ISSUE TITLE
Network packet discrepancy/drop between Windows Host and WSL2

### ISSUE THREAD

**Issue by nnathan** [microsoft/WSL#10989]
### Windows Version

Microsoft Windows [Version 10.0.22621.2861]

### WSL Version

2.0.0.0

### Are you using WSL 1 or WSL 2?

- [X] WSL 2
- [ ] WSL 1

### Kernel Version

5.15.123.1-microsoft-standard-WSL2

### Distro Version

Ubuntu 22.04.3 LTS

### Other Software

Wireshark
tcpdump (on wsl2)
Cygwin + ping

### Repro Steps

1. Run on wsl2: `tcpdump -w /tmp/wsl2.pcap -i eth1 host 1.1.1.1 and icmp`
2. Run on Windows host: Wireshark on internet facing network adapter (in my case Intel Wifi) using capture filter `host 1.1.1.1 and icmp`
3. Run on wsl2: `ping -c 1000 -f 1.1.1.1`
4. Stop tcpdump and wireshark (and in wireshark save capture to `c:\temp\windowshost.pcap`)

### Expected Behavior

0% packet loss

### Actual Behavior

```
PING 1.1.1.1 (1.1.1.1) 56(84) bytes of data.
....................
--- 1.1.1.1 ping statistics ---
1000 packets transmitted, 980 received, 2.6% packet loss, time 9244ms
rtt min/avg/max/mdev = 7.772/9.103/24.292/1.447 ms, pipe 2, ipg/ewma 9.253/8.599 ms
```

### Diagnostic Logs

From the above steps it isn't apparent that packets are being dropped from the Host to the WSL2 VM. However the following attachment 
[pcaps.zip](https://github.com/microsoft/WSL/files/13852209/pcaps.zip)
contains the wsl2 pcap and the windows host pcap.

Here is the number of packets captured from both:

```
$ tcpdump -n -r windowshost.pcap 2>/dev/null  | wc -l
2000
$ tcpdump -n -r wsl2.pcap 2>/dev/null | wc -l
1976
```

In `windowshost.pcap` a 1000 ICMP echo requests were sent, and a 1000 ICMP echo response were received; indicating 0% packet loss.

In `wsl2.cap` a 1000 ICMP echo requests were sent, but only 976 ICMP echo replies were received, which meant ping reported 2.6% packet loss.

Somehow 24 packets were dropped between the host and the WSL2 VM.

This is consistently repeatable on the Windows host that is connected by Wifi.
However, it only seems to manifest when pinging an Internet host such as `1.1.1.1` or `8.8.8.8`. For example, a `ping -c 1000 -f 192.168.0.1` to the Wifi router yields 0% loss. **But as we can see from the packet capture from the Windows host this is not an upstream or a router issue, since both the 1000 requests and 1000 responses do arrive on the Internet facing network adapter.**

**Comment by chanpreetdhanjal** [comment]
Hi. Can you please collect networking logs by following the instructions below?
https://github.com/microsoft/WSL/blob/master/CONTRIBUTING.md#collect-wsl-logs-for-networking-issues

**Comment by nnathan** [comment]
Hi I ran the experiment while collecting networking logs per instruction.

See attached:
[WslNetworkingLogs-2024-01-10_11-02-34.zip](https://github.com/microsoft/WSL/files/13881420/WslNetworkingLogs-2024-01-10_11-02-34.zip)
[windowshost-2024-01-10_11-02-34.pcap.zip](https://github.com/microsoft/WSL/files/13881426/windowshost-2024-01-10_11-02-34.pcap.zip)

**Comment by nnathan** [comment]
I should note that in the above experiment with the attached networking logs, there was a 1.6% packet loss, but in the host pcap there was 0% loss, you can verify that in the `tcpdump.log` that only 984 ICMP echo reply packets were received by WSL2.

**Comment by nnathan** [comment]
Is there any update on this?

**Comment by selmison** [comment]
Some issue here

**Comment by aaronshenhao** [comment]
This issue seems easier to replicate when connected to a congested VPN with high ping times. I tested it with ProtonVPN on the free tier. Without the VPN, it was difficult to replicate the issue. In addition, it felt that packet loss was more common when using raw sockets, but I'm not entirely sure.

I have included results from two tests: one with `ping` and another with a custom Python script that sends ICMP over raw sockets (generated by Claude Sonnet 4). The `IP_HDRINCL` flag is not set or it won't work in WSL 2.  The sample size is 10, but the trend holds up for larger sample sizes too.

Both `tcpdump` and Wireshark were used to analyze the packets. `tcpdump` was running in WSL 2 and Wireshark was capturing packets from the VPN's interface in Windows. The timeout of the Python script is 10 seconds.

## Test 1 - `ping` in WSL 2
<details>
<summary>
    <code>ping</code> output
</summary>
<p>

```
# Command: ping A.B.C.D
PING A.B.C.D (A.B.C.D) 56(84) bytes of data.
64 bytes from A.B.C.D: icmp_seq=1 ttl=119 time=1073 ms
64 bytes from A.B.C.D: icmp_seq=3 ttl=119 time=1084 ms
64 bytes from A.B.C.D: icmp_seq=5 ttl=119 time=196 ms
64 bytes from A.B.C.D: icmp_seq=6 ttl=119 time=1040 ms
64 bytes from A.B.C.D: icmp_seq=7 ttl=119 time=1007 ms
64 bytes from A.B.C.D: icmp_seq=8 ttl=119 time=1007 ms
64 bytes from A.B.C.D: icmp_seq=9 ttl=119 time=1007 ms
64 bytes from A.B.C.D: icmp_seq=10 ttl=119 time=1009 ms
^C
--- A.B.C.D ping statistics ---
11 packets transmitted, 8 received, 27.2727% packet loss, time 10195ms
rtt min/avg/max/mdev = 196.367/927.907/1083.846/278.053 ms, pipe 2
```

</p>
</details>

<details>
<summary>
    <code>tcpdump</code> output
</summary>
<p>

```
# Command: sudo tcpdump -i any -v -n
tcpdump: data link type LINUX_SLL2
tcpdump: listening on any, link-type LINUX_SLL2 (Linux cooked v2), snapshot length 262144 bytes
10:22:46.719992 eth0 Out IP (tos 0x0, ttl 64, id 33694, offset 0, flags [DF], proto ICMP (1), length 84)
172.20.10.5 > A.B.C.D: ICMP echo request, id 42, seq 1, length 64
10:22:47.788237 eth0 Out IP (tos 0x0, ttl 64, id 33709, offset 0, flags [DF], proto ICMP (1), length 84)
172.20.10.5 > A.B.C.D: ICMP echo request, id 42, seq 2, length 64
10:22:47.793392 eth0 In IP (tos 0x0, ttl 119, id 0, offset 0, flags [none], proto ICMP (1), length 84)
A.B.C.D > 172.20.10.5: ICMP echo reply, id 42, seq 1, length 64
10:22:48.790411 eth0 Out IP (tos 0x0, ttl 64, id 33731, offset 0, flags [DF], proto ICMP (1), length 84)
172.20.10.5 > A.B.C.D: ICMP echo request, id 42, seq 3, length 64
10:22:49.868222 eth0 Out IP (tos 0x0, ttl 64, id 33790, offset 0, flags [DF], proto ICMP (1), length 84)
172.20.10.5 > A.B.C.D: ICMP echo request, id 42, seq 4, length 64
10:22:49.874166 eth0 In IP (tos 0x0, ttl 119, id 0, offset 0, flags [none], proto ICMP (1), length 84)
A.B.C.D > 172.20.10.5: ICMP echo reply, id 42, seq 3, length 64
10:22:50.870660 eth0 Out IP (tos 0x0, ttl 64, id 33816, offset 0, flags [DF], proto ICMP (1), length 84)
172.20.10.5 > A.B.C.D: ICMP echo request, id 42, seq 5, length 64
10:22:51.066916 eth0 In IP (tos 0x0, ttl 119, id 0, offset 0, flags [none], proto ICMP (1), length 84)
A.B.C.D > 172.20.10.5: ICMP echo reply, id 42, seq 5, length 64
10:22:51.788256 eth0 Out ARP, Ethernet (len 6), IPv4 (len 4), Request who-has A.B.C.D tell 172.20.10.5, length 28
10:22:51.789425 eth0 In ARP, Ethernet (len 6), IPv4 (len 4), Reply A.B.C.D is-at 00:15:5D:XX:YY:ZZ, length 28
10:22:51.872247 eth0 Out IP (tos 0x0, ttl 64, id 33862, offset 0, flags [DF], proto ICMP (1), length 84)
172.20.10.5 > A.B.C.D: ICMP echo request, id 42, seq 6, length 64
10:22:52.908407 eth0 Out IP (tos 0x0, ttl 64, id 33931, offset 0, flags [DF], proto ICMP (1), length 84)
172.20.10.5 > A.B.C.D: ICMP echo request, id 42, seq 7, length 64
10:22:52.912311 eth0 In IP (tos 0x0, ttl 119, id 0, offset 0, flags [none], proto ICMP (1), length 84)
A.B.C.D > 172.20.10.5: ICMP echo reply, id 42, seq 6, length 64
10:22:53.910539 eth0 Out IP (tos 0x0, ttl 64, id 33973, offset 0, flags [DF], proto ICMP (1), length 84)
172.20.10.5 > A.B.C.D: ICMP echo request, id 42, seq 8, length 64
10:22:53.915105 eth0 In IP (tos 0x0, ttl 119, id 0, offset 0, flags [none], proto ICMP (1), length 84)
A.B.C.D > 172.20.10.5: ICMP echo reply, id 42, seq 7, length 64
10:22:54.912191 eth0 Out IP (tos 0x0, ttl 64, id 33982, offset 0, flags [DF], proto ICMP (1), length 84)
172.20.10.5 > A.B.C.D: ICMP echo request, id 42, seq 9, length 64
10:22:54.916963 eth0 In IP (tos 0x0, ttl 119, id 0, offset 0, flags [none], proto ICMP (1), length 84)
A.B.C.D > 172.20.10.5: ICMP echo reply, id 42, seq 8, length 64
10:22:55.913979 eth0 Out IP (tos 0x0, ttl 64, id 34078, offset 0, flags [DF], proto ICMP (1), length 84)
172.20.10.5 > A.B.C.D: ICMP echo request, id 42, seq 10, length 64
10:22:55.919405 eth0 In IP (tos 0x0, ttl 119, id 0, offset 0, flags [none], proto ICMP (1), length 84)
A.B.C.D > 172.20.10.5: ICMP echo reply, id 42, seq 9, length 64
10:22:56.915770 eth0 Out IP (tos 0x0, ttl 64, id 34081, offset 0, flags [DF], proto ICMP (1), length 84)
172.20.10.5 > A.B.C.D: ICMP echo request, id 42, seq 11, length 64
10:22:56.922647 eth0 In IP (tos 0x0, ttl 119, id 0, offset 0, flags [none], proto ICMP (1), length 84)
A.B.C.D > 172.20.10.5: ICMP echo reply, id 42, seq 10, length 64
10:23:01.107539 eth0 Out IP (tos 0x10, ttl 64, id 34232, offset 0, flags [DF], proto UDP (17), length 76)
172.20.10.5.48459 > E.F.G.H.123: NTPv4, Client, length 48
Leap indicator: (0), Stratum 0 (unspecified), poll 0 (1s), precision 0
Root Delay: 0.000000, Root dispersion: 0.000000, Reference-ID: (unspec)
Reference Timestamp: 0.000000000
Originator Timestamp: 0.000000000
Receive Timestamp: 0.000000000
Transmit Timestamp: 3963169381.024952399 (2025-08-03T00:23:01Z)
Originator - Receive Timestamp: 0.000000000
Originator - Transmit Timestamp: 3963169381.024952399 (2025-08-03T00:23:01Z)
10:23:01.634758 eth0 In IP (tos 0x0, ttl 57, id 14442, offset 0, flags [DF], proto UDP (17), length 76)
E.F.G.H.123 > 172.20.10.5.48459: NTPv4, Server, length 48
Leap indicator: (0), Stratum 2 (secondary reference), poll 0 (1s), precision -25
Root Delay: 0.001022, Root dispersion: 0.000213, Reference-ID: 0x4ff33c32
Reference Timestamp: 3963169310.486889279 (2025-08-03T00:21:50Z)
Originator Timestamp: 3963169381.024952399 (2025-08-03T00:23:01Z)
Receive Timestamp: 3963169381.517955796 (2025-08-03T00:23:01Z)
Transmit Timestamp: 3963169381.517994697 (2025-08-03T00:23:01Z)
Originator - Receive Timestamp: +0.493003397
Originator - Transmit Timestamp: +0.493042298
^C
23 packets captured
23 packets received by filter
0 packets dropped by kernel
```

</p>
</details>

<details>
<summary>
    Wireshark output
</summary>
<p>

```
6 5.860111 172.20.10.5 A.B.C.D ICMP 84 Echo (ping) request id=0x002a, seq=1/256, ttl=64 (reply in 20)
19 6.928590 172.20.10.5 A.B.C.D ICMP 84 Echo (ping) request id=0x002a, seq=2/512, ttl=64 (reply in 26)
20 6.932515 A.B.C.D 172.20.10.5 ICMP 84 Echo (ping) reply id=0x002a, seq=1/256, ttl=119 (request in 6)
26 7.758940 A.B.C.D 172.20.10.5 ICMP 84 Echo (ping) reply id=0x002a, seq=2/512, ttl=119 (request in 19)
28 7.930507 172.20.10.5 A.B.C.D ICMP 84 Echo (ping) request id=0x002a, seq=3/768, ttl=64 (reply in 38)
35 9.008657 172.20.10.5 A.B.C.D ICMP 84 Echo (ping) request id=0x002a, seq=4/1024, ttl=64 (reply in 70)
38 9.013192 A.B.C.D 172.20.10.5 ICMP 84 Echo (ping) reply id=0x002a, seq=3/768, ttl=119 (request in 28)
70 9.200488 A.B.C.D 172.20.10.5 ICMP 84 Echo (ping) reply id=0x002a, seq=4/1024, ttl=119 (request in 35)
93 10.010852 172.20.10.5 A.B.C.D ICMP 84 Echo (ping) request id=0x002a, seq=5/1280, ttl=64 (reply in 96)
96 10.205714 A.B.C.D 172.20.10.5 ICMP 84 Echo (ping) reply id=0x002a, seq=5/1280, ttl=119 (request in 93)
99 11.012793 172.20.10.5 A.B.C.D ICMP 84 Echo (ping) request id=0x002a, seq=6/1536, ttl=64 (reply in 102)
101 12.048632 172.20.10.5 A.B.C.D ICMP 84 Echo (ping) request id=0x002a, seq=7/1792, ttl=64 (reply in 104)
102 12.051744 A.B.C.D 172.20.10.5 ICMP 84 Echo (ping) reply id=0x002a, seq=6/1536, ttl=119 (request in 99)
103 13.050972 172.20.10.5 A.B.C.D ICMP 84 Echo (ping) request id=0x002a, seq=8/2048, ttl=64 (reply in 106)
104 13.054276 A.B.C.D 172.20.10.5 ICMP 84 Echo (ping) reply id=0x002a, seq=7/1792, ttl=119 (request in 101)
105 14.052212 172.20.10.5 A.B.C.D ICMP 84 Echo (ping) request id=0x002a, seq=9/2304, ttl=64 (reply in 110)
106 14.055904 A.B.C.D 172.20.10.5 ICMP 84 Echo (ping) reply id=0x002a, seq=8/2048, ttl=119 (request in 103)
109 15.054169 172.20.10.5 A.B.C.D ICMP 84 Echo (ping) request id=0x002a, seq=10/2560, ttl=64 (reply in 112)
110 15.058356 A.B.C.D 172.20.10.5 ICMP 84 Echo (ping) reply id=0x002a, seq=9/2304, ttl=119 (request in 105)
111 16.055833 172.20.10.5 A.B.C.D ICMP 84 Echo (ping) request id=0x002a, seq=11/2816, ttl=64 (reply in 116)
112 16.061203 A.B.C.D 172.20.10.5 ICMP 84 Echo (ping) reply id=0x002a, seq=10/2560, ttl=119 (request in 109)
116 16.398984 A.B.C.D 172.20.10.5 ICMP 84 Echo (ping) reply id=0x002a, seq=11/2816, ttl=119 (request in 111)
```

</p>
</details>

## Test 2 - ICMP over raw sockets in Python and WSL 2
<details>
<summary>
    Code
</summary>
<p>

```py
import socket
import struct
import time
import sys
import select
import os
import threading
from collections import deque

class ICMPPingDebug:
    def __init__(self, target_host):
        self.target_host = target_host
        self.target_ip = socket.gethostbyname(target_host)
        self.sequence = 0
        self.pending_packets = {}  # Track sent packets
        self.received_packets = deque(maxlen=100)  # Buffer for analysis
        self.stats = {
            'sent': 0,
            'received': 0,
            'matched': 0,
            'timeouts': 0,
            'parsing_errors': 0,
            'unexpected_replies': 0
        }
        
        try:
            self.sock = socket.socket(socket.AF_INET, socket.SOCK_RAW, socket.IPPROTO_ICMP)
            # Increase receive buffer size
            self.sock.setsockopt(socket.SOL_SOCKET, socket.SO_RCVBUF, 65536)
            # Set socket to non-blocking for better control
            self.sock.setblocking(False)
            if os.name != 'nt':
                self.sock.setsockopt(socket.SOL_SOCKET, socket.SO_REUSEADDR, 1)
                try:
                    self.sock.bind(('', 0))
                except:
                    pass
        except PermissionError:
            print("Error: Raw sockets require root privileges. Run with sudo.")
            sys.exit(1)
        except OSError as e:
            print(f"Error creating socket: {e}")
            sys.exit(1)

    def checksum(self, data):
        if len(data) % 2:
            data += b'\x00'
        checksum = 0
        for i in range(0, len(data), 2):
            checksum += (data[i] << 8) + data[i + 1]
        while checksum >> 16:
            checksum = (checksum & 0xFFFF) + (checksum >> 16)
        return ~checksum & 0xFFFF

    def create_icmp_packet(self, packet_id):
        icmp_type = 8
        icmp_code = 0
        icmp_checksum = 0
        icmp_id = packet_id & 0xFFFF
        icmp_seq = self.sequence & 0xFFFF
        
        header = struct.pack('!BBHHH', icmp_type, icmp_code, icmp_checksum, icmp_id, icmp_seq)
        timestamp = struct.pack('!d', time.time())
        payload = timestamp + f'Ping{self.sequence:04d}'.encode() + b'X' * 20
        
        icmp_checksum = self.checksum(header + payload)
        header = struct.pack('!BBHHH', icmp_type, icmp_code, icmp_checksum, icmp_id, icmp_seq)
        
        return header + payload

    def continuous_receive(self):
        """Continuously receive packets in background to avoid missing any"""
        while hasattr(self, 'running') and self.running:
            try:
                ready = select.select([self.sock], [], [], 0.1)
                if ready[0]:
                    try:
                        packet_data, addr = self.sock.recvfrom(1024)
                        recv_time = time.time()
                        self.received_packets.append({
                            'data': packet_data,
                            'addr': addr,
                            'time': recv_time,
                            'processed': False
                        })
                        self.stats['received'] += 1
                    except BlockingIOError:
                        continue
                    except Exception as e:
                        print(f"Debug: Receive error: {e}")
            except Exception as e:
                print(f"Debug: Select error: {e}")
                time.sleep(0.1)

    def parse_icmp_reply(self, packet_data, addr):
        try:
            if os.name == 'nt':
                ip_header_len = (packet_data[0] & 0x0F) * 4
                icmp_data = packet_data[ip_header_len:]
                ttl = packet_data[8]
            else:
                if len(packet_data) > 28 and (packet_data[0] >> 4) == 4:
                    ip_header_len = (packet_data[0] & 0x0F) * 4
                    icmp_data = packet_data[ip_header_len:]
                    ttl = packet_data[8]
                else:
                    icmp_data = packet_data
                    ttl = 64
            
            if len(icmp_data) < 8:
                return None
            
            icmp_type, icmp_code, icmp_checksum, icmp_id, icmp_seq = struct.unpack('!BBHHH', icmp_data[:8])
            
            if icmp_type == 0:
                return {
                    'type': icmp_type,
                    'code': icmp_code,
                    'id': icmp_id,
                    'sequence': icmp_seq,
                    'ttl': ttl,
                    'data': icmp_data[8:] if len(icmp_data) > 8 else b''
                }
        except Exception as e:
            self.stats['parsing_errors'] += 1
            print(f"Debug: Parsing error: {e}")
            
        return None

    def find_matching_reply(self, packet_id, sequence, timeout_time):
        """Look for matching reply in received packets buffer"""
        for packet in self.received_packets:
            if packet['processed']:
                continue
                
            reply = self.parse_icmp_reply(packet['data'], packet['addr'])
            if reply and reply['id'] == (packet_id & 0xFFFF) and reply['sequence'] == sequence:
                packet['processed'] = True
                self.stats['matched'] += 1
                return reply, packet['time'], packet['addr'][0]
        
        return None, None, None

    def send_ping(self, timeout=3.0):
        self.sequence += 1
        packet_id = os.getpid()
        
        icmp_packet = self.create_icmp_packet(packet_id)
        
        try:
            send_time = time.time()
            bytes_sent = self.sock.sendto(icmp_packet, (self.target_ip, 0))
            self.stats['sent'] += 1
            
            # Store packet info for tracking
            self.pending_packets[self.sequence] = {
                'id': packet_id,
                'send_time': send_time,
                'timeout_time': send_time + timeout
            }
            
            print(f"Debug: Sent seq={self.sequence}, id={packet_id & 0xFFFF}, {bytes_sent} bytes")
            
        except Exception as e:
            print(f"Error sending packet: {e}")
            return None
        
        # Wait for reply with multiple checks
        timeout_time = send_time + timeout
        while time.time() < timeout_time:
            reply, recv_time, addr = self.find_matching_reply(packet_id, self.sequence, timeout_time)
            if reply:
                rtt = (recv_time - send_time) * 1000
                del self.pending_packets[self.sequence]
                return {
                    'success': True,
                    'sequence': self.sequence,
                    'ttl': reply['ttl'],
                    'time': rtt,
                    'addr': addr
                }
            time.sleep(0.01)  # Small sleep to avoid busy waiting
        
        # Timeout
        self.stats['timeouts'] += 1
        if self.sequence in self.pending_packets:
            del self.pending_packets[self.sequence]
        
        # Check if we received any unexpected replies
        unprocessed = [p for p in self.received_packets if not p['processed']]
        if unprocessed:
            print(f"Debug: {len(unprocessed)} unprocessed packets in buffer during timeout")
            for packet in unprocessed[:3]:  # Show first 3
                reply = self.parse_icmp_reply(packet['data'], packet['addr'])
                if reply:
                    print(f"  Unexpected: ID={reply['id']}, Seq={reply['sequence']}, Type={reply['type']}")
                    self.stats['unexpected_replies'] += 1
        
        return {
            'success': False,
            'sequence': self.sequence,
            'timeout': True
        }

    def print_stats(self):
        print(f"\nDebug Stats:")
        print(f"  Sent: {self.stats['sent']}")
        print(f"  Received: {self.stats['received']}")
        print(f"  Matched: {self.stats['matched']}")
        print(f"  Timeouts: {self.stats['timeouts']}")
        print(f"  Parsing errors: {self.stats['parsing_errors']}")
        print(f"  Unexpected replies: {self.stats['unexpected_replies']}")
        print(f"  Success rate: {self.stats['matched']/max(1,self.stats['sent'])*100:.1f}%")
        print(f"  Buffer utilization: {len([p for p in self.received_packets if not p['processed']])}/{len(self.received_packets)}")

    def ping_loop(self, interval=1.0):
        print(f"Pinging {self.target_ip}...")
        print("(Press Ctrl+C to stop)")
        
        # Start background receiver
        self.running = True
        receiver_thread = threading.Thread(target=self.continuous_receive, daemon=True)
        receiver_thread.start()
        
        try:
            while True:
                result = self.send_ping(timeout=10)
                
                if result and result['success']:
                    print(f"Reply from {result['addr']}: seq={result['sequence']} TTL={result['ttl']} time={result['time']:.2f}ms")
                elif result and result.get('timeout'):
                    print(f"Request timed out for seq={result['sequence']}")
                else:
                    print(f"No reply for seq={self.sequence}")
                
                # Print stats every 10 pings
                if self.sequence % 10 == 0:
                    self.print_stats()
                
                time.sleep(interval)
                
        except KeyboardInterrupt:
            print("\nPing stopped.")
            self.print_stats()
        finally:
            self.running = False
            self.sock.close()

def main():
    target = "8.8.8.8" if len(sys.argv) < 2 else sys.argv[1]
    
    try:
        pinger = ICMPPingDebug(target)
        pinger.ping_loop()
    except Exception as e:
        print(f"Error: {e}")
        sys.exit(1)

if __name__ == "__main__":
    main()
```
</p>
</details>

<details>
<summary>
    Program output
</summary>
<p>

```
# Command: sudo $(which python) program.py A.B.C.D
Pinging A.B.C.D...
(Press Ctrl+C to stop)
Debug: Sent seq=1, id=42110, 44 bytes
Reply from A.B.C.D: seq=1 TTL=119 time=192.06ms
Debug: Sent seq=2, id=42110, 44 bytes
Request timed out for seq=2
Debug: Sent seq=3, id=42110, 44 bytes
Request timed out for seq=3
Debug: Sent seq=4, id=42110, 44 bytes
Request timed out for seq=4
Debug: Sent seq=5, id=42110, 44 bytes
Reply from A.B.C.D: seq=5 TTL=119 time=194.99ms
Debug: Sent seq=6, id=42110, 44 bytes
Request timed out for seq=6
Debug: Sent seq=7, id=42110, 44 bytes
Reply from A.B.C.D: seq=7 TTL=119 time=540.78ms
Debug: Sent seq=8, id=42110, 44 bytes
Reply from A.B.C.D: seq=8 TTL=119 time=200.75ms
Debug: Sent seq=9, id=42110, 44 bytes
Request timed out for seq=9
Debug: Sent seq=10, id=42110, 44 bytes
Request timed out for seq=10

Debug Stats:
Sent: 10
Received: 4
Matched: 4
Timeouts: 6
Parsing errors: 0
Unexpected replies: 0
Success rate: 40.0%
Buffer utilization: 0/4
```

</p>
</details>

<details>
<summary>
    <code>tcpdump</code> output
</summary>
<p>

```
# Command: sudo tcpdump -i any -n icmp
tcpdump: data link type LINUX_SLL2
tcpdump: verbose output suppressed, use -v[v]... for full protocol decode
listening on any, link-type LINUX_SLL2 (Linux cooked v2), snapshot length 262144 bytes
10:50:45.582024 eth0 Out IP 172.20.10.5 > A.B.C.D: ICMP echo request, id 42110, seq 1, length 44
10:50:45.773426 eth0 In IP A.B.C.D > 172.20.10.5: ICMP echo reply, id 42110, seq 1, length 44
10:50:46.781180 eth0 Out IP 172.20.10.5 > A.B.C.D: ICMP echo request, id 42110, seq 2, length 44
10:50:57.785714 eth0 Out IP 172.20.10.5 > A.B.C.D: ICMP echo request, id 42110, seq 3, length 44
10:51:08.787423 eth0 Out IP 172.20.10.5 > A.B.C.D: ICMP echo request, id 42110, seq 4, length 44
10:51:19.803674 eth0 Out IP 172.20.10.5 > A.B.C.D: ICMP echo request, id 42110, seq 5, length 44
10:51:19.997891 eth0 In IP A.B.C.D > 172.20.10.5: ICMP echo reply, id 42110, seq 5, length 44
10:51:21.010331 eth0 Out IP 172.20.10.5 > A.B.C.D: ICMP echo request, id 42110, seq 6, length 44
10:51:32.037884 eth0 Out IP 172.20.10.5 > A.B.C.D: ICMP echo request, id 42110, seq 7, length 44
10:51:32.578123 eth0 In IP A.B.C.D > 172.20.10.5: ICMP echo reply, id 42110, seq 7, length 44
10:51:33.605334 eth0 Out IP 172.20.10.5 > A.B.C.D: ICMP echo request, id 42110, seq 8, length 44
10:51:33.805753 eth0 In IP A.B.C.D > 172.20.10.5: ICMP echo reply, id 42110, seq 8, length 44
10:51:34.834397 eth0 Out IP 172.20.10.5 > A.B.C.D: ICMP echo request, id 42110, seq 9, length 44
10:51:45.842422 eth0 Out IP 172.20.10.5 > A.B.C.D: ICMP echo request, id 42110, seq 10, length 44
^C
16 packets captured
16 packets received by filter
0 packets dropped by kernel
```

</p>
</details>

<details>
<summary>
    Wireshark output
</summary>
<p>

```
42 12.359157 172.20.10.5 A.B.C.D ICMP 64 Echo (ping) request id=0xa47e, seq=1/256, ttl=64 (reply in 46)
46 12.549888 A.B.C.D 172.20.10.5 ICMP 64 Echo (ping) reply id=0xa47e, seq=1/256, ttl=119 (request in 42)
49 13.559105 172.20.10.5 A.B.C.D ICMP 64 Echo (ping) request id=0xa47e, seq=2/512, ttl=64 (reply in 58)
58 15.428854 A.B.C.D 172.20.10.5 ICMP 64 Echo (ping) reply id=0xa47e, seq=2/512, ttl=119 (request in 49)
185 24.582943 172.20.10.5 A.B.C.D ICMP 64 Echo (ping) request id=0xa47e, seq=3/768, ttl=64 (reply in 191)
191 26.650534 A.B.C.D 172.20.10.5 ICMP 64 Echo (ping) reply id=0xa47e, seq=3/768, ttl=119 (request in 185)
201 35.729946 172.20.10.5 A.B.C.D ICMP 64 Echo (ping) request id=0xa47e, seq=4/1024, ttl=64 (reply in 222)
222 40.540376 A.B.C.D 172.20.10.5 ICMP 64 Echo (ping) reply id=0xa47e, seq=4/1024, ttl=119 (request in 201)
266 46.761742 172.20.10.5 A.B.C.D ICMP 64 Echo (ping) request id=0xa47e, seq=5/1280, ttl=64 (reply in 276)
276 46.953845 A.B.C.D 172.20.10.5 ICMP 64 Echo (ping) reply id=0xa47e, seq=5/1280, ttl=119 (request in 266)
279 47.963440 172.20.10.5 A.B.C.D ICMP 64 Echo (ping) request id=0xa47e, seq=6/1536, ttl=64 (reply in 283)
283 52.668161 A.B.C.D 172.20.10.5 ICMP 64 Echo (ping) reply id=0xa47e, seq=6/1536, ttl=119 (request in 279)
487 58.776803 172.20.10.5 A.B.C.D ICMP 64 Echo (ping) request id=0xa47e, seq=7/1792, ttl=64 (reply in 493)
493 59.303708 A.B.C.D 172.20.10.5 ICMP 64 Echo (ping) reply id=0xa47e, seq=7/1792, ttl=119 (request in 487)
632 60.310739 172.20.10.5 A.B.C.D ICMP 64 Echo (ping) request id=0xa47e, seq=8/2048, ttl=64 (reply in 713)
713 60.505641 A.B.C.D 172.20.10.5 ICMP 64 Echo (ping) reply id=0xa47e, seq=8/2048, ttl=119 (request in 632)
2770 61.509724 172.20.10.5 A.B.C.D ICMP 64 Echo (ping) request id=0xa47e, seq=9/2304, ttl=64 (reply in 3623)
3623 62.336448 A.B.C.D 172.20.10.5 ICMP 64 Echo (ping) reply id=0xa47e, seq=9/2304, ttl=119 (request in 2770)
5547 72.530152 172.20.10.5 A.B.C.D ICMP 64 Echo (ping) request id=0xa47e, seq=10/2560, ttl=64 (reply in 5610)
5610 75.401666 A.B.C.D 172.20.10.5 ICMP 64 Echo (ping) reply id=0xa47e, seq=10/2560, ttl=119 (request in 5547)

```
</p>
</details>

## Analysis
### Test 1 - `ping`
| Seq | `ping` Result | Wireshark RTT | Wireshark Result | tcpdump Result (WSL) | Observation |
|:---:|:---|:---:|:---|:---|:---|
| 1 | **Success** (1073 ms) | 1072 ms | Arrived | Arrived | **Success** |
| 2 | **Lost** | 830 ms | Arrived | ***Did NOT Arrive*** | **Packet Lost by WSL2** |
| 3 | **Success** (1084 ms) | 1083 ms | Arrived | Arrived | **Success** |
| 4 | **Lost** | 192 ms | Arrived | ***Did NOT Arrive*** | **Packet Lost by WSL2** |
| 5 | **Success** (196 ms) | 195 ms | Arrived | Arrived | **Success** |
| 6 | **Success** (1040 ms) | 1039 ms | Arrived | Arrived | **Success** |
| 7 | **Success** (1007 ms) | 1006 ms | Arrived | Arrived | **Success** |
| 8 | **Success** (1007 ms) | 1005 ms | Arrived | Arrived | **Success** |
| 9 | **Success** (1007 ms) | 1006 ms | Arrived | Arrived | **Success** |
| 10 | **Success** (1009 ms) | 1007 ms | Arrived | Arrived | **Success** |
| 11 | **Lost** (Note 1) | 343 ms | Arrived | ***Did NOT Arrive*** | **Packet Lost by WSL2** |

### Test 2 - raw sockets
| Seq | Program Result | Wireshark RTT | Wireshark Result | tcpdump Result (WSL) | Observation |
|:---:|:---|:---|:---|:---|:---|
| 1 | **Success** (192 ms) | 191 ms | Arrived | Arrived | **Success** |
| 2 | **Timeout** | 1870 ms | Arrived | ***Did NOT Arrive*** | **Packet Lost by WSL2** |
| 3 | **Timeout** | 2068 ms | Arrived | ***Did NOT Arrive*** | **Packet Lost by WSL2** |
| 4 | **Timeout** | 4810 ms | Arrived | ***Did NOT Arrive*** | **Packet Lost by WSL2** |
| 5 | **Success** (195 ms) | 192 ms | Arrived | Arrived | **Success** |
| 6 | **Timeout** | 4705 ms | Arrived | ***Did NOT Arrive*** | **Packet Lost by WSL2** |
| 7 | **Success** (541 ms) | 527 ms | Arrived | Arrived | **Success** |
| 8 | **Success** (201 ms) | 195 ms | Arrived | Arrived | **Success** |
| 9 | **Timeout** | 827 ms | Arrived | ***Did NOT Arrive*** | **Packet Lost by WSL2** |
| 10 | **Timeout** | 2871 ms | Arrived | ***Did NOT Arrive*** | **Packet Lost by WSL2** |

According to Wireshark, all the packets are arriving, but they appear to be getting lost by WSL 2. With the `ping` tool, the lost packets don't seem correlated to Wireshark's RTT. However, with the raw sockets, packets with a higher RTT do appear to be getting dropped. Without the VPN enabled, packet loss is virtually 0% in both tests (average RTT ~10 ms). It's not clear to me whether it's caused by the interaction between the VPN's interface and WSL, or high RTT/congestion, but hopefully this could lead to better replication of the issue.

WSL version: 2.4.11.0
Networking mode: Mirrored.

**Comment by aaronshenhao** [comment]
TLDR; The issue (at least in my case) is caused by packets being blocked by Windows Firewall. The easiest way to test this is to disable Windows Firewall with `netsh advfirewall set allprofiles state off` and try it again. I get 0% packet loss after doing so.

The symptoms suggest a timing-dependent bug in VFP's packet processing where high-latency networks make the issue more likely to occur (likely a race condition).

## Test 3 - log inspection

I ran a separate test with the WSL collection tool and filtered `logs.etl` for lines which contained the destination IP address or "ICMP" (case-insensitive). In this test, seq 4 and seq 13 got dropped. The lines that correspond to the actual dropped packets (in terms of time, frequency and order) seem to be these:

### Sequence 4
> [04]0004.8018::2025-08-03 ***12:45:09.474440300*** [Microsoft-Windows-Hyper-V-VfpExt] Block rule with ID {C761F2A3-729E-4AF4-B74F-CEA59EF8F7D9}_LOCAL processed inbound packets on port 2 (Name = A8D1AA24-7D81-4553-80BE-7D76F5887F4E, FriendlyName = A8D1AA24-7D81-4553-80BE-7D76F5887F4E) with status = Unknown NTSTATUS Error code: 0x10003 and statusLocation = 0: flow id {src ip = 8.8.8.8, dst ip = 10.2.0.2, protocol = 1, icmp type = V4EchoReply }, rule {layer = MPSSVC_VFP_LAYER_FW, group = MPSSVC_VFP_GROUP_IPV4_IN, rule id = {C761F2A3-729E-4AF4-B74F-CEA59EF8F7D9}_LOCAL, gftFlags = 0}


Wireshark arrival time for seq = 3: 12:45:07.989074000
Wireshark arrival time for seq = 4: ***12:45:09.474382000***
Wireshark arrival time for seq = 5: 12:45:20.448934000

### Sequence 13:
> [06]0004.8018::2025-08-03 ***12:45:33.113407000*** [Microsoft-Windows-Hyper-V-VfpExt] Block rule with ID {C761F2A3-729E-4AF4-B74F-CEA59EF8F7D9}_LOCAL processed inbound packets on port 2 (Name = A8D1AA24-7D81-4553-80BE-7D76F5887F4E, FriendlyName = A8D1AA24-7D81-4553-80BE-7D76F5887F4E) with status = Unknown NTSTATUS Error code: 0x10003 and statusLocation = 0: flow id {src ip = 8.8.8.8, dst ip = 10.2.0.2, protocol = 1, icmp type = V4EchoReply }, rule {layer = MPSSVC_VFP_LAYER_FW, group = MPSSVC_VFP_GROUP_IPV4_IN, rule id = {C761F2A3-729E-4AF4-B74F-CEA59EF8F7D9}_LOCAL, gftFlags = 0} 

Wireshark arrival time for seq = 12: 12:45:31.522640000
Wireshark arrival time for seq = 13: ***12:45:33.113155000***
Wireshark arrival time for seq = 14: 12:45:44.524061000

There were only 6 such events in the log, the first two corresponding to 12:45:09, the second to 12:45:33, and the third to 12:45:57 (test concluded by then).

There were other "inspection drop" events, but these were numerous and did not correspond to the actual dropped packets. Example:
> [00]0004.8018::2025-08-03 12:45:57.614158200 [Microsoft-Windows-TCPIP] ICMP : Receive path drop on interface 2. Type = Echo Reply , Code = 0, Reason = Inspection drop , Status = The packet should be dropped, no ICMP should be sent., CompartmentId = 1, SourceAddress = 8.8.8.8, DestAddress = 10.2.0.2.

The filtered log: [filtered_log.txt](https://github.com/user-attachments/files/21563946/filtered_log.txt)

--- 
Steps for creating the filtered log file:
1. Run the steps here: https://github.com/microsoft/WSL/blob/master/CONTRIBUTING.md#collect-wsl-logs-for-networking-issues
2. Extract log with `pktmon format logs.etl -o logs-etl.txt`
3. The packet monitor (pktmon) tool outputs UTF-16, so `grep` does not work. I wasted a bit of time figuring out what was going on. To produce the same filtered file, run the Python script below (produced by Claude 4): 
<details>
<summary><code>filter-code.py</code></summary>
<p>

```py
#!/usr/bin/env python3
import re
import os

# File paths
input_file = "logs-etl.txt"
output_file = "filtered-8888-icmp.txt"

# Pattern to match 8.8.8.8 or ICMP (case insensitive)
pattern = re.compile(r'8\.8\.8\.8|icmp', re.IGNORECASE)

print(f"Filtering log file: {input_file}")
print(f"Output file: {output_file}")

try:
    # Try different encodings
    encodings_to_try = ['utf-16', 'utf-16-le', 'utf-8', 'cp1252']
    
    for encoding in encodings_to_try:
        try:
            print(f"Trying encoding: {encoding}")
            with open(input_file, 'r', encoding=encoding, errors='ignore') as infile:
                # Read a small sample to test
                sample = infile.read(1000)
                if 'Event: Header' in sample:  # Check if this looks like our log file
                    print(f"Successfully reading with encoding: {encoding}")
                    infile.seek(0)  # Reset to beginning
                    
                    with open(output_file, 'w', encoding='utf-8') as outfile:
                        line_count = 0
                        matched_lines = 0
                        
                        for line in infile:
                            line_count += 1
                            if pattern.search(line):
                                outfile.write(line)
                                matched_lines += 1
                            
                            # Progress indicator
                            if line_count % 10000 == 0:
                                print(f"Processed {line_count} lines, found {matched_lines} matches...")
                        
                        print(f"Filtering complete!")
                        print(f"Total lines processed: {line_count}")
                        print(f"Lines matching filter: {matched_lines}")
                        print(f"Filtered log saved to: {output_file}")
                        break
                else:
                    print(f"Encoding {encoding} doesn't seem to work")
        except UnicodeDecodeError:
            print(f"UnicodeDecodeError with {encoding}")
            continue
        except Exception as e:
            print(f"Error with encoding {encoding}: {e}")
            continue
    else:
        print("Could not find a working encoding for the file")

except FileNotFoundError:
    print(f"Error: Could not find input file {input_file}")
except Exception as e:
    print(f"Error: {e}")
```

</p>
</details>

**Comment by 83nf15h** [comment]
I appear to have a very similar issue. Under WSLv2 with mirrored networking mode I get increasing packet loss correlated with RTT for the traffic. I initially thought it may be due to Large Send Offload (LSO) or Receive Segment Coalescing (RSC) but I still see the issue with them disabled.

**Base Windows:**
```
Ping statistics for 172.<VPN address>:
    Packets: Sent = 7866, Received = 7860, Lost = 6 (0% loss),
Approximate round trip times in milli-seconds:
    Minimum = 250ms, Maximum = 344ms, Average = 257ms
```

```
Ping statistics for (google.com)192.178.188.101: 
Packets: Sent = 2431, Received = 2428, Lost = 3 (0% loss), 
Approximate round trip times in milli-seconds: 
Minimum = 13ms, Maximum = 82ms, Average = 20ms 
```

**Ubuntu under WSLv1**
```
--- 172.<VPN address> ping statistics ---
6708 packets transmitted, 6693 received, 0.223614% packet loss, time 6706740ms
rtt min/avg/max/mdev = 416.271/425.843/489.272/6.610 ms
```

```
--- google.com ping statistics ---
362 packets transmitted, 362 received, 0% packet loss, time 361356ms
rtt min/avg/max/mdev = 15.337/20.164/48.300/3.731 ms
```

**Ubuntu under WSLv2 with Mirrored Networking**
```
--- 172.<VPN address> ping statistics --- 
2987 packets transmitted, 1828 received, 38.8015% packet loss, time 3008168ms 
rtt min/avg/max/mdev = 324.783/374.474/527.403/50.025 ms 
```

```
--- google.com ping statistics --- 
2802 packets transmitted, 2703 received, 3.53319% packet loss, time 2805884ms 
rtt min/avg/max/mdev = 14.158/21.382/91.866/5.175 ms 
```

```
--- telstra.com ping statistics --- 
2192 packets transmitted, 2120 received, 3.28467% packet loss, time 2194370ms 
rtt min/avg/max/mdev = 15.577/23.105/89.710/5.218 ms 
```

```
--- 10.1.1.1 (Gateway) ping statistics --- 
70 packets transmitted, 70 received, 0% packet loss, time 69115ms 
rtt min/avg/max/mdev = 1.066/1.784/2.671/0.273 ms
```

I would really prefer to use WSLv2 as the DNS features with mirrored networking mode fix several problems we have with WSLv1, however 30-50% packet loss is a hard pill to swallow to get better DNS... Turning off the firewall is not an available workaround in my case. 

Are there any firewall rules that could help to mitigate the problem? 

Any other suggested workarounds or information I can provide that could help isolate the issue to develop a fix?
