### ISSUE TITLE
WSL2 networkingMode=mirrored connection timed out when going over two VPNs

### ISSUE THREAD

**Issue by marbaa** [microsoft/WSL#12309]
### Windows Version

Microsoft Windows [Version 10.0.22631.4317]

### WSL Version

2.3.26.0

### Are you using WSL 1 or WSL 2?

- [x] WSL 2
- [ ] WSL 1

### Kernel Version

5.15.167.4-1

### Distro Version

Debian 11

### Repro Steps

1. Enable mirrored networking
2. Connect via VPN (Cisco AnyConnect)
3. Connect via second VPN (CheckPoint Securemote) - new routes for target networks are added
4. Make ssh from windows cmd - works
5. Make ssh from any WSL2 distro - connection timed out

We use AnyConnect to connect to company network. To access target servers, we need to further connect to other VPN with Checkpoint.
ssh to servers located on first VPN works with mirrored mode from WSL2 distro.
ssh to servers located behind second VPN doesn't work from WSL2 distro.

**However ssh to servers behind second VPN works from windows cmd.**

Routes from Windows are propagated into WSL2 distro, also destination ip is shown in route table through same gateway ip.
Doesn't matter in which order I connect to second VPN/wsl --shutdown.

### Expected Behavior

Working ssh connection from WSL2 distro with mirrored network.

### Actual Behavior

Timed out connection from WSL2 distro with mirrored network.

**Comment by marbaa** [comment]
I'm unable to collect network logs as it is secured corporate notebook.

```
PS C:\> Get-NetRoute -DestinationPrefix "6.151.100.0/23"

ifIndex DestinationPrefix                              NextHop                                  RouteMetric ifMetric PolicyStore
------- -----------------                              -------                                  ----------- -------- -----------
46      6.151.100.0/23                                 10.128.0.1                                         1          ActiveStore


PS C:\>
PS C:\> ssh 6.151.101.242 -l test
This server was flagged as default-system on deployment.
test@6.151.101.242's password:
```

WSL2:
```
$ ip r get 6.151.101.242
6.151.101.242 via 10.128.0.1 dev eth1 src 10.128.0.2 uid 1000
    cache
$ ssh 6.151.101.242
ssh: connect to host 6.151.101.242 port 22: Connection timed out
$
$ ip a s eth1
3: eth1: <BROADCAST,MULTICAST,UP,LOWER_UP> mtu 1350 qdisc mq state UP group default qlen 1000
    link/ether 54:73:cf:79:21:0f brd ff:ff:ff:ff:ff:ff
    inet 10.128.0.2/30 brd 10.128.0.3 scope global noprefixroute eth1
```

WSL2 tcpdump
```
$ sudo tcpdump -vni eth1
tcpdump: listening on eth1, link-type EN10MB (Ethernet), snapshot length 262144 bytes
20:49:51.118532 ARP, Ethernet (len 6), IPv4 (len 4), Reply 10.128.0.1 is-at 44:55:4d:4d:59:2d, length 28
20:49:52.072705 ARP, Ethernet (len 6), IPv4 (len 4), Reply 10.128.0.1 is-at 44:55:4d:4d:59:2d, length 28
20:49:57.308445 IP (tos 0x0, ttl 64, id 36368, offset 0, flags [DF], proto TCP (6), length 60)
    10.128.0.2.45103 > 6.151.101.242.22: Flags [S], cksum 0x7739 (incorrect -> 0x89a9), seq 1169495868, win 65500, options [mss 1310,sackOK,TS val 649860114 ecr 0,nop,wscale 7], length 0
20:49:58.311997 IP (tos 0x0, ttl 64, id 36369, offset 0, flags [DF], proto TCP (6), length 60)
    10.128.0.2.45103 > 6.151.101.242.22: Flags [S], cksum 0x7739 (incorrect -> 0x85bd), seq 1169495868, win 65500, options [mss 1310,sackOK,TS val 649861118 ecr 0,nop,wscale 7], length 0
20:50:00.391997 IP (tos 0x0, ttl 64, id 36370, offset 0, flags [DF], proto TCP (6), length 60)
    10.128.0.2.45103 > 6.151.101.242.22: Flags [S], cksum 0x7739 (incorrect -> 0x7d9d), seq 1169495868, win 65500, options [mss 1310,sackOK,TS val 649863198 ecr 0,nop,wscale 7], length 0
20:50:04.472098 IP (tos 0x0, ttl 64, id 36371, offset 0, flags [DF], proto TCP (6), length 60)
    10.128.0.2.45103 > 6.151.101.242.22: Flags [S], cksum 0x7739 (incorrect -> 0x6dad), seq 1169495868, win 65500, options [mss 1310,sackOK,TS val 649867278 ecr 0,nop,wscale 7], length 0
20:50:12.552164 IP (tos 0x0, ttl 64, id 36372, offset 0, flags [DF], proto TCP (6), length 60)
    10.128.0.2.45103 > 6.151.101.242.22: Flags [S], cksum 0x7739 (incorrect -> 0x4e1d), seq 1169495868, win 65500, options [mss 1310,sackOK,TS val 649875358 ecr 0,nop,wscale 7], length 0
20:50:29.192140 IP (tos 0x0, ttl 64, id 36373, offset 0, flags [DF], proto TCP (6), length 60)
    10.128.0.2.45103 > 6.151.101.242.22: Flags [S], cksum 0x7739 (incorrect -> 0x0d1d), seq 1169495868, win 65500, options [mss 1310,sackOK,TS val 649891998 ecr 0,nop,wscale 7], length 0
20:50:34.232018 ARP, Ethernet (len 6), IPv4 (len 4), Request who-has 10.128.0.1 tell 10.128.0.2, length 28
20:50:34.232355 ARP, Ethernet (len 6), IPv4 (len 4), Reply 10.128.0.1 is-at 44:55:4d:4d:59:2d, length 28
20:51:01.832147 IP (tos 0x0, ttl 64, id 36374, offset 0, flags [DF], proto TCP (6), length 60)
    10.128.0.2.45103 > 6.151.101.242.22: Flags [S], cksum 0x7739 (incorrect -> 0x8d9c), seq 1169495868, win 65500, options [mss 1310,sackOK,TS val 649924638 ecr 0,nop,wscale 7], length 0
20:51:06.871981 ARP, Ethernet (len 6), IPv4 (len 4), Request who-has 10.128.0.1 tell 10.128.0.2, length 28
20:51:06.872473 ARP, Ethernet (len 6), IPv4 (len 4), Reply 10.128.0.1 is-at 44:55:4d:4d:59:2d, length 28
20:51:35.300243 ARP, Ethernet (len 6), IPv4 (len 4), Reply 10.128.0.1 is-at 44:55:4d:4d:59:2d, length 28
20:51:37.408764 ARP, Ethernet (len 6), IPv4 (len 4), Reply 10.128.0.1 is-at 44:55:4d:4d:59:2d, length 28
20:51:38.410895 ARP, Ethernet (len 6), IPv4 (len 4), Reply 10.128.0.1 is-at 44:55:4d:4d:59:2d, length 28
^C
16 packets captured
16 packets received by filter
0 packets dropped by kernel
```

**Comment by marbaa** [comment]
[WslLogs-2024-11-23_12-36-05.zip](https://github.com/user-attachments/files/17879519/WslLogs-2024-11-23_12-36-05.zip)
Attached logs from collect-wsl-logs.ps1.

collect-networking-logs.ps1 is bugged. After i press any key, it produces some error and when creating zip file, it deletes all files without creating any .log file.

```
> .\collect-networking-logs.ps1

                                                                                                                                                                                                                                                                                                                Directory: C:\Users\xxx\Downloads                                                                                                                                                                                                                                                                                                                                                                                                                                                                                                                                                                                                                                                                                                                                                                                                                                                                                          Mode                 LastWriteTime         Length Name                                                                                                                                                                                                                                                      ----                 -------------         ------ ----                                                                                                                                                                                                                                                      d-----      23. 11. 2024     12:48                WslNetworkingLogs-2024-11-23_12-48-43                                                                                                                                                                                                                     wsl_networking.wprp not found in the current directory. Downloading it from GitHub.                                                                                                                                                                                                                         networking.sh not found in the current directory. Downloading it from GitHub.                                                                                                                                                                                                                                                                                                                                                                                                                                                                                                                                           Initializing data collection -- please wait.                                                                                                                                                                                                                                                                Initialization complete. Reproduce the scenario, then run 'capture stop'.                                                                                                                                                                                                                                   
Log collection is running. Please reproduce the problem and press any key to save the logs.
Saving logs...
/bin/bash: line 1: killall: command not found
Wait-Process : This command stopped operation because process "wsl (15872)" is not stopped in the specified time-out.
At C:\Users\xxx\Downloads\collect-networking-logs.ps1:264 char:13

Data collection successful; output = WslNetworkingLogs-2024-11-23_12-48-43/wfpdiag.cab

100%  [>>>>>>>>>>>>>>>>>>>>>>>>>>>>>>>>>>>>>>>>>>>>>>>>>>>>>>>>>>>>]

ZipArchiveHelper : The process cannot access the file 'C:\Users\xxx\Downloads\WslNetworkingLogs-2024-11-23_12-48-43\tcpdump.log' because it is being used by another process.
At C:\Windows\system32\WindowsPowerShell\v1.0\Modules\Microsoft.PowerShell.Archive\Microsoft.PowerShell.Archive.psm1:697 char:30
+ ... sArchived = ZipArchiveHelper $subDirFiles.ToArray() $destinationPath  ...
+                 ~~~~~~~~~~~~~~~~~~~~~~~~~~~~~~~~~~~~~~~~~~~~~~~~~~~~~~~~~
    + CategoryInfo          : PermissionDenied: (C:\Users\xxx...-43\tcpdump.log:String) [Write-Error], IOException
    + FullyQualifiedErrorId : CompressArchiveUnauthorizedAccessError,ZipArchiveHelper

New-Object : Exception calling ".ctor" with "1" argument(s): "Stream was not readable."
At C:\Windows\system32\WindowsPowerShell\v1.0\Modules\Microsoft.PowerShell.Archive\Microsoft.PowerShell.Archive.psm1:808 char:38
+ ...     $srcStream = New-Object System.IO.BinaryReader $currentFileStream
+                      ~~~~~~~~~~~~~~~~~~~~~~~~~~~~~~~~~~~~~~~~~~~~~~~~~~~~
    + CategoryInfo          : InvalidOperation: (:) [New-Object], MethodInvocationException
    + FullyQualifiedErrorId : ConstructorInvokedThrowException,Microsoft.PowerShell.Commands.NewObjectCommand

Logs saved in: C:\Users\xxx\Downloads\WslNetworkingLogs-2024-11-23_12-48-43.zip
```

**Comment by marbaa** [comment]
After I closed external tcpdump window manually, not by 'press any key' from window where script was exectuted, .zip file was created.
It has 28MB, can't upload it here.

**Comment by marbaa** [comment]
[WslNetworkingLogs-2024-11-23_13-16-58.zip](https://github.com/user-attachments/files/17879624/WslNetworkingLogs-2024-11-23_13-16-58.zip)

**Comment by lifetraveler** [comment]
try `networkingmode=nat`,say goodbye to mirrored

**Comment by ymuuuu** [comment]
> try `networkingmode=nat`,say goodbye to mirrored

so it is like an update or smth that happened ? cause it used to work fine before ?

**Comment by marbaa** [comment]
@lifetraveler not for me. I want to use usb wifi adapter in WSL2, beside integrated notebook wifi but I'm not willing to compile own kernel to enable loading modules.
@ymuuuu NAT is default networking mode in WSL2, so if you use ```networkingmode=nat``` or omit it in config file, it is the same.

**Comment by ymuuuu** [comment]
> @lifetraveler not for me. I want to use usb wifi adapter in WSL2, beside integrated notebook wifi but I'm not willing to compile own kernel to enable loading modules.
> 
> @ymuuuu NAT is default networking mode in WSL2, so if you use ```networkingmode=nat``` or omit it in config file, it is the same.

yes i understand that and I have set it to mirrored but not functioning as it should
check my issue
[https://github.com/microsoft/WSL/issues/12317](12317)

**Comment by marbaa** [comment]
Seems this is another dead issue which won't be solved anytime.

**Comment by marbaa** [comment]
Made update of WSL. SSH still not working to networks behind second VPN.

```
WSL version: 2.5.9.0
Kernel version: 6.6.87.2-1
WSLg version: 1.0.66
MSRDC version: 1.2.6074
Direct3D version: 1.611.1-81528511
DXCore version: 10.0.26100.1-240331-1435.ge-release
Windows version: 10.0.22631.5335
```

@craigloewen-msft @benhillis  Can somebody from MS have a look on it? There are a lot of threads about it on internet, even older than my bugreport. I would say such environment is pretty standard also in other companies and this fix would be really helpful.

**Comment by marbaa** [comment]
Just made a test in office, where no 1st VPN is active. SSH doesn't work from mirrored WSL2 to networks behind Checkpoint VPN. So probably WSL2 is not compatible with Securemote Checkpoint VPN.
Changing MTU in WSL2 doesn't help.

**Comment by 951mmm** [comment]
same issue. mirrored ssh always high latency

**Comment by marbaa** [comment]
Update to this unfixable issue. Securemote Checkpoint VPN still not compatible with WSL.
Workaround with ```ignoredPorts``` doesn't work.

```
[experimental]
ignoredPorts=22
```

```
wsl --version
WSL version: 2.6.3.0
Kernel version: 6.6.87.2-1
WSLg version: 1.0.71
MSRDC version: 1.2.6353
Direct3D version: 1.611.1-81528511
DXCore version: 10.0.26100.1-240331-1435.ge-release
Windows version: 10.0.26100.7781
```
