### ISSUE TITLE
Networking mirrored can't access to windows by 127.0.0.1:port with WSL2

### ISSUE THREAD

**Issue by msojocs** [microsoft/WSL#11312]
### Windows Version

Microsoft Windows [版本 10.0.22631.3296]

### WSL Version

 2.1.5.0

### Are you using WSL 1 or WSL 2?

- [X] WSL 2
- [ ] WSL 1

### Kernel Version

5.15.146.1-microsoft-standard-WSL2

### Distro Version

ubuntu 20.04

### Other Software

Docker desktop was uninstalled from the windows system.

### Repro Steps

# Information

My laptop's IP is `192.168.0.102` in WLAN.

Is was worked for me before. But after I reset my system, I can not make it work again.

1. Start a clash app with port `7890`
2. Go into the wsl environment
3. Execute command `telnet 127.0.0.1 7890`
4. Not connected

# First

## .wslconfig

```
[wsl2]
networkingMode=mirrored
```

## commands and result

<details>
<summary>detail</summary>

```
msojocs@DESKTOP-1TV4OAG:~$ ip a
1: lo: <LOOPBACK,UP,LOWER_UP> mtu 65536 qdisc noqueue state UNKNOWN group default qlen 1000
    link/loopback 00:00:00:00:00:00 brd 00:00:00:00:00:00
    inet 127.0.0.1/8 scope host lo
       valid_lft forever preferred_lft forever
    inet6 ::1/128 scope host
       valid_lft forever preferred_lft forever
2: eth0: <BROADCAST,MULTICAST,UP,LOWER_UP> mtu 1500 qdisc mq state UP group default qlen 1000
    link/ether 00:50:56:c0:00:08 brd ff:ff:ff:ff:ff:ff
    inet6 fe80::9c5b:a645:98b4:bfc2/64 scope link noprefixroute
       valid_lft forever preferred_lft forever
3: eth1: <NO-CARRIER,BROADCAST,MULTICAST,UP> mtu 1500 qdisc mq state DOWN group default qlen 1000
    link/ether da:80:83:b3:d6:cb brd ff:ff:ff:ff:ff:ff
4: eth2: <BROADCAST,MULTICAST,UP,LOWER_UP> mtu 1500 qdisc mq state UP group default qlen 1000
    link/ether 00:50:56:c0:00:01 brd ff:ff:ff:ff:ff:ff
    inet6 fe80::de9f:1113:2891:d898/64 scope link noprefixroute
       valid_lft forever preferred_lft forever
5: loopback0: <BROADCAST,MULTICAST,UP,LOWER_UP> mtu 1500 qdisc mq state UP group default qlen 1000
    link/ether 00:15:5d:e1:6c:93 brd ff:ff:ff:ff:ff:ff
    inet6 fe80::3b9f:eb69:8d5e:9e71/64 scope link noprefixroute
       valid_lft forever preferred_lft forever
6: eth3: <BROADCAST,MULTICAST,UP,LOWER_UP> mtu 1500 qdisc mq state UP group default qlen 1000
    link/ether d8:80:83:b3:d6:cb brd ff:ff:ff:ff:ff:ff
    inet 192.168.0.102/24 brd 192.168.0.255 scope global noprefixroute eth3
       valid_lft forever preferred_lft forever
    inet6 fe80::7df1:6f90:3370:4cd1/64 scope link nodad noprefixroute
       valid_lft forever preferred_lft forever
7: eth4: <NO-CARRIER,BROADCAST,MULTICAST,UP> mtu 1500 qdisc mq state DOWN group default qlen 1000
    link/ether fa:80:83:b3:d6:cb brd ff:ff:ff:ff:ff:ff
8: eth5: <NO-CARRIER,BROADCAST,MULTICAST,UP> mtu 1500 qdisc mq state DOWN group default qlen 1000
    link/ether ea:80:83:b3:d6:cb brd ff:ff:ff:ff:ff:ff
msojocs@DESKTOP-1TV4OAG:~$ telnet 127.0.0.1 7890
Trying 127.0.0.1...
telnet: Unable to connect to remote host: Connection refused
msojocs@DESKTOP-1TV4OAG:~$ telnet 192.168.0.102 7890
Trying 192.168.0.102...
telnet: Unable to connect to remote host: Connection refused
msojocs@DESKTOP-1TV4OAG:~$
```

</details>

# Second

## .wslconfig

```
[wsl2]
networkingMode=mirrored
[experimental]
hostAddressLoopback=true
```

## commands and result

<details>
<summary>detail</summary>

```
msojocs@DESKTOP-1TV4OAG:~$ ip a
1: lo: <LOOPBACK,UP,LOWER_UP> mtu 65536 qdisc noqueue state UNKNOWN group default qlen 1000
    link/loopback 00:00:00:00:00:00 brd 00:00:00:00:00:00
    inet 127.0.0.1/8 scope host lo
       valid_lft forever preferred_lft forever
    inet6 ::1/128 scope host
       valid_lft forever preferred_lft forever
2: eth0: <BROADCAST,MULTICAST,UP,LOWER_UP> mtu 1500 qdisc mq state UP group default qlen 1000
    link/ether 00:50:56:c0:00:08 brd ff:ff:ff:ff:ff:ff
    inet6 fe80::9c5b:a645:98b4:bfc2/64 scope link noprefixroute
       valid_lft forever preferred_lft forever
3: eth1: <BROADCAST,MULTICAST,UP,LOWER_UP> mtu 1500 qdisc mq state UP group default qlen 1000
    link/ether da:80:83:b3:d6:cb brd ff:ff:ff:ff:ff:ff
    inet6 fe80::bf84:bc17:2e88:c5c0/64 scope link noprefixroute
       valid_lft forever preferred_lft forever
4: eth2: <BROADCAST,MULTICAST,UP,LOWER_UP> mtu 1500 qdisc mq state UP group default qlen 1000
    link/ether 00:50:56:c0:00:01 brd ff:ff:ff:ff:ff:ff
    inet6 fe80::de9f:1113:2891:d898/64 scope link noprefixroute
       valid_lft forever preferred_lft forever
5: loopback0: <BROADCAST,MULTICAST,UP,LOWER_UP> mtu 1500 qdisc mq state UP group default qlen 1000
    link/ether 00:15:5d:e1:6c:93 brd ff:ff:ff:ff:ff:ff
    inet6 fe80::3b9f:eb69:8d5e:9e71/64 scope link noprefixroute
       valid_lft forever preferred_lft forever
6: eth3: <BROADCAST,MULTICAST,UP,LOWER_UP> mtu 1500 qdisc mq state UP group default qlen 1000
    link/ether d8:80:83:b3:d6:cb brd ff:ff:ff:ff:ff:ff
    inet 192.168.0.102/24 brd 192.168.0.255 scope global noprefixroute eth3
       valid_lft forever preferred_lft forever
    inet6 fe80::7df1:6f90:3370:4cd1/64 scope link nodad noprefixroute
       valid_lft forever preferred_lft forever
7: eth4: <NO-CARRIER,BROADCAST,MULTICAST,UP> mtu 1500 qdisc mq state DOWN group default qlen 1000
    link/ether fa:80:83:b3:d6:cb brd ff:ff:ff:ff:ff:ff
8: eth5: <NO-CARRIER,BROADCAST,MULTICAST,UP> mtu 1500 qdisc mq state DOWN group default qlen 1000
    link/ether ea:80:83:b3:d6:cb brd ff:ff:ff:ff:ff:ff
msojocs@DESKTOP-1TV4OAG:~$ telnet 127.0.0.1 7890
Trying 127.0.0.1...
telnet: Unable to connect to remote host: Connection refused
msojocs@DESKTOP-1TV4OAG:~$ telnet 192.168.0.102 7890
Trying 192.168.0.102...
Connected to 192.168.0.102.
Escape character is '^]'.
```

</details>

### Expected Behavior

The command `telnet 127.0.0.1 7890` can success.

### Actual Behavior

The command `telnet 127.0.0.1 7890` is failed.

### Diagnostic Logs

# Log

## Collected log

Steps:

1. execute `wsl --shutdown`
2. execute `.\collect-networking-logs.ps1`
3. execute `wsl`
4. execute `curl 127.0.0.1:7890`
5. execute `telnet 127.0.0.1 7890`
6. execute `telnet 192.168.0.102 7890`

[WslNetworkingLogs-2024-03-16_15-43-33.zip](https://github.com/microsoft/WSL/files/14622814/WslNetworkingLogs-2024-03-16_15-43-33.zip)

## Other

```
cat /etc/resolv.conf
# This file was automatically generated by WSL. To stop automatic generation of this file, add the following entry to /etc/wsl.conf:
# [network]
# generateResolvConf = false
nameserver 180.76.76.76
nameserver 223.6.6.6
```

**Comment by msojocs** [comment]
Afte view this issue (https://github.com/microsoft/WSL/issues/10632), I have checked the port binding in wsl:

1. execute `python -m http.server --bind 0.0.0.0` with windows, success
2. execute `python3 -m http.server --bind 0.0.0.0` with wsl, failed.

![image](https://github.com/microsoft/WSL/assets/20937135/4b6bba2d-5516-4864-aeaf-54ee2ed15006)

**Comment by pmartincic** [comment]
What do you get from `netstat -an | findstr /c:"7890" | findstr /c:"LISTENING"`?

**Comment by msojocs** [comment]
> What do you get from `netstat -an | findstr /c:"7890" | findstr /c:"LISTENING"`?

This is the result.

![image](https://github.com/microsoft/WSL/assets/20937135/cb73ce42-b68e-4c7b-ab65-ca9c6d50e385)

**Comment by pffang** [comment]
Similar issue.
If I kill all WSL processes and restart it, I can access Windows localhost:port again.
But if I leave it running for hours, I cannot access Windows localhost:port from WSL.

**Comment by msojocs** [comment]
> Similar issue. If I kill all WSL processes and restart it, I can access Windows localhost:port again. But if I leave it running for hours, I cannot access Windows localhost:port from WSL.

This method does not work for me.

**Comment by keith-horton** [comment]
If you want to connect to the host from the WSL container by the IP address assigned you'll need to connect to 127.0.01. If you want to connect to the assigned address, you need to set [experimental] hostAddressLoopback=true (see https://learn.microsoft.com/en-us/windows/wsl/wsl-config#experimental-configuration-settings).

But in the original repro, it was sent to 127.0.0.1, so that's valid.
We see a RST immediately returned.

15:44:12.145100 IP 127.0.0.1.60816 > 127.0.0.1.7890: Flags [S], seq 2455237139, win 65495, options [mss 65495,sackOK,TS val 260823200 ecr 0,nop,wscale 7], length 0
15:44:12.145107 IP 127.0.0.1.7890 > 127.0.0.1.60816: Flags [R.], seq 0, ack 2455237140, win 0, length 0

Everything else looks setup correctly (Hyper-V Firewall is setup correctly).
This suggests one of 2 things that I can see:
1. the app wasn't bound & listening to that port at the time
2. Cisco's VMWare solution has filters that are causing issues
    (I only bring up VMWare as we have observed many interop issues in the past).

**Comment by msojocs** [comment]
> If you want to connect to the host from the WSL container by the IP address assigned you'll need to connect to 127.0.01. If you want to connect to the assigned address, you need to set [experimental] hostAddressLoopback=true (see https://learn.microsoft.com/en-us/windows/wsl/wsl-config#experimental-configuration-settings).
> 
> But in the original repro, it was sent to 127.0.0.1, so that's valid. We see a RST immediately returned.
> 
> 15:44:12.145100 IP 127.0.0.1.60816 > 127.0.0.1.7890: Flags [S], seq 2455237139, win 65495, options [mss 65495,sackOK,TS val 260823200 ecr 0,nop,wscale 7], length 0 15:44:12.145107 IP 127.0.0.1.7890 > 127.0.0.1.60816: Flags [R.], seq 0, ack 2455237140, win 0, length 0
> 
> Everything else looks setup correctly (Hyper-V Firewall is setup correctly). This suggests one of 2 things that I can see:
> 
> 1. the app wasn't bound & listening to that port at the time
> 2. Cisco's VMWare solution has filters that are causing issues
>    (I only bring up VMWare as we have observed many interop issues in the past).

I have uninstalled the VMWare just now and reboot the computer, but it still not work.

I think the app was bound the port at the time, because I can not access google without this proxy (google was blocked in my country).

And now I can access google(port is work in host), but `telnet 127.0.0.1 7890` still can not work with wsl.

**Comment by pffang** [comment]
> If you want to connect to the host from the WSL container by the IP address assigned you'll need to connect to 127.0.01. If you want to connect to the assigned address, you need to set [experimental] hostAddressLoopback=true (see https://learn.microsoft.com/en-us/windows/wsl/wsl-config#experimental-configuration-settings).
> 
> But in the original repro, it was sent to 127.0.0.1, so that's valid. We see a RST immediately returned.
> 
> 15:44:12.145100 IP 127.0.0.1.60816 > 127.0.0.1.7890: Flags [S], seq 2455237139, win 65495, options [mss 65495,sackOK,TS val 260823200 ecr 0,nop,wscale 7], length 0 15:44:12.145107 IP 127.0.0.1.7890 > 127.0.0.1.60816: Flags [R.], seq 0, ack 2455237140, win 0, length 0
> 
> Everything else looks setup correctly (Hyper-V Firewall is setup correctly). This suggests one of 2 things that I can see:
> 
>     1. the app wasn't bound & listening to that port at the time
> 
>     2. Cisco's VMWare solution has filters that are causing issues
>        (I only bring up VMWare as we have observed many interop issues in the past).

But I used mirrored mode and no VMWare.

**Comment by GitUser200607** [comment]
I did not changed anything and a couple of days ago all worked well.

**Comment by wangyw6716** [comment]
Try executing the command 
``` 
sudo systemctl disable network-manager.service
```
 followed by running wsl.exe --shutdown in PowerShell, and then restart WSL again.

**Comment by msojocs** [comment]
> Try executing the command
> 
> ```
> sudo systemctl disable network-manager.service
> ```
> 
> followed by running wsl.exe --shutdown in PowerShell, and then restart WSL again.

Ohhh!!!

It is working now. Thank you very much.

![image](https://github.com/microsoft/WSL/assets/20937135/67f0ea98-e0e2-4970-b197-ce2fc0af52d1)

**Comment by wangyw6716** [comment]
> > Try executing the command
> > ```
> > sudo systemctl disable network-manager.service
> > ```
> > 
> > 
> >     
> >       
> >     
> > 
> >       
> >     
> > 
> >     
> >   
> > followed by running wsl.exe --shutdown in PowerShell, and then restart WSL again.
> 
> Ohhh!!!
> 
> It is working now. Thank you very much.
> 
> ![image](https://private-user-images.githubusercontent.com/20937135/318367074-67f0ea98-e0e2-4970-b197-ce2fc0af52d1.png?jwt=eyJhbGciOiJIUzI1NiIsInR5cCI6IkpXVCJ9.eyJpc3MiOiJnaXRodWIuY29tIiwiYXVkIjoicmF3LmdpdGh1YnVzZXJjb250ZW50LmNvbSIsImtleSI6ImtleTUiLCJleHAiOjE3MTE5NTY3MDcsIm5iZiI6MTcxMTk1NjQwNywicGF0aCI6Ii8yMDkzNzEzNS8zMTgzNjcwNzQtNjdmMGVhOTgtZTBlMi00OTcwLWIxOTctY2UyZmMwYWY1MmQxLnBuZz9YLUFtei1BbGdvcml0aG09QVdTNC1ITUFDLVNIQTI1NiZYLUFtei1DcmVkZW50aWFsPUFLSUFWQ09EWUxTQTUzUFFLNFpBJTJGMjAyNDA0MDElMkZ1cy1lYXN0LTElMkZzMyUyRmF3czRfcmVxdWVzdCZYLUFtei1EYXRlPTIwMjQwNDAxVDA3MjY0N1omWC1BbXotRXhwaXJlcz0zMDAmWC1BbXotU2lnbmF0dXJlPWE5NTE3N2NhZjk5NGM5ZTMzOTAyNmJlOWM3NmIyNjNhMzhjZTM0Y2FhZmYyNzU5MmRmZGQ1YzY3YTc0ZGRmODgmWC1BbXotU2lnbmVkSGVhZGVycz1ob3N0JmFjdG9yX2lkPTAma2V5X2lkPTAmcmVwb19pZD0wIn0.1V9JzYWfeyS0rqQPVm3ENSlcbMhlzaAK2ZaB_gGQjxw)

I tried disabling every service until I reached network-manager.service, and finally, the mirrored functionality started working properly. It took me a significant amount of time to figure this out.

**Comment by msojocs** [comment]
solved.

**Comment by yunus-sun** [comment]
> Try executing the command
> 
> ```
> sudo systemctl disable network-manager.service
> ```
> 
> followed by running wsl.exe --shutdown in PowerShell, and then restart WSL again.

Similar issue. It works for me. Thanks so much!

**Comment by qgyhd1234** [comment]
> Try executing the command
> 
> ```
> sudo systemctl disable network-manager.service
> ```
> 
> followed by running wsl.exe --shutdown in PowerShell, and then restart WSL again.


Solved my problem, thanks

**Comment by Kutius** [comment]
> Try executing the command
> 
> ```
> sudo systemctl disable network-manager.service
> ```
> 
> followed by running wsl.exe --shutdown in PowerShell, and then restart WSL again.

Failed to disable unit: Unit file network-manager.service does not exist.😢

**Comment by gsxgoldenlegendary** [comment]
> > Try executing the command
> > ```
> > sudo systemctl disable network-manager.service
> > ```
> > 
> > 
> >     
> >       
> >     
> > 
> >       
> >     
> > 
> >     
> >   
> > followed by running wsl.exe --shutdown in PowerShell, and then restart WSL again.
> 
> Failed to disable unit: Unit file network-manager.service does not exist.😢

The NetworkManager service has been named NetworkManager. You can see https://askubuntu.com/questions/1371275/where-has-the-network-manager-service-in-21-10-gone for details.

**Comment by Kutius** [comment]
> > > Try executing the command
> > > ```
> > > sudo systemctl disable network-manager.service
> > > ```
> > > 
> > > 
> > >     
> > >       
> > >     
> > > 
> > >       
> > >     
> > > 
> > >     
> > >   
> > > followed by running wsl.exe --shutdown in PowerShell, and then restart WSL again.
> > 
> > 
> > Failed to disable unit: Unit file network-manager.service does not exist.😢
> 
> The NetworkManager service has been named NetworkManager. You can see https://askubuntu.com/questions/1371275/where-has-the-network-manager-service-in-21-10-gone for details.

Unlucky😢😢, it also show: `Failed to disable unit: Unit file NetworkManager.service does not exist.`

**Comment by Clark-G** [comment]
> > > > Try executing the command
> > > > ```
> > > > sudo systemctl disable network-manager.service
> > > > ```
> > > > 
> > > > 
> > > >     
> > > >       
> > > >     
> > > > 
> > > >       
> > > >     
> > > > 
> > > >     
> > > >   
> > > > followed by running wsl.exe --shutdown in PowerShell, and then restart WSL again.
> > > 
> > > 
> > > Failed to disable unit: Unit file network-manager.service does not exist.😢
> > 
> > 
> > The NetworkManager service has been named NetworkManager. You can see https://askubuntu.com/questions/1371275/where-has-the-network-manager-service-in-21-10-gone for details.
> 
> Unlucky😢😢, it also show: `Failed to disable unit: Unit file NetworkManager.service does not exist.`

same issue here

**Comment by fillwithjoy1** [comment]
I have no idea what's happening here but I'm using XAMPP and it has the feature to check all open sockets and it's reporting here
![image](https://github.com/user-attachments/assets/1fa9eafd-52e8-4638-9ece-ffeb03cebac7)
that despite my ssh config being set to 0.0.0.0, it only binds to localhost (aka 127.0.0.1)

**Comment by calloftimereiver** [comment]
> Try executing the command
> 
> ```
> sudo systemctl disable network-manager.service
> ```
> 
> followed by running wsl.exe --shutdown in PowerShell, and then restart WSL again.

works for me , many thanks!!!
