### ISSUE TITLE
Packet loss between WSL2 container and host

### ISSUE THREAD

**Issue by gozdal** [microsoft/WSL#5530]
# Environment

```none
Microsoft Windows NT 10.0.19041.0
Ubuntu 20.04
Linux version 4.19.104-microsoft-standard (oe-user@oe-host) (gcc version 8.2.0 (GCC)) #1 SMP Wed Feb 19 06:37:35 UTC 2020
```

# Steps to reproduce

From Linux run `ping` or `mtr` against the IP of Windows. Observe for 5 minutes.

#  Expected behavior

No packet loss.

# Actual behavior

2-3% packet loss.

```none
                                 My traceroute  [v0.93]
X1Gozdala (172.23.204.221)                                     2020-07-03T10:26:50+0200
Keys:  Help   Display mode   Restart statistics   Order of fields   quit
                                               Packets               Pings
  Host                                        Loss%   Snt   Last   Avg  Best  Wrst StDev
  1. 172.23.192.1                              2.1%   243    0.5   0.4   0.2   1.2   0.1
  2. 172.31.42.144                             1.7%   242    0.3   0.4   0.3   1.4   0.1 
```

`ifconfig -a` on Linux:
```
root@X1Gozdala:~# ifconfig -a
bond0: flags=5122<BROADCAST,MASTER,MULTICAST>  mtu 1500
        ether 36:xx:xx:xx:xx:xx  txqueuelen 1000  (Ethernet)
        RX packets 0  bytes 0 (0.0 B)
        RX errors 0  dropped 0  overruns 0  frame 0
        TX packets 0  bytes 0 (0.0 B)
        TX errors 0  dropped 0 overruns 0  carrier 0  collisions 0

dummy0: flags=130<BROADCAST,NOARP>  mtu 1500
        ether 26:xx:xx:xx:xx:xx  txqueuelen 1000  (Ethernet)
        RX packets 0  bytes 0 (0.0 B)
        RX errors 0  dropped 0  overruns 0  frame 0
        TX packets 0  bytes 0 (0.0 B)
        TX errors 0  dropped 0 overruns 0  carrier 0  collisions 0

eth0: flags=4163<UP,BROADCAST,RUNNING,MULTICAST>  mtu 1500
        inet 172.23.204.221  netmask 255.255.240.0  broadcast 172.23.207.255
        inet6 fe80::xxx:xxxx:xxxx:xxxx  prefixlen 64  scopeid 0x20<link>
        ether 00:xx:xx:xx:xx:xx  txqueuelen 1000  (Ethernet)
        RX packets 112969  bytes 161271354 (161.2 MB)
        RX errors 0  dropped 0  overruns 0  frame 0
        TX packets 33617  bytes 2237958 (2.2 MB)
        TX errors 0  dropped 0 overruns 0  carrier 0  collisions 0

lo: flags=73<UP,LOOPBACK,RUNNING>  mtu 65536
        inet 127.0.0.1  netmask 255.0.0.0
        inet6 ::1  prefixlen 128  scopeid 0x10<host>
        loop  txqueuelen 1000  (Local Loopback)
        RX packets 0  bytes 0 (0.0 B)
        RX errors 0  dropped 0  overruns 0  frame 0
        TX packets 0  bytes 0 (0.0 B)
        TX errors 0  dropped 0 overruns 0  carrier 0  collisions 0

sit0: flags=128<NOARP>  mtu 1480
        sit  txqueuelen 1000  (IPv6-in-IPv4)
        RX packets 0  bytes 0 (0.0 B)
        RX errors 0  dropped 0  overruns 0  frame 0
        TX packets 0  bytes 0 (0.0 B)
        TX errors 0  dropped 0 overruns 0  carrier 0  collisions 0```
```

`ipconfig` on Windows:
```
Ethernet adapter vEthernet (Default Switch):

   Connection-specific DNS Suffix  . :
   Link-local IPv6 Address . . . . . : fe80::xxx:xxx:xxxx:xxxx%28
   IPv4 Address. . . . . . . . . . . : 172.20.192.1
   Subnet Mask . . . . . . . . . . . : 255.255.240.0
   Default Gateway . . . . . . . . . :

Ethernet adapter vEthernet (WSL):

   Connection-specific DNS Suffix  . :
   Link-local IPv6 Address . . . . . : fe80::xxxx:xxxx:xxxx:xxxx%50
   IPv4 Address. . . . . . . . . . . : 172.23.192.1
   Subnet Mask . . . . . . . . . . . : 255.255.240.0
   Default Gateway . . . . . . . . . :

Ethernet adapter Ethernet:

   Connection-specific DNS Suffix  . : dom
   IPv6 Address. . . . . . . . . . . : 2001:xxx:xxxx::xxx
   IPv6 Address. . . . . . . . . . . : 2001:xxx:xxxx:x:xxx:xxxx:xxxx:xxxx
   IPv6 Address. . . . . . . . . . . : fd3f:xxxx:xxxx::xxx
   IPv6 Address. . . . . . . . . . . : fd3f:xxxx:xxxx:x:xxxx:xxxx:xxxx:xxxx
   Temporary IPv6 Address. . . . . . : 2001:xxx:xxxx:x:xxxx:xxxx:xxxx:xxxx
   Temporary IPv6 Address. . . . . . : fd3f:xxxx:xxxx:x:xxxx:xxxx:xxxx:xxxx
   Link-local IPv6 Address . . . . . : fe80::xxxx:xxxx:xxxx:xxxx%38
   IPv4 Address. . . . . . . . . . . : 172.31.42.144
   Subnet Mask . . . . . . . . . . . : 255.255.255.0
   Default Gateway . . . . . . . . . : fe80::xxxx:xxxx:xxxx:xxxx%38
                                       172.31.42.1
```

**Comment by therealkenc** [comment]
I wasn't able to reproduce this here. Tried `mtr` for 30 minutes and even a flood `ping`. Excellent submission though, thank-you. This could explain #4946 and maybe #5069, if in some cases the ip frame drop rate was high enough rather than 2-3%.

For the data point, what is the loss you get with a flood ping:

```
$ sudo ping -f <host ipv4 addr>
```

![image](https://user-images.githubusercontent.com/7049700/86469542-7aff2000-bcee-11ea-9a1e-6c2bf43b3f36.png)

**Comment by gozdal** [comment]
I *can't* reproduce it with `ping -f` (tried 2 times for 2 minutes). However, did a tcpdump on the Linux side with straight `ping x1gozdala.dom`, together with `tcpdump -i eth0 icmp -s0 -w packet-loss.pcap` in the other console. It seems that the ICMP packets are not *sent* at all:
`ping x1gozdala.dom`:
```none
PING x1gozdala.dom (172.31.42.144) 56(84) bytes of data.
64 bytes from X1Gozdala.dom (172.31.42.144): icmp_seq=1 ttl=127 time=0.367 ms
64 bytes from X1Gozdala.dom (172.31.42.144): icmp_seq=2 ttl=127 time=0.542 ms
64 bytes from X1Gozdala.dom (172.31.42.144): icmp_seq=3 ttl=127 time=0.422 ms
64 bytes from X1Gozdala.dom (172.31.42.144): icmp_seq=4 ttl=127 time=0.395 ms
64 bytes from X1Gozdala.dom (172.31.42.144): icmp_seq=5 ttl=127 time=0.410 ms
64 bytes from X1Gozdala.dom (172.31.42.144): icmp_seq=6 ttl=127 time=0.345 ms
64 bytes from X1Gozdala.dom (172.31.42.144): icmp_seq=7 ttl=127 time=0.394 ms
64 bytes from X1Gozdala.dom (172.31.42.144): icmp_seq=8 ttl=127 time=0.430 ms
64 bytes from X1Gozdala.dom (172.31.42.144): icmp_seq=9 ttl=127 time=0.351 ms
64 bytes from X1Gozdala.dom (172.31.42.144): icmp_seq=10 ttl=127 time=0.404 ms
64 bytes from X1Gozdala.dom (172.31.42.144): icmp_seq=11 ttl=127 time=0.400 ms
64 bytes from X1Gozdala.dom (172.31.42.144): icmp_seq=12 ttl=127 time=0.546 ms
64 bytes from X1Gozdala.dom (172.31.42.144): icmp_seq=13 ttl=127 time=0.390 ms
64 bytes from X1Gozdala.dom (172.31.42.144): icmp_seq=14 ttl=127 time=0.259 ms
64 bytes from X1Gozdala.dom (172.31.42.144): icmp_seq=15 ttl=127 time=0.594 ms
64 bytes from X1Gozdala.dom (172.31.42.144): icmp_seq=16 ttl=127 time=0.410 ms
64 bytes from X1Gozdala.dom (172.31.42.144): icmp_seq=17 ttl=127 time=0.550 ms
64 bytes from X1Gozdala.dom (172.31.42.144): icmp_seq=18 ttl=127 time=0.575 ms
64 bytes from X1Gozdala.dom (172.31.42.144): icmp_seq=19 ttl=127 time=0.247 ms
64 bytes from X1Gozdala.dom (172.31.42.144): icmp_seq=20 ttl=127 time=0.411 ms
64 bytes from X1Gozdala.dom (172.31.42.144): icmp_seq=21 ttl=127 time=0.269 ms
64 bytes from X1Gozdala.dom (172.31.42.144): icmp_seq=22 ttl=127 time=0.406 ms
64 bytes from X1Gozdala.dom (172.31.42.144): icmp_seq=23 ttl=127 time=0.294 ms
64 bytes from X1Gozdala.dom (172.31.42.144): icmp_seq=24 ttl=127 time=0.416 ms
64 bytes from X1Gozdala.dom (172.31.42.144): icmp_seq=25 ttl=127 time=0.340 ms
64 bytes from X1Gozdala.dom (172.31.42.144): icmp_seq=26 ttl=127 time=0.443 ms
64 bytes from X1Gozdala.dom (172.31.42.144): icmp_seq=27 ttl=127 time=0.531 ms
64 bytes from X1Gozdala.dom (172.31.42.144): icmp_seq=28 ttl=127 time=0.410 ms
64 bytes from X1Gozdala.dom (172.31.42.144): icmp_seq=29 ttl=127 time=0.387 ms
64 bytes from X1Gozdala.dom (172.31.42.144): icmp_seq=30 ttl=127 time=0.386 ms
64 bytes from X1Gozdala.dom (172.31.42.144): icmp_seq=31 ttl=127 time=0.287 ms
64 bytes from X1Gozdala.dom (172.31.42.144): icmp_seq=32 ttl=127 time=0.501 ms
64 bytes from X1Gozdala.dom (172.31.42.144): icmp_seq=33 ttl=127 time=0.364 ms
64 bytes from X1Gozdala.dom (172.31.42.144): icmp_seq=34 ttl=127 time=0.268 ms
64 bytes from X1Gozdala.dom (172.31.42.144): icmp_seq=35 ttl=127 time=0.535 ms
64 bytes from X1Gozdala.dom (172.31.42.144): icmp_seq=36 ttl=127 time=0.393 ms
64 bytes from X1Gozdala.dom (172.31.42.144): icmp_seq=37 ttl=127 time=0.402 ms
64 bytes from X1Gozdala.dom (172.31.42.144): icmp_seq=40 ttl=127 time=0.411 ms
64 bytes from X1Gozdala.dom (172.31.42.144): icmp_seq=41 ttl=127 time=0.575 ms
```

There is a gap between seq=37 and 40. Pcap shows:
![obraz](https://user-images.githubusercontent.com/619444/86472212-575bca00-bd2e-11ea-9960-356a6453eb75.png)

It's driving me mad working on remote SSH hosts (the loss of connectivity for 2-3 seconds is really annoying).
What can I do help you understand this problem?

**Comment by gozdal** [comment]
Ran ping flood a little longer. There is packet loss but much smaller:
`gozdal@X1Gozdala:~$ sudo ping -f x1gozdala.dom`
```
PING x1gozdala.dom (172.31.42.144) 56(84) bytes of data.
..........................................................................................................................................................................................................................................................................................................................................................................................................................................................................................................................................................................................................................................................................................................................................................................................................................................................................................................................................................................................................................................................................................................................................................................................................................................................................................................................................................................................................................................................................................^C
--- x1gozdala.dom ping statistics ---
5253344 packets transmitted, 5251908 received, 0.027335% packet loss, time 1473859ms
rtt min/avg/max/mdev = 0.078/0.208/27.727/0.268 ms, pipe 8, ipg/ewma 0.280/0.490 ms
```

**Comment by Spongman** [comment]
not sure if it's relatvd, but i'm seeing the same thing. just started recently:

````
64 bytes from 10.0.3.1: icmp_seq=59 ttl=64 time=0.852 ms
64 bytes from 10.0.3.1: icmp_seq=60 ttl=64 time=0.981 ms
64 bytes from 10.0.3.1: icmp_seq=106 ttl=64 time=1.05 ms
64 bytes from 10.0.3.1: icmp_seq=107 ttl=64 time=0.938 ms
64 bytes from 10.0.3.1: icmp_seq=108 ttl=64 time=0.749 ms
64 bytes from 10.0.3.1: icmp_seq=109 ttl=64 time=0.964 ms
64 bytes from 10.0.3.1: icmp_seq=110 ttl=64 time=0.781 ms
64 bytes from 10.0.3.1: icmp_seq=111 ttl=64 time=0.631 ms
64 bytes from 10.0.3.1: icmp_seq=112 ttl=64 time=0.974 ms
64 bytes from 10.0.3.1: icmp_seq=113 ttl=64 time=0.663 ms
64 bytes from 10.0.3.1: icmp_seq=114 ttl=64 time=0.861 ms
64 bytes from 10.0.3.1: icmp_seq=115 ttl=64 time=0.845 ms
64 bytes from 10.0.3.1: icmp_seq=154 ttl=64 time=0.964 ms
64 bytes from 10.0.3.1: icmp_seq=155 ttl=64 time=0.763 ms
64 bytes from 10.0.3.1: icmp_seq=156 ttl=64 time=1.02 ms
````

**Comment by aliask** [comment]
I think I'm also running into this issue - although I'm seeing ~30% packet loss - totally unusable.
```
--- 8.8.8.8 ping statistics ---
505 packets transmitted, 342 received, +105 errors, 32.2772% packet loss, time 514203ms
rtt min/avg/max/mdev = 6.231/362.228/2123.556/644.623 ms, pipe 4
```

Also seeing the same behaviour in tcpdump missing the outgoing packets:
```
10:18:55.021878 IP 172.18.199.22 > 8.8.8.8: ICMP echo request, id 6, seq 480, length 64
10:18:55.034308 IP 8.8.8.8 > 172.18.199.22: ICMP echo reply, id 6, seq 480, length 64
10:19:00.180566 IP 172.18.199.22 > 8.8.8.8: ICMP echo request, id 6, seq 484, length 64 <--- where are 481-483?
10:19:00.180623 IP 172.18.199.22 > 8.8.8.8: ICMP echo request, id 6, seq 485, length 64
10:19:00.193324 IP 8.8.8.8 > 172.18.199.22: ICMP echo reply, id 6, seq 484, length 64
```

`ping -f` has lower rate of issues on mine too.

`ver` output: `Microsoft Windows [Version 10.0.19043.1165]`

**Comment by maksyms** [comment]
I've just easily reproduced it, pinging github.com from WSLg and PowerShell, both on Win11.
Windows 11, PowerShell, `ping -t github.com`:
![image](https://user-images.githubusercontent.com/595059/141779134-3d65bb76-ef03-4878-a397-c74411455b1f.png)
Windows 11, WSLg, `ping github.com`:
![image](https://user-images.githubusercontent.com/595059/141779200-651a91f0-3b29-4245-b60e-71080935e558.png)

**Comment by devrev-jo** [comment]
I'm seeing the same on Azure Virtual Desktop with Windows 10 and WSL 2. Any pointers would be appreciated.
