### ISSUE TITLE
Mirrored networking: localhost (127.0.0.1) TCP connections never complete inside WSL2 while NAT mode works normally

### ISSUE THREAD

**Issue by wasabiumai** [microsoft/WSL#41102]
### Windows Version

Windows 11 25H2 (OS Build 26200.8875)

### WSL Version

WSL version: 2.9.4.0

### Are you using WSL 1 or WSL 2?

- [x] WSL 2
- [ ] WSL 1

### Kernel Version

6.18.35.2-microsoft-standard-WSL2

### Distro Version

Ubuntu 22.04.5 LTS

### Other Software

- Windows 11 Version 25H2 (OS Build 26200.8875)
- WSL version: 2.9.4.0
- Linux kernel: 6.18.35.2-microsoft-standard-WSL2
- Distribution: Ubuntu XX.XX LTS (replace with the output of lsb_release -a)
- .wslconfig:

```
[wsl2]
networkingMode=mirrored

[experimental]
hostAddressLoopback=true
```

The issue occurs only in mirrored networking. Switching to networkingMode=nat makes the problem disappear.

### Repro Steps

1. Configure WSL with:
```
[wsl2]
networkingMode=mirrored

[experimental]
hostAddressLoopback=true
```

2. Restart WSL.
`wsl --shutdown`

3. Start a TCP server inside WSL.
```
import socket

s = socket.socket()
s.bind(("127.0.0.1", 12345))
print("bind")
s.listen()
print("listen")

c, addr = s.accept()
print("accepted", addr)
```
The program prints:
```
bind
listen
```

4. Open another WSL terminal and connect:
`nc 127.0.0.1 12345`
or
```
import socket
s = socket.socket()
s.connect(("127.0.0.1", 12345))
```

### Expected Behavior

The TCP connection should complete successfully.

The client should connect immediately, and the server should print:

`accepted ('127.0.0.1', <port>)`

This is exactly what happens when using networkingMode=nat.

### Actual Behavior

The client blocks indefinitely while trying to connect.

The server remains blocked in accept().

The TCP three-way handshake never completes.

The problem occurs only when networkingMode=mirrored is enabled.

### Diagnostic Logs

**Listening socket**
```
$ ss -ltnp | grep 12345
LISTEN 0 1 0.0.0.0:12345
```
**Routing**
```
$ ip route get 127.0.0.2

local 127.0.0.2 dev lo table local src 127.0.0.1
```
```
$ ip route show table local

local 127.0.0.0/8 dev lo
local 127.0.0.1 dev lo
...
```
The routing table appears to be correct.

**tcpdump**
Capturing traffic inside WSL while attempting to connect:
```
127.0.0.1.45044 > 127.0.0.1.12345: Flags [S]
127.0.0.1.45044 > 127.0.0.1.12345: Flags [S]
127.0.0.1.45044 > 127.0.0.1.12345: Flags [S]
...
```
Only SYN packets are observed. No SYN-ACK is generated, so the TCP handshake never completes.

Earlier during debugging, I also observed Windows replying with a TCP RST using an unexpected source port, but after further configuration changes the behavior changed to repeated SYN retransmissions only.

**Additional observations**

- The issue is reproducible with both Python sockets and netcat, so it does not appear to be ROS 2 specific.
- hostAddressLoopback=true does not change the behavior.
- wsl --update --pre-release reports that WSL is already up to date.
- Switching to networkingMode=nat immediately resolves the problem without changing the application.

**Additional Information**

This issue appears to be a regression.

The same WSL configuration (networkingMode=mirrored) worked correctly until approximately one week ago.

I left my PC running for several days for remote desktop access. When I returned, Windows had automatically restarted. After that restart, localhost TCP connections inside WSL stopped working in mirrored networking mode.

According to Windows Update history, the following updates were installed on 2026-07-15:

- KB5101650 (Security Update)
- KB5120102 (Security Update)
- KB5100998 (Update)

The issue started immediately after this automatic restart. I cannot determine which update introduced the regression.

Regression: Yes

**Comment by chemwolf6922** [comment]
Hi @wasabiumai . I'm not able to repro this locally probably due to different Windows build number or KBs. Could you please collect log following the bot's suggestion? Thanks.
Please use the network log profile.

**Comment by chemwolf6922** [comment]
To identify if any of the updates introduced this regression. You could uninstall the updates one by one follow the instructions here https://support.microsoft.com/en-US/Windows/Deployment/Updates-Lifecycle/how-to-uninstall-a-windows-update. And try if any uninstallation resolves the issue.

**Comment by wasabiumai** [comment]
Thanks for the suggestion.

I have an update.

I uninstalled the following Windows updates:

   - KB5094126
   - KB5087051

After uninstalling them and rebooting Windows, the issue is no longer
reproducible.

Localhost TCP connections in networkingMode=mirrored now work correctly
again.

This strongly suggests that one of these Windows updates introduced the
regression.

I have not yet determined which specific update is responsible because I
uninstalled both before testing.

2026年7月17日(金) 15:11 Feng Wang ***@***.***>:

**Comment by chemwolf6922** [comment]
Thanks for the info. I'll report this issue to the broader team since the fix likely lies outside of WSL.

**Comment by Dark-Matter7232** [comment]
I believe I'm hitting what appears to be another manifestation of the same mirrored networking regression, but in my case it surfaced as a completely unrelated application failure.

### Environment

- Windows 11 Pro Insider Preview 26200.8875
- WSL 2.9.4.0
- Linux kernel 7.1.3

### Background

I was debugging an STM32 target using the VS Code Cortex-Debug extension under WSL2. The extension internally creates a small local TCP server on `127.0.0.1` (typically choosing a port in the `55xxx-62xxx` range).

Initially, the debugger failed with a generic error. After tracing the extension's source code, I found it was failing because the underlying `bind()` call was returning `EADDRINUSE`. I was able to reproduce this completely independently of VS Code and Cortex-Debug.

### Minimal reproducer (Node.js)

```js
const net = require("net");

const server = net.createServer();

server.listen(60000, "127.0.0.1", () => {
    console.log("OK");
});

server.on("error", console.error);
```

With `networkingMode=mirrored`:

```
Error: listen EADDRINUSE: address already in use 127.0.0.1:60000
```

### Python reproducer

```python
import socket

s = socket.socket()
s.bind(("127.0.0.1", 60000))
print("OK")
```

With mirrored networking:

```
OSError: [Errno 98] Address already in use
```

### Additional observations

- `ss -ltnp`, `lsof`, and `/proc/net/tcp` inside WSL show nothing listening on the affected ports.
- `Get-NetTCPConnection -LocalPort 60000` on Windows also reports nothing listening.
- Low ports (for example `12345`) bind successfully.
- High ports consistently fail. I tested:

```
55000
56000
57000
58000
59000
60000
61000
62000
```

Every one of them returns `EADDRINUSE` under mirrored networking.

I also noticed that `netsh int ipv4 show excludedportrange protocol=tcp` showed dynamically changing excluded port ranges. Restarting the WinNAT service temporarily cleared them before they reappeared, although the ports that failed to bind were not necessarily inside the currently excluded ranges.

### Workaround

Changing `.wslconfig` to:

```ini
[wsl2]
networkingMode=NAT
```

followed by:

```powershell
wsl --shutdown
```

immediately fixes the issue.

The exact same Node.js and Python programs successfully bind to all of the above ports, and the Cortex-Debug extension also starts working correctly.

This appears to be another localhost regression specific to mirrored networking. I'm not sure whether it shares the same root cause as this issue, but it seems related since applications are unable to create localhost TCP listeners even though neither Linux nor Windows reports anything actually listening on those ports.

**Comment by ferale90** [comment]
I was able to pin down the exact drop point using `pktmon` (built into Windows, no install needed), which might help narrow down the root cause.

**Setup**: WSL 2.7.11.0, kernel 6.18.33.2-2, Windows build 10.0.26200.8894 (25H2), `networkingMode=mirrored`. Reproduced with a plain TCP server on the Windows host listening on a port, and `curl -m 5 http://127.0.0.1:<port>` from inside WSL, which times out silently (no RST, nothing in the classic Windows Firewall log even with `LogBlocked` enabled on all profiles).

**Repro with pktmon**:
```
pktmon filter add repro -p <port>
pktmon start --capture --comp all --type all --pkt-size 0 -f trace.etl
# reproduce the timeout from WSL
pktmon stop
pktmon etl2txt trace.etl -o trace.txt
```

The `.txt` output is UTF-16LE.

**Finding**: right before the drop, the actual SYN packet is visible:

```
127.0.0.1.<ephemeral> > 127.0.0.1.<port>: Flags [S], ...
```

i.e. **both source and destination IP are 127.0.0.1**. Immediately after, pktmon logs:

```
Drop: ... DropReason INET: land attack ...
```

emitted by `tcpip.sys` on the IP input path bound to the Hyper-V vSwitch NIC used for the mirrored localhost proxy (filter driver `vfpext.sys`, same as used by HNS for NAT/ACL).

This strongly suggests the mirrored-mode localhost-forwarding component re-injects the WSL-originated packet into the Windows host TCP/IP stack **without rewriting the source address**, so it still shows up as `127.0.0.1 -> 127.0.0.1`. Windows' native anti-spoofing check in `tcpip.sys` then classifies this as a "land attack" (source IP == destination IP) and silently discards it before any firewall or application-level evaluation happens — which matches the "no SYN-ACK, nothing in any log" behavior reported here. This would also explain why it's IPv4-specific in my testing (IPv6 `[::1]` gave an immediate connection-refused instead of a silent timeout — a different, presumably working, code path).

Not a fix, but hopefully useful to whoever picks this up — happy to share the raw pktmon trace if it helps.

NOTE: This comment was AI generated. Hope to be helpful!

**Comment by chemwolf6922** [comment]
Hi @Dark-Matter7232 .
Your issue is a known regression which blocked wsl from binding any port in the host ephemeral port range. Which by default will be the high 16384 ports. This is fixed in https://github.com/microsoft/WSL/pull/41085.

**Comment by chemwolf6922** [comment]
Hi @ferale90 . Could you please collect wsl log with the networking profile enabled while repro the issue? Thanks. 
```
.\collect_wsl-logs.ps1 -LogProfile networking
```

**Comment by chemwolf6922** [comment]
Hi @wasabiumai .
If you could repro the issue. Please help collect and share wsl log with the networking profile. Thanks.
```
.\collect_wsl-logs.ps1 -LogProfile networking
```
