### ISSUE TITLE
WSL NetworkMode mirrored unable to connect to Windows host via TCP

### ISSUE THREAD

**Issue by go2sh** [microsoft/WSL#40343]
### Windows Version

Microsoft Windows [Version 10.0.22631.6936]

### WSL Version

2.6.3.0

### Are you using WSL 1 or WSL 2?

- [x] WSL 2
- [ ] WSL 1

### Kernel Version

6.6.87.2-microsoft-standard-WSL2+

### Distro Version

Ubuntu 26.04

### Other Software

* Windows App Running TCP server on 20000
* Linux python script connecting to localhost:20000

### Repro Steps

When a WSL2 client attempts to connect to a Windows host application via 127.0.0.1 in mirrored networking mode, the TCP handshake fails because the Windows network stack returns the SYN-ACK to a different ephemeral port than the one the SYN was sent from. The Linux kernel does not match the SYN-ACK to the original socket and responds with RST, making it impossible to establish a connection to Windows host services via loopback.

This happens even with hostAddressLoopback=true set in .wslconfig.

1. Set networkingMode=mirrored and hostAddressLoopback=true in %USERPROFILE%\.wslconfig
2. Run wsl --shutdown and restart WSL
3. Start a TCP server on Windows host listening on port 20000 (e.g. any app bound to 0.0.0.0:20000)
4. From WSL, attempt to connect to 127.0.0.1:20000: `nc -v 127.0.0.1 20000`
5. Capture traffic in WSL: `sudo tcpdump -i any -n port 20000`

### Expected Behavior

The TCP three-way handshake completes successfully:
```
WSL (port X)     →  SYN    →  Windows:20000
WSL (port X)     ←  SYN-ACK ←  Windows:20000
WSL (port X)     →  ACK    →  Windows:20000
```
The SYN-ACK should be addressed back to the same source port that sent the SYN, allowing the Linux kernel to match it to the existing socket and complete the connection.

### Actual Behavior

The SYN-ACK is returned to a different port than the one that sent the SYN, causing the Linux kernel to send RST and drop the connection:
```
WSL (port 41264)  →  SYN      →  Windows:20000   ✅
WSL (port 36677)  ←  SYN-ACK  ←  Windows:20000   ❌ wrong port!
WSL (port 36677)  →  RST      →  Windows:20000   ❌ connection dropped
```
The connection never establishes. The Windows app keeps retransmitting SYN-ACK to incorrect ports, each time receiving a RST from the Linux kernel.

### Diagnostic Logs

`tcpdump` output from WSL during connection attempt:
```
13:24:14.179902 loopback0 Out IP 127.0.0.1.41264 > 127.0.0.1.20000: Flags [S], seq 2406906390, win 64240, options [mss 1460,sackOK,TS val 3610728993 ecr 0,nop,wscale 7], length 0
13:24:14.180534 loopback0 In  IP 127.0.0.1.20000 > 127.0.0.1.36677: Flags [S.], seq 2977463670, ack 2406906391, win 8192, options [mss 65495,nop,wscale 8,sackOK,TS val 6756090 ecr 3610728993], length 0
13:24:14.180569 loopback0 Out IP 127.0.0.1.36677 > 127.0.0.1.20000: Flags [R], seq 2406906391, win 0, length 0
13:24:15.192632 loopback0 In  IP 127.0.0.1.20000 > 127.0.0.1.35723: Flags [S.], seq 2977463670, ack 2406906391, win 8192, options [mss 65495,nop,wscope 8,sackOK,TS val 6757102 ecr 3610728993], length 0
13:24:15.192678 loopback0 Out IP 127.0.0.1.35723 > 127.0.0.1.20000: Flags [R], seq 2406906391, win 0, length 0
13:24:17.195141 loopback0 In  IP 127.0.0.1.33820 > 127.0.0.1.20000: Flags [S.], seq 2977463670, ack 2406906391, win 8192, options [mss 65495,nop,wscale 8,sackOK,TS val 6759105 ecr 3610728993], length 0
13:24:17.195186 loopback0 Out IP 127.0.0.1.33820 > 127.0.0.1.20000: Flags [R], seq 2406906391, win 0, length 0
```

`.wslconfig`:
```
[wsl2]
networkingMode=mirrored
kernel=C:\\Users\\User\\vmlinux

[experimental]
hostAddressLoopback=true
```

**Comment by MX1951** [comment]
I can reproduce the same issue on my machine.


## Environment

Windows: 10.0.29576.1000  
WSL: 2.7.3.0  
Kernel: 6.6.114.1-1  
Distro: Ubuntu  
Networking mode: mirrored

My `%USERPROFILE%\.wslconfig`:

```ini
[wsl2]
networkingMode=mirrored
memory=137266987008
swap=34359738368
````

## Repro

Start a TCP server on the Windows host:

```powershell
cd $env:TEMP
"win-all-ok" | Out-File -Encoding ascii .\win-all.txt
py -3 -m http.server 18082 --bind 0.0.0.0
```

Windows can access it successfully:

```powershell
curl.exe http://127.0.0.1:18082/win-all.txt
```

Output:

```text
win-all-ok
```

But from WSL, in mirrored networking mode:

```bash
wslinfo --networking-mode
# mirrored

env -u HTTP_PROXY -u HTTPS_PROXY -u ALL_PROXY \
    -u http_proxy -u https_proxy -u all_proxy \
    curl -v --noproxy '*' --connect-timeout 5 \
    http://127.0.0.1:18082/win-all.txt
```

It times out.

This also breaks Windows localhost proxy usage from WSL. For example, my Windows system proxy is `127.0.0.1:7890`, and WSL receives `HTTP_PROXY=http://127.0.0.1:7890`, but WSL cannot connect to it.

## tcpdump evidence

I captured the traffic inside WSL:

```bash
sudo tcpdump -i any -n -vv 'tcp port 18082'
```

Relevant output:

```text
loopback0 Out IP 127.0.0.1.43545 > 127.0.0.1.18082: Flags [S]
loopback0 In  IP 127.0.0.1.18082 > 127.0.0.1.12411: Flags [S.]
loopback0 Out IP 127.0.0.1.12411 > 127.0.0.1.18082: Flags [R]

loopback0 Out IP 127.0.0.1.43545 > 127.0.0.1.18082: Flags [S]
loopback0 In  IP 127.0.0.1.18082 > 127.0.0.1.11417: Flags [S.]
loopback0 Out IP 127.0.0.1.11417 > 127.0.0.1.18082: Flags [R]

loopback0 Out IP 127.0.0.1.43545 > 127.0.0.1.18082: Flags [S]
loopback0 In  IP 127.0.0.1.18082 > 127.0.0.1.9451: Flags [S.]
loopback0 Out IP 127.0.0.1.9451 > 127.0.0.1.18082: Flags [R]
```

The SYN is sent from source port `43545`, but the SYN-ACK is returned to different ports such as `12411`, `11417`, and `9451`. The Linux kernel then responds with RST. This matches the behavior described in this issue.

## Additional notes

Windows self-test succeeds, so the server itself is working.

WSL reports `networkingMode=mirrored`, but WSL cannot connect to Windows host services via `127.0.0.1`.

Hyper-V firewall settings show `LoopbackEnabled=True`, so this does not look like a simple firewall block.

This issue affects tools that rely on Windows localhost proxy from WSL, such as OpenAI Codex, npm, curl, etc.

**Comment by Zrrrrrrg** [comment]
Same to me, exactly what the two posts above describe.

**Comment by Zrrrrrrg** [comment]
> Same to me, exactly what the two posts above describe.

It's weird... When I run Wireshark on Windows Host (just let the Wireshark process holds and stays at the startup screen, nothing more), I could normally use "mirrored" mode to access localhost from both sides -- iff the Wireshark is running, if you shut the Wireshark, it rollbacks to the above fault.
It must have something to do with driver.

**Comment by agoldhammer** [comment]
I'm having the same issue.

**Comment by go2sh** [comment]
> > Same to me, exactly what the two posts above describe.
> 
> It's weird... When I run Wireshark on Windows Host (just let the Wireshark process holds and stays at the startup screen, nothing more), I could normally use "mirrored" mode to access localhost from both sides -- iff the Wireshark is running, if you shut the Wireshark, it rollbacks to the above fault. It must have something to do with driver.

Thanks for pointing this out. With wireshark its working and its absolutely bonkers.

**Comment by ThunderRonin** [comment]
I can independently reproduce this issue on a different Windows build and Debian WSL2 installation.

Environment:

- Windows build: `10.0.26200.9457`
- WSL networking: `mirrored`
- `.wslconfig`: `hostAddressLoopback=true`
- Initially: WSL `2.6.3.0`, kernel `6.6.87.2-microsoft-standard-WSL2`
- After upgrading: WSL `2.7.14.0`, kernel `6.18.33.2-2`

Minimal control test:

1. Start a temporary Windows TCP listener bound explicitly to IPv4 `127.0.0.1:28981`.
2. From WSL, run `timeout 2 bash -c 'exec 3<>/dev/tcp/127.0.0.1/28981'`.
3. The connection times out with exit code 124.

I repeated the test with the Windows listener bound to `0.0.0.0:28982`; that also timed out. Two existing Windows TCP services on ports 2080 and 10809 likewise failed 3/3 connection attempts through WSL `127.0.0.1`.

As a control, connecting from the same WSL instance to those services through a Windows host-assigned IPv4 address succeeds immediately. This isolates the failure to the mirrored localhost path rather than the applications or TCP listeners.

Upgrading from WSL 2.6.3.0 to current stable 2.7.14.0, running `wsl --shutdown`, and restarting the distribution did not change the result. `hostAddressLoopback=true` also does not resolve it. I have not captured packets to independently confirm the wrong-ephemeral-port mechanism described in the original report, but the externally observable behavior and minimal reproduction match it exactly.

**Comment by go2sh** [comment]
I run copilot on the issue today and the outcome is:

> I traced issue #40343 through the mirrored networking path. The most likely root cause is outside the WSL userspace code, in the Windows HNS/VFP flow-steering or loopback packet path.
> 
> **Key evidence:**
> 
> Linux deliberately routes 127.0.0.1 TCP/UDP traffic through loopback0 in NetworkManager.cpp.
> WSL sends the packet unchanged; there is no code here that rewrites TCP source ports.
> Mirrored mode enables HNS flow steering in WslCoreGuestNetworkService.cpp.
> Linux configures a reserved ephemeral port range globally, but the special GELNIC loopback endpoint intentionally skips the normal nftables masquerade setup in WslMirroredNetworking.cpp.
> The reported SYN-ACK has a different destination port before Linux receives it. Linux then correctly sends RST.
> Wireshark changing the behavior strongly supports a Windows driver/filter-state problem rather than a Linux routing or application issue.
> The plausible failure is therefore:
> 
> HNS/VFP flow steering loses or incorrectly reconstructs the TCP 4-tuple for host-loopback traffic traversing the mirrored GELNIC path.
> 
> I did not find a local commit or obvious WSL-side bug that would explain the port rewrite. The existing tests verify route setup, but not an actual host-to-WSL TCP handshake, leaving this regression uncovered.
> 
> The most useful next diagnostic would be a simultaneous capture on Windows and inside WSL. If Windows sees the SYN leave with port X but emits the SYN-ACK toward port Y, the defect is conclusively in the Windows HNS/VFP/network-filter path.

**Comment by Zrrrrrrg** [comment]
Hey bros look what I find just now: https://chatgpt.com/s/t_6ab5004279dc8191b1bcb2fe5973f793
To be brief, "The wrong `dstport` number is not random, but caused by a misplacement of checksum".

And by several tests, until now, what I could confirm:
1. The above one
2. UDP remains intact from both sides, only TCP suffers
3. Wrong `dstport` only shows from Win to WSL, while WSL 2 Win remains intact
4. The affected packets includes ACK, SYN and even RST
5. It seems that either "pktmon", "Windows Filtering Platform"(WFP) and "tcpdump" won't change the behavior like what Wireshark does
6. Npcap, on which Wireshark relies on, takes the real blame; it could be proved by directly running "dumpcap"(cli version of Wireshark)
7. Actually ```just let the Wireshark process holds and stays at the startup screen, nothing more``` is not exactly what it is: on the startup screen, the capture is under going; and only the capture of "Adapter for loopback traffic capture" makes the magic: you turn it on, the issue gone; turn it off, the issue back (you could just click into that capture and stop it); capture on other networks make no changes; it also applies to "dumpcap" 
<img width="832" height="154" alt="Image" src="https://github.com/user-attachments/assets/b2a6e7c1-c94a-4acb-a98a-3aa6995decd6" />
8. And the last thing confuses me most is this: when enabling Wireshark "Adapter for loopback traffic capture"(which means the issuse gone, for now), the capture in it only shows "the packet from WSL 2 Win", but "no any packet from Win 2 WSL"; you could have a check by a toy nodejs server and "curl" yourself; I think it is the tightly related to the behavior change (it intervenes and forgets to put it back lol)
<img width="1261" height="302" alt="Image" src="https://github.com/user-attachments/assets/38573250-d50d-4e03-9156-0b078a0aaf50" />

**Comment by Zrrrrrrg** [comment]
https://chatgpt.com/s/t_6ab5100e71848191bb5649b17a762c8c

The verifying code above
