### ISSUE TITLE
Socket Connect hangs until timeout runs out in mirrored mode.

### ISSUE THREAD

**Issue by MichiBab** [microsoft/WSL#10855]
### Windows Version

Microsoft Windows [Version 10.0.22631.2715]

### WSL Version

2.0.9.0

### Are you using WSL 1 or WSL 2?

- [X] WSL 2
- [ ] WSL 1

### Kernel Version

5.15.133.1-1

### Distro Version

Ubuntu 22.04

### Repro Steps

Call this script in mirrored mode as normal user or sudo (try both):

```
import socket
import time
import os

def is_port_in_use(port):
    with socket.socket(socket.AF_INET, socket.SOCK_STREAM) as s:
        try:
            s.bind(('localhost', port))
        except socket.error:
            return True
        return False

def is_port_in_use(port):
    with socket.socket(socket.AF_INET, socket.SOCK_STREAM) as s:
        s.settimeout(2)

        print(f"Socket type: {s.type}")
        print(f"Socket family: {s.family}")
        print(f"Socket timeout: {s.gettimeout()} seconds")
        # Get and print socket options
        print(f"SO_REUSEADDR option: {s.getsockopt(socket.SOL_SOCKET, socket.SO_REUSEADDR)}")
        print(f"SO_KEEPALIVE option: {s.getsockopt(socket.SOL_SOCKET, socket.SO_KEEPALIVE)}")
        print(f"TCP_NODELAY option: {s.getsockopt(socket.IPPROTO_TCP, socket.TCP_NODELAY)}")
        print("checking: ", port)
        print("Timeout: ",s.gettimeout())
        return s.connect_ex(("localhost", port)) == 0
    
    
print("Uid: ", os.getuid())
start_time = time.time()
print("Is Port in use:", is_port_in_use(6006))
print("--- Runtime: %s seconds ---" % (time.time() - start_time))
```

### Expected Behavior

It directly checks if the socket is in use or not.

### Actual Behavior

Sometimes it takes over 132 seconds to return True or False. In not mirrored mode it always directly returns. I came across this issue using ros, where the roscore takes about 2 minutes to start, or starting tensorboard takes around 2 minutes aswell, so i build this script to reproduce the error.

If it directly returns true or false in mirrored mode, i start the script as sudo and then the problem occurs again.
What is interesting, is that if i set the socket timeout to a specific second, then it will return after that. Its like its blocked for the default timeout.

### Diagnostic Logs

Without networking mode mirrored:

❯ python3 test_connect.py
Uid:  1000
Socket type: 1
Socket family: 2
Socket timeout: None seconds
SO_REUSEADDR option: 0
SO_KEEPALIVE option: 0
TCP_NODELAY option: 0
checking:  6006
Timeout:  None
Is Port in use: False
--- Runtime: 0.0001404285430908203 seconds ---

With networking mode mirrored:

❯ python3 test_connect.py
Uid:  1000
Socket type: 1
Socket family: 2
Socket timeout: None seconds
SO_REUSEADDR option: 0
SO_KEEPALIVE option: 0
TCP_NODELAY option: 0
checking:  6006
Timeout:  None
Is Port in use: False
--- Runtime: 132.54164338111877 seconds ---

# Sometimes it works as fast as without mirrored. But sometimes not, even tho it results in the port is not in use.
# If it works directly, starting the script with sudo will result again in this timeout.

With networking mode mirrored and setting timeout to a second with:
s.settimeout(1) before the connect_ex call

❯ python3 test_connect.py
Uid:  1000
Socket type: 1
Socket family: 2
Socket timeout: 1.0 seconds
SO_REUSEADDR option: 0
SO_KEEPALIVE option: 0
TCP_NODELAY option: 0
checking:  6006
Timeout:  None
Is Port in use: False
--- Runtime: 1.001239538192749 seconds ---

Or with settimeout to 2 seconds:

❯ python3 test_connect.py
Uid:  1000
Socket type: 1
Socket family: 2
Socket timeout: 2.0 seconds
SO_REUSEADDR option: 0
SO_KEEPALIVE option: 0
TCP_NODELAY option: 0
checking:  6006
Timeout:  2.0
Is Port in use: False
--- Runtime: 2.0022153854370117 seconds ---

**Comment by chanpreetdhanjal** [comment]
Could you please follow the steps below and attach the diagnostic logs? https://github.com/microsoft/WSL/blob/master/CONTRIBUTING.md#collect-wsl-logs-for-networking-issues

**Comment by chanpreetdhanjal** [comment]
Please follow the networking diagnostic script. https://github.com/microsoft/WSL/blob/master/CONTRIBUTING.md#collect-wsl-logs-for-networking-issues

It should create a folder like [WslNetworkingLogs-date_ver.zip]

**Comment by MichiBab** [comment]
[WslNetworkingLogs-2023-12-07_21-14-32.zip](https://github.com/microsoft/WSL/files/13604763/WslNetworkingLogs-2023-12-07_21-14-32.zip)
Updated

**Comment by markovaljaots** [comment]
I have the same issue with WSL `2.0.14.0`

**Comment by MichiBab** [comment]
Still the same problem with 2.1.0

**Comment by derMatze82** [comment]
same problem here with 2.1.0.
It is frustrating because some applications expect a conneciton refused when performing port checks with telnet

**Comment by linG5821** [comment]
When I go through windows `telnet localhost [port]` the access is very slow, but when I go through `telnet 127.0.0.1 [port]` or `telnet native ip [port]` it is very fast, I think it might be because there is a problem with localhost resolution, so I found a blog I looked at the prioritization policy for IPv6

`netsh interface ipv6 show prefixpolicies`

Default policy

Priority    label  prefix
----------  -----  --------------------------------
        50      0  ::1/128
        40      1  ::/0
        35      4  ::ffff:0:0/96
        30      2  2002::/16
         5      5  2001::/32
         3     13  fc00::/7
         1     11  fec0::/10
         1     12  3ffe::/16
         1      3  ::/96
 
I've changed the order of their priorities      
PS: required Administrator
```
netsh int ipv6 set prefix ::/96 50 0
netsh int ipv6 set prefix ::ffff:0:0/96 40 1
netsh int ipv6 set prefix 2002::/16 35 2
netsh int ipv6 set prefix 2001::/32 30 3
netsh int ipv6 set prefix ::1/128 10 4
netsh int ipv6 set prefix ::/0 5 5
netsh int ipv6 set prefix fc00::/7 3 13
netsh int ipv6 set prefix fec0::/10 1 11
netsh int ipv6 set prefix 3ffe::/16 1 12
```
Modified policy
Priority    label  prefix
----------  -----  --------------------------------
        50      0  ::/96
        40      1  ::ffff:0:0/96
        35      2  2002::/16
        30      3  2001::/32
        10      4  ::1/128
         5      5  ::/0
         3     13  fc00::/7
         1     12  3ffe::/16
         1     11  fec0::/10 

now `telnet 127.0.0.1 [port]`  is getting fast

But I don't know what other problems such a change would cause

It can be reset by the following command
`netsh interface ipv6 reset`
PS: reboot your system

**Comment by ZedG2** [comment]
> When I go through windows `telnet localhost [port]` the access is very slow, but when I go through `telnet 127.0.0.1 [port]` or `telnet native ip [port]` it is very fast, I think it might be because there is a problem with localhost resolution, so I found a blog I looked at the prioritization policy for IPv6
> 
> `netsh interface ipv6 show prefixpolicies`
> 
> Default policy
> 
> ```
> Priority    label  prefix
> ----------  -----  --------------------------------
>         50      0  ::1/128
>         40      1  ::/0
>         35      4  ::ffff:0:0/96
>         30      2  2002::/16
>          5      5  2001::/32
>          3     13  fc00::/7
>          1     11  fec0::/10
>          1     12  3ffe::/16
>          1      3  ::/96
> ```
> 
> I've changed the order of their priorities PS: required Administrator
> 
> ```
> netsh int ipv6 set prefix ::/96 50 0
> netsh int ipv6 set prefix ::ffff:0:0/96 40 1
> netsh int ipv6 set prefix 2002::/16 35 2
> netsh int ipv6 set prefix 2001::/32 30 3
> netsh int ipv6 set prefix ::1/128 10 4
> netsh int ipv6 set prefix ::/0 5 5
> netsh int ipv6 set prefix fc00::/7 3 13
> netsh int ipv6 set prefix fec0::/10 1 11
> netsh int ipv6 set prefix 3ffe::/16 1 12
> ```
> 
> Modified policy
> 
> ```
> Priority    label  prefix
> ----------  -----  --------------------------------
>         50      0  ::/96
>         40      1  ::ffff:0:0/96
>         35      2  2002::/16
>         30      3  2001::/32
>         10      4  ::1/128
>          5      5  ::/0
>          3     13  fc00::/7
>          1     12  3ffe::/16
>          1     11  fec0::/10 
> ```
> 
> now `telnet 127.0.0.1 [port]` is getting fast
> 
> But I don't know what other problems such a change would cause
> 
> It can be reset by the following command `netsh interface ipv6 reset` PS: reboot your system

not work for me.

**Comment by linG5821** [comment]
> > When I go through windows `telnet localhost [port]` the access is very slow, but when I go through `telnet 127.0.0.1 [port]` or `telnet native ip [port]` it is very fast, I think it might be because there is a problem with localhost resolution, so I found a blog I looked at the prioritization policy for IPv6
> > `netsh interface ipv6 show prefixpolicies`
> > Default policy
> > ```
> > Priority    label  prefix
> > ----------  -----  --------------------------------
> >         50      0  ::1/128
> >         40      1  ::/0
> >         35      4  ::ffff:0:0/96
> >         30      2  2002::/16
> >          5      5  2001::/32
> >          3     13  fc00::/7
> >          1     11  fec0::/10
> >          1     12  3ffe::/16
> >          1      3  ::/96
> > ```
> > 
> > 
> >     
> >       
> >     
> > 
> >       
> >     
> > 
> >     
> >   
> > I've changed the order of their priorities PS: required Administrator
> > ```
> > netsh int ipv6 set prefix ::/96 50 0
> > netsh int ipv6 set prefix ::ffff:0:0/96 40 1
> > netsh int ipv6 set prefix 2002::/16 35 2
> > netsh int ipv6 set prefix 2001::/32 30 3
> > netsh int ipv6 set prefix ::1/128 10 4
> > netsh int ipv6 set prefix ::/0 5 5
> > netsh int ipv6 set prefix fc00::/7 3 13
> > netsh int ipv6 set prefix fec0::/10 1 11
> > netsh int ipv6 set prefix 3ffe::/16 1 12
> > ```
> > 
> > 
> >     
> >       
> >     
> > 
> >       
> >     
> > 
> >     
> >   
> > Modified policy
> > ```
> > Priority    label  prefix
> > ----------  -----  --------------------------------
> >         50      0  ::/96
> >         40      1  ::ffff:0:0/96
> >         35      2  2002::/16
> >         30      3  2001::/32
> >         10      4  ::1/128
> >          5      5  ::/0
> >          3     13  fc00::/7
> >          1     12  3ffe::/16
> >          1     11  fec0::/10 
> > ```
> > 
> > 
> >     
> >       
> >     
> > 
> >       
> >     
> > 
> >     
> >   
> > now `telnet 127.0.0.1 [port]` is getting fast
> > But I don't know what other problems such a change would cause
> > It can be reset by the following command `netsh interface ipv6 reset` PS: reboot your system
> 
> not work for me.
> 
> ![image](https://private-user-images.githubusercontent.com/7886856/299501342-9e379b7e-9c2a-4ccb-b02b-8c7ee6a9ce5e.png?jwt=eyJhbGciOiJIUzI1NiIsInR5cCI6IkpXVCJ9.eyJpc3MiOiJnaXRodWIuY29tIiwiYXVkIjoicmF3LmdpdGh1YnVzZXJjb250ZW50LmNvbSIsImtleSI6ImtleTUiLCJleHAiOjE3MDYyNTY0NjAsIm5iZiI6MTcwNjI1NjE2MCwicGF0aCI6Ii83ODg2ODU2LzI5OTUwMTM0Mi05ZTM3OWI3ZS05YzJhLTRjY2ItYjAyYi04YzdlZTZhOWNlNWUucG5nP1gtQW16LUFsZ29yaXRobT1BV1M0LUhNQUMtU0hBMjU2JlgtQW16LUNyZWRlbnRpYWw9QUtJQVZDT0RZTFNBNTNQUUs0WkElMkYyMDI0MDEyNiUyRnVzLWVhc3QtMSUyRnMzJTJGYXdzNF9yZXF1ZXN0JlgtQW16LURhdGU9MjAyNDAxMjZUMDgwMjQwWiZYLUFtei1FeHBpcmVzPTMwMCZYLUFtei1TaWduYXR1cmU9MzM0MDk1MzJiODIzZTNmYTYyMWE2NTc4NzQ5YjMwNWFlZWZhYzA0MzUzMWZiZTdhNjUyY2E2OGI5ODEzODJkZSZYLUFtei1TaWduZWRIZWFkZXJzPWhvc3QmYWN0b3JfaWQ9MCZrZXlfaWQ9MCZyZXBvX2lkPTAifQ.BB7rQUcxZsmgMzcMtikV4hP_WXITyOJ7Sr2t-dkYnvM)

Are you using powershell or cmd on windows ？

* CMD
![image](https://github.com/microsoft/WSL/assets/33996782/7629d95c-6ad6-43b7-8a06-4c2014fcf86e)

![image](https://github.com/microsoft/WSL/assets/33996782/d332eca7-aafe-479e-80ad-edb62aeb2845)

* Powershell
![image](https://github.com/microsoft/WSL/assets/33996782/5fe83dc0-a829-43d5-956e-1718ec3d7b34)

**Comment by ZedG2** [comment]
@linG5821 
We have a different issue. The problem is that the port is not listening, not that it is refusing connections immediately.

**Comment by linG5821** [comment]
I did find problems with changing the default NIC policy in practice

I mapped ports when using Docker, I tried '127.0.0.1:port' and 'localhost:port' both were accessible, but I used the Intranet ip 'ipv4ip:port' and couldn't access it, when I reset the network, Intranet ip 'ipv4ip:port' and '127.0.0.1:port' are accessible, and access to 'localhost:port' comes back to the issue itself.

**Comment by MichiBab** [comment]
Still the same issue with 2.1.3.0

**Comment by MichiBab** [comment]
Still the same issue on 2.1.5. @chanpreetdhanjal is there any way to help? I have a workaround for ROS but it's a bit annoying on tensorboard to wait that long after fetching plots.

**Comment by chanpreetdhanjal** [comment]
Someone from our team is looking at it. We will get back to you as soon as we make further progress. Thank you for your patient.

**Comment by ZedG2** [comment]
Can't believe MS team still not resolve this bug. It's pretty annoying problem, especially when I am going to using the vscode JS debug terminal in WSL2 mirrored network mode.

**Comment by chanpreetdhanjal** [comment]
We are actively looking at it as per other items in our priority list. Will provide an update as soon as we have something tangible to share.

**Comment by keith-horton** [comment]
To update this thread: there are 2 possible issues.

1. when attempting to connect by name "localhost", the IPv6 address ::1 is likely resolved first (v4 vs. v6 is configurable in Linux). Linux does not support the option for IPv6 that we use to allow sending localhost traffic to the host - it's only supported with IPv4. So unfortunately we cannot use the :;1 address to connect from the Linux container to the host.

2. when a connection is attempted by IPv4 127.0.0.1 to the host, but nothing is listening on the host, a RST is returned. We see that something has attempted to port-forward that response because the Linux stack eventually sees this with a different source port (which of course is dropped). We're currently working with Linux folks as we have tracked the response through a kernel debugger to the point where we send it over the vmBus to the Linux container.

Sorry, the RST issue is taking much longer to root cause than expected :(


Hope this helps

**Comment by dhtzs** [comment]
Has there been any progress on this issue?

**Comment by keith-horton** [comment]
we have spent a lot of cycles debugging down the windows stack, through vswitch, to the vm - this has been really difficult and we don't yet have a culprit. we are fixing some Docker related issues - once that goes out, we'll return back to finding this bug.

**Comment by shigenobuokamoto** [comment]
> when a connection is attempted by IPv4 127.0.0.1 to the host, but nothing is listening on the host, a RST is returned. We see that something has attempted to port-forward that response because the Linux stack eventually sees this with a different source port (which of course is dropped). We're currently working with Linux folks as we have tracked the response through a kernel debugger to the point where we send it over the vmBus to the Linux container.

indeed, when capturing packets on Windows and Linux (WSL), the port is wrong.

```
Windows host                                  linux(WSL)
       HV interface     FSE switch         loopback0
syn    222 <- 60844                         222 <- 60844
         00:11:22:33:44:55 <-------------- 00:15:5d:bd:df:a8

rst    222 -> 60844                         222 -> 45634
                                                   ^^^^^???
00:15:5d:61:13:45  ----------------------> 00:15:5d:bd:df:a8
```
destination MAC address Windows sent the packet to is loopback0 (WSL).
MAC address received by Linux (WSL) is the one sent by Windows.

if both perceptions are correct, then maybe something is going on inside the FSE switch?



hostAddressLoopback=true & eth0 address will back to destination port Windows sent it to, which is fine.
i think it is basically the same mechanism, but the behavior is different.

**Comment by drolander** [comment]
I'm having the same issue. Just got upgraded to Win11 22H2 and have been waiting to try mirrored networking. It did not take long to find this issue. Please fix.

**Comment by lihk11** [comment]
same issue with 2.2.4.0

**Comment by atyshka** [comment]
Any updates on resolutions or workarounds for this issue?

**Comment by nessunluogo** [comment]
Same issue here using WSL 2.3.24.0 just updated

**Comment by Morrigan-Ship** [comment]
its now about WSL
its about hyper-v adaptors

I fixed it:

Run powershell as Administrator
wsl --shutdown
win + R keys to run
"C:\WINDOWS\System32\mmc.exe" "C:\WINDOWS\System32\virtmgmt.msc" in run and Enter
stop service
now in powershell Enter: Get-HNSNetwork | ? Name -Like * | Remove-HnsNetwork
start service from old mmc.exe command
run wsl

**Comment by derMatze82** [comment]
> its now about WSL its about hyper-v adaptors
> 
> I fixed it:
> 
> Run powershell as Administrator wsl --shutdown win + R keys to run "C:\WINDOWS\System32\mmc.exe" "C:\WINDOWS\System32\virtmgmt.msc" in run and Enter stop service now in powershell Enter: Get-HNSNetwork | ? Name -Like * | Remove-HnsNetwork start service from old mmc.exe command run wsl

does not work for me :/

**Comment by shixudong2020** [comment]
it seem to hyper-v's hse-hostvnic problem,not wsl's
solution:win11 update to 24H2
temporary solution:open wireshark,no actual capture is required

**Comment by dsestil** [comment]
I also found that this problem is solved after upgrade to win11 24H2.

**Comment by MichiBab** [comment]
I have an asus mainboard and still dont receive the 24H2 update, if i get it and can test it i will close this issue, thanks for the update!

**Comment by j-schumann** [comment]
I'm on W11 Pro 24H2, Build 26100.3323 and still got the issue, so it is not fixed by simply upgrading to H2.

**Comment by EarlFan** [comment]
this problem is extremely annoying, my work rely on local debugging of parallel computation via mpi on the wsl system.

**Comment by sbrl** [comment]
I have a Windows 11 PC with WSL 2 and all system updates, but I still experience this issue on 24H2.

**Comment by benhillis** [comment]
@CatalinFetoiu - was this something you are investigating?

**Comment by shixudong2020** [comment]
> if the destination port is open in windows.
> 
> ![Image](https://github.com/user-attachments/assets/bbc4ebe2-7a3c-4d9f-ab8b-0cb00527aca2)
> 
> the response comes back to the source port.
> 
> however, if destination port that is not open in windows, the return packet from loopback0 will be sent to an unrelated port, resulting in an unresponsive state.
> 
> ![Image](https://github.com/user-attachments/assets/c86d5793-2a6c-4af1-9cf3-120a57b36c21)
> 
> when capturing packets on the windows, the correct response appears to be returned, so i think something is happening around the virtual switch.

when capturing packets on the windows, wireshark with loopback can not capture  response packets to WSL, How u  captured these 
response packets to WSL?

**Comment by bentwookie** [comment]
Still exists as of 24H2 26100.4349. FWIW, this bug makes it really hard to use ROS2 in WSL2 across machines.

**Comment by rosiakpiotr** [comment]
> Still exists as of 24H2 26100.4349. FWIW, this bug makes it really hard to use ROS2 in WSL2 across machines.

For many ROS2 users that also struggle with this issue: I was able to fix CLI tools with manually calling `ros2 daemon start` before listing topics / nodes ([thanks to this repository](https://github.com/espenakk/ros2-wsl2-guide)).

**Comment by paxtonyu** [comment]
Any updates on resolutions or workarounds for this issue? It seems that this bug has lasted for two years.

**Comment by wsxq2** [comment]
> > Still exists as of 24H2 26100.4349. FWIW, this bug makes it really hard to use ROS2 in WSL2 across machines.
> 
> For many ROS2 users that also struggle with this issue: I was able to fix CLI tools with manually calling `ros2 daemon start` before listing topics / nodes ([thanks to this repository](https://github.com/espenakk/ros2-wsl2-guide)).

That works, Thanks you very much!

**Comment by aradalvand** [comment]
Still an issue, and this causes so many gnarly, hard-to-find downstream issues. Merits more urgent attention IMO.

**Comment by whittede** [comment]
Agreed with the above comment. Would really, really, like to see this get prioritized, it causes so many lost hours of debugging only to find at the end that it is a bug within WSL, not a setup issue.

**Comment by Alvin0523** [comment]
can microsoft fix this asap?? This is the last line before all of us dump this nonsense and shift to native ubuntu

**Comment by xak2000** [comment]
I noticed an interesting commit comment in the linked issue:

> WSL2's mirrored networking mode has a bug (#10855) where RST packets for connections to closed ports on 127.0.0.1 are returned with a corrupted destination port. The kernel drops the misaddressed RST, leaving the connection in SYN-SENT until TCP timeout (~130s).

I have no idea if that is true, but if it is - it is the reason of this bug, isn't it? Worth to check at least.

@keith-horton I seen you tried to found a culprit of this issue earlier. Maybe this info helps. I really hope. Because currently mirrored mode is very unstable. Sometimes it works fine, sometimes it is extremely slow (probably due to waiting for these timeouts) to the point of being unusable.

**Comment by keith-horton** [comment]
Hi there. We spent some time with the vswitch folks to see how this packet in this one scenario was being mishandled. We never did bottom-out on that investigation.

The only known issue with mirrored-mode is this one atypical scenario: attempting to connect() from the Linux guest to the Windows host, but the Windows host has no one listening.

We run many performance tests - there are no known issues with performance.
It would be useful to know what makes it "unusable".

**Comment by xak2000** [comment]
> there are no known issues with performance.

Hmm, that is surprising to me. I thought these issues are well-known.

For me what makes WSL2 with mirrored network "unusable":

1. If I run something that listens on a specific port on host machine, then stop it (no one listens on this port anymore), then if I'm trying to run something that wants to listen on the same port in WSL2 machine, it can't do this.

   An example:

   ```
   $ yarn dev
   Nuxt 3.18.1 with Nitro 2.12.4
   [get-port] Unable to find an available port (tried 3000 on any host). Using alternative port 3001.
   
     ➜ Local:    http://localhost:3001/
   ```

   As you can see it can't bind to port 3000. But port 3000 is already free and it was free during at least 30 seconds. Only after roughly 60-120 seconds it can finally start it to listen on port 3000 again.

   Of course you can argue that it is a very specific scenario, and I would agree, this problem alone wouldn't make it "unusable", if you don't need to do this often. Still, very annoying.

2. Network speed is EXTREMELY slow. I didn't debug this problem too much to understand what part exactly is slow, but I can describe the scenario.

   I have a Nuxt app (node.js backend + frontend), and another Java app (pure API backend).
   Also a Mysql server instnance (a docker container running in docker-for-windows with WSL2 backend).

   They call each other like this. Very simple:

   ```
   [browser] -http-> [node.js backend] -http-> [java backend] -> Mysql (docker container)
   ```

   When all 3 components are running on Windows machine (except the Mysql server that is always running in docker), everything works fine. The response times observable in the browser are 50-500ms.

   When I run `[node.js backend]` in WSL2 (all files are moved to the WSL2 filesystem, so no FS bridge overhead), the observable response times in the browser are 500ms - 60s. Yes, THAT slow. Just checked: 43.2s for a response that returns JSON (172 kB).

   I'm not sure this "slowness" problem is related to this issue, actually. But you asked what makes it "unusable", so here we are. :)

   Probably I should research it more to understand what direction of the request/response is actually slow to further isolate the problem (host -> guest or guest -> host). If you are interested in I could try to do this.

   The network calls involved when Node.js app is running in the WSL2 look like this:

   ```
   [browser](host) -http-> [node.js backend](WSL) -http-> [java backend](host) -> Mysql (docker container, WSL)
   ```

   A screenshot from the Chrome Network panel, as an example.

   #### `networkingMode=mirrored`:

   <img width="909" height="301" alt="Image" src="https://github.com/user-attachments/assets/390a65ae-d1f7-4366-aa39-b073d190c5f7" />

   #### `networkingMode=net`:

   Actually, surprisingly to me the behavior is the same now. I mean, the requests are exactly as slow as in `mirrored` mode. Earlier `net` mode worked fine. Hmmm...

   #### And the same node.js app running on the host system, to compare:
   
   <img width="910" height="356" alt="Image" src="https://github.com/user-attachments/assets/1293ad9e-ef1f-4bd7-bca9-1e7c2b913363" />

   Based on the fact that the network is slow in both `mirrored` and `net` (NAT) modes, probably the problem is not related to the `mirrored` mode.

   P.S. I slightly debugged the problem to understand at least in which part of the req/res cycle the delay is. It looks like the delay is after the response is generated by the host machine (`[java backend]`) and sent (I see in the logs that the socket stream is closed), but before it is received by the guest machine (`[node.js backend]`). I.e. `[node.js backend](WSL)` send request to `[java backend](host)`, `[java backend](host)` generates the response and sends it back, then `[node.js backend](WSL)` waits another 20 seconds for this response to arrive.

   Also an observation: when the response size is less than 90kB, the response time is worse but not by an order of magnitude. E.g. 400ms -> 1.7s. But when the response size is 90kB+, then the response time is suddenly becomes 20s+. This behavior is consistent. Not an accidental result.

   I tried to disable IPv6 and "Large Send Offload Version 2" as someone recommended in #8171. It didn't help. Once disabling of IPv6 helped (in `net` mode) - the response time reduced from 20s to 500ms, but then I tried to restart WSL in `mirrored` mode - the response time returned back to 20s. Then I restarted in `net` mode, and the response time was still 20s. Even with disabled IPv6. So, I do not understand why it helped at first but after the restart of WSL it stopped to help. Now it is consistently 20-23s for `/groups?size=50` request regardless of enabling/disabling IPv6 and regardless of networking mode.

**Comment by MichiBab** [comment]
> Hi there. We spent some time with the vswitch folks to see how this packet in this one scenario was being mishandled. We never did bottom-out on that investigation.
> 
> The only known issue with mirrored-mode is this one atypical scenario: attempting to connect() from the Linux guest to the Windows host, but the Windows host has no one listening.
> 
> We run many performance tests - there are no known issues with performance. It would be useful to know what makes it "unusable".

Maybe another script for u to test in mirrored mode:

```
import socket
import time
import os


def print_socket_info():
    with socket.socket(socket.AF_INET, socket.SOCK_STREAM) as s:
        print(f"Socket type: {s.type}")
        print(f"Socket family: {s.family}")
        print(f"Socket timeout: {s.gettimeout()} seconds")
        # Get and print socket options
        print(
            f"SO_REUSEADDR option: {s.getsockopt(socket.SOL_SOCKET, socket.SO_REUSEADDR)}"
        )
        print(
            f"SO_KEEPALIVE option: {s.getsockopt(socket.SOL_SOCKET, socket.SO_KEEPALIVE)}"
        )
        print(
            f"TCP_NODELAY option: {s.getsockopt(socket.IPPROTO_TCP, socket.TCP_NODELAY)}"
        )


def is_port_in_use(port):
    with socket.socket(socket.AF_INET, socket.SOCK_STREAM) as s:
        return s.connect_ex(("localhost", port)) == 0


def print_checking_time(port):
    start_time = time.time()
    print("Is Port in use:", is_port_in_use(port))
    print("--- Runtime: %s seconds ---" % (time.time() - start_time))


if __name__ == "__main__":
    print("Uid: ", os.getuid())
    print_socket_info()
    for i in range(1000, 65535):
        print_checking_time(i)
```





This only runs quickly when im NOT in mirrored mode. In mirrored mode it gets stuck as described in the ticket.
Does that still work for you without issues on Mirrored?

**Comment by clouds56** [comment]
I'm here to provide some more information.

> We run many performance tests - there are no known issues with performance.

This is not a performance issue, it obviously is a bug.

What I'm tracking down, first we prepare some file
```bash
# win.pcap
PS> netsh trace start capture=yes scenario=Virtualization tracefile=c:\tmp\windows.etl maxsize=512
PS> netsh trace stop
PS> etl2pcapng .\windows.etl win.pcap
# win_internal.pcap
# wireshark listen on vEthernet (Internal Switch)
# the Internal Switch's ip and mac is the same as eth2 below 00:15:5d:xx:xx:09

# wsl.pcap
wsl $ sudo tcpdump -i any -s 0 -w /tmp/wsl.pcap
# wsl_lo.pcap
wsl $ sudo tcpdump -i lo -s 0 -w /tmp/wsl_lo.pcap
# wsl_eth2.pcap
sudo tcpdump -i eth2 -s 0 -w /tmp/wsl_eth.pcap
wsl $ ip addr
1: lo: <LOOPBACK,UP,LOWER_UP> mtu 65536 qdisc noqueue state UNKNOWN group default qlen 1000
    link/loopback 00:00:00:00:00:00 brd 00:00:00:00:00:00
    inet 127.0.0.1/8 scope host lo
       valid_lft forever preferred_lft forever
    inet 10.255.255.254/32 brd 10.255.255.254 scope global lo
       valid_lft forever preferred_lft forever
    inet6 ::1/128 scope host proto kernel_lo
       valid_lft forever preferred_lft forever
2: loopback0: <BROADCAST,MULTICAST,UP,LOWER_UP> mtu 1500 qdisc mq state UP group default qlen 1000
    link/ether 00:15:5d:xx:xx:12 brd ff:ff:ff:ff:ff:ff
5: eth2: <BROADCAST,MULTICAST,UP,LOWER_UP> mtu 1500 qdisc mq state UP group default qlen 1000
    link/ether 00:15:5d:xx:xx:09 brd ff:ff:ff:ff:ff:ff
    inet 169.254.83.x/16 brd 169.254.255.255 scope link noprefixroute eth2
       valid_lft forever preferred_lft forever
```

then run `curl -vv http://localhost:1` in wsl
```
 curl -vv http://localhost:1
20:51:12.988818 [0-0] * Host localhost:1 was resolved.
20:51:12.988947 [0-0] * IPv6: ::1
20:51:12.989007 [0-0] * IPv4: 127.0.0.1
20:51:12.989076 [0-0] * [SETUP] added
20:51:12.989174 [0-0] *   Trying [::1]:1...
20:51:12.989336 [0-0] * [SETUP] Curl_conn_connect(block=0) -> 0, done=0
20:51:12.989394 [0-0] * connect to ::1 port 1 from ::1 port 42257 failed: Connection refused
20:51:12.989457 [0-0] *   Trying 127.0.0.1:1...
20:51:12.989530 [0-0] * [SETUP] Curl_conn_connect(block=0) -> 0, done=0
20:51:13.189869 [0-0] * [SETUP] Curl_conn_connect(block=0) -> 0, done=0
20:51:14.191100 [0-0] * [SETUP] Curl_conn_connect(block=0) -> 0, done=0
20:51:15.192382 [0-0] * [SETUP] Curl_conn_connect(block=0) -> 0, done=0
20:51:16.193622 [0-0] * [SETUP] Curl_conn_connect(block=0) -> 0, done=0
20:51:17.194805 [0-0] * [SETUP] Curl_conn_connect(block=0) -> 0, done=0
20:51:18.195977 [0-0] * [SETUP] Curl_conn_connect(block=0) -> 0, done=0
20:51:19.197270 [0-0] * [SETUP] Curl_conn_connect(block=0) -> 0, done=0
20:51:20.198589 [0-0] * [SETUP] Curl_conn_connect(block=0) -> 0, done=0
20:51:21.199790 [0-0] * [SETUP] Curl_conn_connect(block=0) -> 0, done=0
```

This is background, and I see in wsl.pcap
```
459	14.829497	::1	::1	TCP	100	42257 → 1 [SYN] Seq=0 Win=65476 Len=0 MSS=65476 SACK_PERM TSval=2408402288 TSecr=0 WS=128
460	14.829507	::1	::1	TCP	80	1 → 42257 [RST, ACK] Seq=1 Ack=1 Win=0 Len=0
461	14.829708	127.0.0.1	127.0.0.1	TCP	80	40941 → 1 [SYN] Seq=0 Win=64240 Len=0 MSS=1460 SACK_PERM TSval=557190798 TSecr=0 WS=128
462	14.829981	127.0.0.1	127.0.0.1	TCP	60	1 → 36005 [RST, ACK] Seq=1 Ack=1 Win=0 Len=0
476	15.852318	127.0.0.1	127.0.0.1	TCP	80	[TCP Retransmission] 40941 → 1 [SYN] Seq=0 Win=64240 Len=0 MSS=1460 SACK_PERM TSval=557191821 TSecr=0 WS=128
477	15.852586	127.0.0.1	127.0.0.1	TCP	60	1 → 36048 [RST, ACK] Seq=1 Ack=1 Win=0 Len=0
522	16.876340	127.0.0.1	127.0.0.1	TCP	80	[TCP Retransmission] 40941 → 1 [SYN] Seq=0 Win=64240 Len=0 MSS=1460 SACK_PERM TSval=557192845 TSecr=0 WS=128
523	16.876868	127.0.0.1	127.0.0.1	TCP	60	1 → 36078 [RST, ACK] Seq=1 Ack=1 Win=0 Len=0
558	17.896334	127.0.0.1	127.0.0.1	TCP	80	[TCP Retransmission] 40941 → 1 [SYN] Seq=0 Win=64240 Len=0 MSS=1460 SACK_PERM TSval=557193865 TSecr=0 WS=128
559	17.896640	127.0.0.1	127.0.0.1	TCP	60	1 → 36109 [RST, ACK] Seq=1 Ack=1 Win=0 Len=0
582	18.920309	127.0.0.1	127.0.0.1	TCP	80	[TCP Retransmission] 40941 → 1 [SYN] Seq=0 Win=64240 Len=0 MSS=1460 SACK_PERM TSval=557194889 TSecr=0 WS=128
583	18.920687	127.0.0.1	127.0.0.1	TCP	60	1 → 36136 [RST, ACK] Seq=1 Ack=1 Win=0 Len=0
604	19.944328	127.0.0.1	127.0.0.1	TCP	80	[TCP Retransmission] 40941 → 1 [SYN] Seq=0 Win=64240 Len=0 MSS=1460 SACK_PERM TSval=557195913 TSecr=0 WS=128
605	19.944582	127.0.0.1	127.0.0.1	TCP	60	1 → 36160 [RST, ACK] Seq=1 Ack=1 Win=0 Len=0
685	21.960326	127.0.0.1	127.0.0.1	TCP	80	[TCP Retransmission] 40941 → 1 [SYN] Seq=0 Win=64240 Len=0 MSS=1460 SACK_PERM TSval=557197929 TSecr=0 WS=128
686	21.960581	127.0.0.1	127.0.0.1	TCP	60	1 → 36217 [RST, ACK] Seq=1 Ack=1 Win=0 Len=0
```

in win.pcap
```
3210	42.772986	127.0.0.1	127.0.0.1	TCP	74	40941 → 1 [SYN] Seq=0 Win=64240 Len=0 MSS=1460 SACK_PERM TSval=557190798 TSecr=0 WS=128
3211	42.773063	127.0.0.1	127.0.0.1	TCP	54	1 → 40941 [RST, ACK] Seq=1 Ack=1 Win=0 Len=0
3232	43.795623	127.0.0.1	127.0.0.1	TCP	74	[TCP Port numbers reused] 40941 → 1 [SYN] Seq=0 Win=64240 Len=0 MSS=1460 SACK_PERM TSval=557191821 TSecr=0 WS=128
3233	43.795690	127.0.0.1	127.0.0.1	TCP	54	1 → 40941 [RST, ACK] Seq=1 Ack=1 Win=0 Len=0
3292	44.819761	127.0.0.1	127.0.0.1	TCP	74	[TCP Port numbers reused] 40941 → 1 [SYN] Seq=0 Win=64240 Len=0 MSS=1460 SACK_PERM TSval=557192845 TSecr=0 WS=128
3293	44.819915	127.0.0.1	127.0.0.1	TCP	54	1 → 40941 [RST, ACK] Seq=1 Ack=1 Win=0 Len=0
3334	45.839648	127.0.0.1	127.0.0.1	TCP	74	[TCP Port numbers reused] 40941 → 1 [SYN] Seq=0 Win=64240 Len=0 MSS=1460 SACK_PERM TSval=557193865 TSecr=0 WS=128
3335	45.839734	127.0.0.1	127.0.0.1	TCP	54	1 → 40941 [RST, ACK] Seq=1 Ack=1 Win=0 Len=0
3371	46.863626	127.0.0.1	127.0.0.1	TCP	74	[TCP Port numbers reused] 40941 → 1 [SYN] Seq=0 Win=64240 Len=0 MSS=1460 SACK_PERM TSval=557194889 TSecr=0 WS=128
3372	46.863726	127.0.0.1	127.0.0.1	TCP	54	1 → 40941 [RST, ACK] Seq=1 Ack=1 Win=0 Len=0
3409	47.887623	127.0.0.1	127.0.0.1	TCP	74	[TCP Port numbers reused] 40941 → 1 [SYN] Seq=0 Win=64240 Len=0 MSS=1460 SACK_PERM TSval=557195913 TSecr=0 WS=128
3410	47.887693	127.0.0.1	127.0.0.1	TCP	54	1 → 40941 [RST, ACK] Seq=1 Ack=1 Win=0 Len=0
3514	49.903608	127.0.0.1	127.0.0.1	TCP	74	[TCP Port numbers reused] 40941 → 1 [SYN] Seq=0 Win=64240 Len=0 MSS=1460 SACK_PERM TSval=557197929 TSecr=0 WS=128
3515	49.903680	127.0.0.1	127.0.0.1	TCP	54	1 → 40941 [RST, ACK] Seq=1 Ack=1 Win=0 Len=0
```

which is the same as @shigenobuokamoto 's work
But I'm giving more information here

1. For ipv6 [::1]:1, it goes to lo instead of loopback0, so it would got RST correctly
2. For ipv4 127.0.0.1:1 it goes to loopback0, from 00:15:5d:xx:xx:12 to 00:15:5d:xx:xx:4c (where the latter is not the same as eth2/vEthernet (Internal Switch) 00:15:5d:xx:xx:09, and I never see this mac in my `ipconfig /all`)
3. In wsl_lo.pcap, there's only ipv6 traffic, which is consistent with 1, and in wsl_eth2.pcap or win_internal.pcap, we see no traffics, which is consistent with 2
4. All traffics got correct Header checksum for ip, but only partial checksum for tcp (even for received package), that means 00:15:5d:xx:xx:4c doesn't do offload checksum correctly (I think this is a flag).
5. At unknown interface 00:15:5d:xx:xx:4c, it sent correct RST package, (with partial checksum) and port is changed by some layer (maybe NAT?)

Traffic summary (we align first package in win.pcap and wsl.pcap time 0)
| file | time | idx | port | tcp flags | src mac | dst msc | ip checksum | tcp checksum in pcap | tcp checksum (truth) | tcp partial checksum (truth) |
| --- | ---- | --- | ---- | -------- | ------- | ------- | ----------- | ------------ | -------------- | -------------- |
| wsl.pcap | 0.000000 | 461 | 40941 -> 1 | [SYN] | Microsoft_xx:xx:12 | - | 0xc4f8 ✅ | 0xfe30 [Partial] | 0x76b8 | 0xfe30 |
| win.pcap | 0.000000 | 3210 | 40941 -> 1 | [SYN] | Microsoft_xx:xx:12 | 00:11:22:33:44:55 | 0xc4f8 ✅ | 0x76b8 ✅ | 0x76b8 | - |
| win.pcap | 0.000077 | 3211 | 1 -> 40941 | [RST, ACK]  | Microsoft_xx:xx:4c | Microsoft_xx:xx:12 | 0xbe8d ✅ | 0xfe1c [Partial] | 0x093d | 0xfe1c |
| wsl.pcap | 0.000273 | 462 | 1 -> 36005 ❌ | [RST, ACK] | Microsoft_xx:xx:4c | - | 0xbe8d ✅ | 0xfe1c [Partial] | 0x1c85 | 0xfe1c |
| wsl.pcap | 1.022610 | 476 | 40941 -> 1 | [SYN] | Microsoft_xx:xx:12 | - | 0xc4f7 ✅ | 0xfe30 [Partial] | 0x72b9 | 0xfe30 |
| win.pcap | 1.022637 | 3232 | 40941 -> 1 | [SYN] | Microsoft_xx:xx:12 | 00:11:22:33:44:55 | 0xc4f7 ✅ | 0x76b9 ✅ | 0x76b9 | - |
| win.pcap | 1.022704 | 3233 | 1 -> 40941| [RST, ACK]  | Microsoft_xx:xx:4c | Microsoft_xx:xx:12 | 0xbe62✅ | 0xfe1c [Partial] | 0x093d | 0xfe1c |
| wsl.pcap | 1.022878 | 477 | 1 -> 36048 ❌ | [RST, ACK]  | Microsoft_xx:xx:4c | - | 0xbe62✅ | 0xfe1c [Partial] | 0x1c5a | 0xfe1c |

**Comment by parasyte** [comment]
My use case that hits this bug: Any client/server app (in WSL) that depends on RST from a local service will have to wait for a timeout (approximately 135 seconds) before the service can be automatically started by the client. [`sccache`](https://github.com/mozilla/sccache) is an example application that does this.

On WSL2's mirrored network mode, I have a >2-minute wait before my first compile will begin. I can kill it and start the server manually. It's extremely annoying and frustrating.

I will switch back to NAT networking mode and use mirrored mode only when services in WSL need to be reachable outside of the Windows host. It's a manual workaround either way.

**Comment by sandro-elsweijer** [comment]
@keith-horton  My use case is this issue here, which links to this one.
https://github.com/microsoft/WSL/issues/11215

Parallel MPI applications are not usable with this networking mode.

**Comment by whittede** [comment]
@keith-horton any chance that the team could take a look at this again? 🥺👉👈 Do the details listed by people here help give an idea of the specific problems we are all facing?

**Comment by crondrift** [comment]
Maybe this helps?

https://github.com/microsoft/WSL/issues/14063#issuecomment-5652411603

This appears related to this issue, because both failures involve the
127.0.0.1 -> loopback0 -> table 127 relay path and result in TCP
connect timeouts. My case differs because the destination is a
confirmed listening Stubby DNS service inside the same WSL distro.
Replacing the route with a local lo route fixes it immediately.
