### ISSUE TITLE
WSL2 cannot telnet or netcat to 127.0.0.1

### ISSUE THREAD

**Issue by whittede** [microsoft/WSL#13327]
### Windows Version

Microsoft Windows [Version 10.0.26100.4652]

### WSL Version

2.5.9.0

### Are you using WSL 1 or WSL 2?

- [x] WSL 2
- [ ] WSL 1

### Kernel Version

6.6.87.2

### Distro Version

Ubuntu 24.04

### Other Software

Docker version 28.3.3, build 980b856 (in WSL2)
Also Docker Desktop 4.43.2 (199162) (in Windows)
(tried both)

### Repro Steps

My issue is that I am trying to run pieces of software that rely on checking for whether a socket is in use or available via a "connection refused" error. For example, if I use `telnet` or `netcat` on an empty port, I would expect it to respond with `Unable to connect to remote host: Connection refused` immediately. **Instead, attempting these commands on `localhost` or `127.0.0.1` result in an infinite "hang" that never resolves.**

---
I have spent a _long_ time trying to diagnose this. Here are the things I have investigated to dig out the root issue:

When I run `ip link` inside of my WSL2 environment, it returns:
```
1: lo: <LOOPBACK,UP,LOWER_UP> mtu 65536 qdisc noqueue state UNKNOWN mode DEFAULT group default qlen 1000
    link/loopback 00:00:00:00:00:00 brd 00:00:00:00:00:00
2: eth0: <BROADCAST,MULTICAST> mtu 1500 qdisc mq state DOWN mode DEFAULT group default qlen 1000
    link/ether 00:15:5d:d8:d6:7e brd ff:ff:ff:ff:ff:ff
3: loopback0: <BROADCAST,MULTICAST,UP,LOWER_UP> mtu 1500 qdisc mq state UP mode DEFAULT group default qlen 1000
    link/ether 00:15:5d:46:54:2a brd ff:ff:ff:ff:ff:ff
4: eth1: <BROADCAST,MULTICAST,UP,LOWER_UP> mtu 1500 qdisc mq state UP mode DEFAULT group default qlen 1000
    link/ether f8:54:f6:e5:21:f2 brd ff:ff:ff:ff:ff:ff
5: docker0: <NO-CARRIER,BROADCAST,MULTICAST,UP> mtu 1500 qdisc noqueue state DOWN mode DEFAULT group default
    link/ether 0a:8e:e1:79:d0:94 brd ff:ff:ff:ff:ff:ff
```

I am running an up to date WSL version 2.5.9 in Mirrored Mode (`networkingMode=mirrored`), and my `/etc/hosts/` file says:

```

# This file was automatically generated by WSL. To stop automatic generation of this file, add the following entry to /etc/wsl.conf:

# [network]

# generateHosts = false

127.0.0.1       localhost

127.0.1.1       E-TOP-2.localdomain     E-TOP-2



# The following lines are desirable for IPv6 capable hosts

::1     ip6-localhost ip6-loopback

fe00::0 ip6-localnet

ff00::0 ip6-mcastprefix

ff02::1 ip6-allnodes

ff02::2 ip6-allrouters

```

I have tried restarting WSL2 and my entire Windows machine after running `netsh winsock reset` and `netsh int ip reset all`. My Windows Defender firewall and all of my BitDefender Antivirus protection are completely off. I've tried opening up Docker Desktop and turning off Settings > Resources > WSL Integration. I've also tried looking for any `udev` files adding network rules but all I find is:
```
/etc/udev$ ls
hwdb.d  iocost.conf  rules.d  udev.conf
``` 

Localhost/127.0.0.1 ports that _do_ have things listening on them don't hang and successfully identify the running service immediately. Also, using `telnet`/`netcat` with IPv6 (`::1`) or using `127.0.0.53` instead of `127.0.0.1` both refuse a connection on empty ports just fine.

I am totally stumped at the root cause of me running `telnet 127.0.0.1 [any_empty_port_number]` and it hanging indefinitely. I don't even know what else to attempt or why it would behave weird.

### Expected Behavior

If I use `telnet` or `netcat` on an empty localhost or 127.0.0.1 port, I would expect it to respond with `Unable to connect to remote host: Connection refused` immediately.

### Actual Behavior

Attempting `telnet` or `netcat` on an empty port in `localhost` or `127.0.0.1`, result in an infinite "hang" that never resolves.

### Diagnostic Logs

If I use `tcpdump` while trying to empty port 7000 (for example) at 127.0.0.1 via netcat, I see:

```

sudo tcpdump -i any tcp port 7000

tcpdump: data link type LINUX_SLL2

tcpdump: verbose output suppressed, use -v[v]... for full protocol decode

listening on any, link-type LINUX_SLL2 (Linux cooked v2), snapshot length 262144 bytes

14:26:39.973709 loopback0 Out IP localhost.44813 > localhost.bbs: Flags [S], seq 910227121, win 64240, options [mss 1460,sackOK,TS val 4063495848 ecr 0,nop,wscale 7], length 0

14:26:39.974147 loopback0 In IP localhost.bbs > localhost.64619: Flags [R.], seq 0, ack 910227122, win 0, length 0

14:26:41.019265 loopback0 Out IP localhost.44813 > localhost.bbs: Flags [S], seq 910227121, win 64240, options [mss 1460,sackOK,TS val 4063496894 ecr 0,nop,wscale 7], length 0

14:26:41.019712 loopback0 In IP localhost.bbs > localhost.64619: Flags [R.], seq 0, ack 1, win 0, length 0

14:26:43.099268 loopback0 Out IP localhost.44813 > localhost.bbs: Flags [S], seq 910227121, win 64240, options [mss 1460,sackOK,TS val 4063498974 ecr 0,nop,wscale 7], length 0

14:26:43.099778 loopback0 In IP localhost.bbs > localhost.64619: Flags [R.], seq 0, ack 1, win 0, length 0

14:26:47.179349 loopback0 Out IP localhost.44813 > localhost.bbs: Flags [S], seq 910227121, win 64240, options [mss 1460,sackOK,TS val 4063503054 ecr 0,nop,wscale 7], length 0

14:26:47.179984 loopback0 In IP localhost.bbs > localhost.64619: Flags [R.], seq 0, ack 1, win 0, length 0

14:26:55.339347 loopback0 Out IP localhost.44813 > localhost.bbs: Flags [S], seq 910227121, win 64240, options [mss 1460,sackOK,TS val 4063511214 ecr 0,nop,wscale 7], length 0

14:26:55.339973 loopback0 In IP localhost.bbs > localhost.64619: Flags [R.], seq 0, ack 1, win 0, length 0

14:27:13.871473 loopback0 Out IP localhost.44813 > localhost.bbs: Flags [S], seq 910227121, win 64240, options [mss 1460,sackOK,TS val 4063527854 ecr 0,nop,wscale 7], length 0

14:27:13.871973 loopback0 In IP localhost.bbs > localhost.64619: Flags [R.], seq 0, ack 1, win 0, length 0

```

**Comment by whittede** [comment]
Logs included in the ticket.

**Comment by OneBlue** [comment]
@whittede: I'm going to guess that mirrored mode is what's causing this behavior. Could you check if you see the same issue in NAT mode ? 

@CatalinFetoiu: Do you know what could cause this ? Maybe localhost connect() from linux should be treated differently and return instantly ?

**Comment by whittede** [comment]
Wow, yep, removing the mirrored mode line in my `.wslconfig` worked! Suddenly it starts refusing connections fine.

That's weird, I'm pretty sure I've been running with `networkingMode=mirrored` for months and not having issues with telnet refusing connections on empty ports? I wonder why it suddenly stopped doing that?

**Comment by CatalinFetoiu** [comment]
thanks for the report and sharing the logs. from the tcpdump output this appears to be a duplicate of the following issue, as the RST is returned to the wrong port, making the netcat client to wait forever (if the RST was returned to the right port then the netcat client would exit). closing the issue as duplicate of the other one

https://github.com/microsoft/WSL/issues/10855

/dupe #10855
